author,title,annotation,img_url,book_url,genre
Анна Дрэйк,Герои на всю голову. Полный переворот,"Действие заклинания закончилось, и повелитель тьмы  медленно поднялся с колен. 

— Что, не подействовали ваши штучки? — злорадно прогремел он. — Мен...",https://rust.litnet.com/uploads/covers/120/1722373491_24.jpg,https://litnet.com/ru/book/sudba-solnechnogo-drakona-b516861,"Фэнтези, Эпическое фэнтези"
Sandra Hartly,Академия магии Эльфхай. Луна и Солнце: Притяжение.,"Кассандра де Форест достигла совершеннолетия и теперь ей предстоит выяснить, как выжить в академии магии, где учатся гордые эльфы. 
Она отправилась в Эльфхай, к сво...",https://rust.litnet.com/uploads/covers/120/1701793509_94.png,https://litnet.com/ru/book/sudba-solnechnogo-drakona-b516861,"Фэнтези, Эпическое фэнтези"
Наталисс,Ангел-хранитель для демона,"БЕСПЛАТНО!
— Теперь я не знаю, кто я. Изгой или хранитель для короля…
— А что бы ты предпочла?
— Ни то, ни другое.
— Это даже обидно. Неужели я такой плохой...",https://rust.litnet.com/uploads/covers/120/1747133503_92.jpeg,https://litnet.com/ru/book/sudba-solnechnogo-drakona-b516861,"Фэнтези, Эпическое фэнтези"
Котова Ирина,Королевская кровь-4. Связанные судьбы,"Первая книга серии бесплатно https://litnet.com/shrt/PmMq
Бывает, что исправлять ошибки богов приходится людям. Мир Туры ждут темные времена, но пока каждый занят своей судьбой...",https://rust.litnet.com/uploads/covers/120/1670147237_52.jpg,https://litnet.com/ru/book/sudba-solnechnogo-drakona-b516861,"Фэнтези, Эпическое фэнтези"
Наталья Белецкая,Эльфийский гамбит 2,"Войска Лирии продвигаются все ближе. Казалось бы, драконий артефакт может дать Бизарии преимущество, но у фанатиков есть ментальные маги, способные противостоять ...",https://rust.litnet.com/uploads/covers/120/1733322346_42.jpg,https://litnet.com/ru/book/sudba-solnechnogo-drakona-b516861,"Фэнтези, Эпическое фэнтези"
Ольга Ружникова ,Дочь лорда,"""Что остается, когда твой отец убит, мать и брат тебя предали, а король приговорил к смерти? Выжить. Выжить, выждать, научиться и отомстить"".
Как быть, если ты – один из...",https://rust.litnet.com/uploads/covers/120/1614877059_24.jpg,https://litnet.com/ru/book/sudba-solnechnogo-drakona-b516861,"Фэнтези, Эпическое фэнтези"
Tami’ss ,Избранная. Печать правды,"Я всегда мечтала лишь об одном ... Нет , это не любовь до гроба и не желание достать звезду с неба.
Все немного проще.
Я мечтала , хоть ненадолго , но увидеть мир вокру...",https://rust.litnet.com/uploads/covers/120/1747113142_39.png,https://litnet.com/ru/book/sudba-solnechnogo-drakona-b516861,"Фэнтези, Эпическое фэнтези"
Максимилиана Лэони,Головоломка Империи драконов: охота на магию,"📚 ПЕРВАЯ КНИГА РОМАНА 📚 ЦИКЛ ""МИР ЭРЛЛАДЭНА""
Я – тайнорождённая принцесса огромного королевства, скрытая от мира. И у меня жизненно-важная миссия – о...",https://rust.litnet.com/uploads/covers/120/1741207328_39.jpg,https://litnet.com/ru/book/sudba-solnechnogo-drakona-b516861,"Фэнтези, Эпическое фэнтези"
Алёна Цветкова,Старшая сестра его величества. Жизнь,"Еще вчера я была принцессой. Учила детей доброму и вечному. Сегодня я никто. Нищенка с наследным принцем на руках.
Но я должна выжить. Выжить, чтобы отомстить тому, к...",https://rust.litnet.com/uploads/covers/120/1634321527_33.png,https://litnet.com/ru/book/sudba-solnechnogo-drakona-b516861,"Фэнтези, Эпическое фэнтези"
Ульяна Соболева,Варвара. Последняя из Медведских,"Она проснулась в чужом мире, в теле женщины, которую все хотят уничтожить. В её венах – кровь проклятого рода, и вместе с ней пробуждается древний зверь. За ней иду...",https://rust.litnet.com/uploads/covers/120/1747937242_82.jpg,https://litnet.com/ru/book/sudba-solnechnogo-drakona-b516861,"Фэнтези, Эпическое фэнтези"
Анна Миолай,Перекрестки судеб,"Королева Иоленти правит Хортландом, но давно уже не принадлежит себе. Магия фэйри сковала ее разум, превратив в марионетку в ее же дворце, полном чужаков. Она вынужд...",https://rust.litnet.com/uploads/covers/120/1741076963_96.jpg,https://litnet.com/ru/book/sudba-solnechnogo-drakona-b516861,"Фэнтези, Эпическое фэнтези"
Ульяна Муратова,Опасная любовь командора,"Адель:
Я получила назначение на должность гарнизонной целительницы. Мой непосредственный руководитель — несносный, твердолобый маг, считающий меня необразован...",https://rust.litnet.com/uploads/covers/120/1727074662_35.jpg,https://litnet.com/ru/book/sudba-solnechnogo-drakona-b516861,"Фэнтези, Эпическое фэнтези"
Ульяна Муратова,Пять попыток вспомнить правду,"Я очнулась в незнакомом месте, не помня своего прошлого.
Пугающий чужак с пронзительно чёрными глазами заявляет, что он — мой жених, но я ему не верю.
Мне нужно люб...",https://rust.litnet.com/uploads/covers/120/1727035919_92.jpg,https://litnet.com/ru/book/sudba-solnechnogo-drakona-b516861,"Фэнтези, Эпическое фэнтези"
Ани Марика,Подарок судьбы,"Хотела исполнить мечту и соприкоснуться с таинственной и древней цивилизацией Майя. Мечта сбылась. Только последствия мне не понравились.
Я умерла, и худшее, что мо...",https://rust.litnet.com/uploads/covers/120/1716663161_53.jpg,https://litnet.com/ru/book/sudba-solnechnogo-drakona-b516861,"Фэнтези, Эпическое фэнтези"
Такаббир,Трон Знания. Книга 1,"Привычная жизнь престолонаследника Адэра Карро резко меняется после того, как великий отец назначает его правителем нищей колонии.
Кутежи и попойки остаются в про...",https://rust.litnet.com/uploads/covers/120/1712331103_85.jpg,https://litnet.com/ru/book/sudba-solnechnogo-drakona-b516861,"Фэнтези, Эпическое фэнтези"
Такаббир,Трон Знания. Книга 2,"Продолжение истории о престолонаследнике великой державы, которому отец подарил нищую колонию, желая разбудить в сыне правителя.

ЭПИЧЕСКОЕ ФЭНТЕЗИ.

Автор обложк...",https://rust.litnet.com/uploads/covers/120/1712363393_5.jpg,https://litnet.com/ru/book/sudba-solnechnogo-drakona-b516861,"Фэнтези, Эпическое фэнтези"
Жанна Лебедева,Сиреневый черный 1. Гнев единорога,"Что скрывается за красотой эльфов и свирепостью гоблинов? Где проходит черта между тьмой и светом? Какова цена бессмертия и стоит ли к нему стремиться...
Спасаясь о...",https://rust.litnet.com/uploads/covers/120/1723502000_33.jpg,https://litnet.com/ru/book/sudba-solnechnogo-drakona-b516861,"Фэнтези, Эпическое фэнтези"
Сана Мидзуно,Песнь павших пионов,"Она проснулась без имени — и без прошлого. Его клятвы были выжжены кровью, но сердце всё ещё помнило её голос. Между ними — древняя сила, способная разрушить гр...",https://rust.litnet.com/uploads/covers/120/1747208154_54.png,https://litnet.com/ru/book/pesn-pavshih-pionov-b526198,"Фэнтези, Эпическое фэнтези"
Luchistyia,На грани тьмы,"Мир, который вы знали, лишь малая часть великой тайны. Приготовьтесь к захватывающему путешествию вглубь магических земель, где тени сгущаются, а древние силы проб...",https://rust.litnet.com/uploads/covers/120/1745262421_99.png,https://litnet.com/ru/book/pesn-pavshih-pionov-b526198,"Фэнтези, Эпическое фэнтези"
Полина Шут,Хроники Теней: Кодекс Крови,"Эш Джеймс Апшер - простой охотник за нечестью, гитарист и просто славный парень. Каждый день он со своим наставником защищает Терру от тварей, порожденных Сопрежен...",https://rust.litnet.com/uploads/covers/120/1745016704_32.png,https://litnet.com/ru/book/pesn-pavshih-pionov-b526198,"Фэнтези, Эпическое фэнтези"
Oleg Alaiz,Абсолют,"Продолжение на Author Today
 В глубинах Сибири, на одном из засекреченных объектов, спрятана тюрьма сверхстрогого режима «Абсолют». О таком месте не расскаж...",https://rust.litnet.com/uploads/covers/120/1744992158_20.png,https://litnet.com/ru/book/pesn-pavshih-pionov-b526198,"Фэнтези, Эпическое фэнтези"
Daria Chernyshova,Мать матерей,"Есть тайна, известная только царице. Один колдовской амулет дает женщине власть над птицами и зверьми. Два амулета делают непобедимой. С тремя она способна подчиня...",https://rust.litnet.com/uploads/covers/120/1744989882_73.png,https://litnet.com/ru/book/pesn-pavshih-pionov-b526198,"Фэнтези, Эпическое фэнтези"
Натали Карамель,Хроники Лунного Клинка. Тени Бездны,"Мир Этерии на грани гибели. Трещина в древней печати, сдерживавшей богиню тьмы Моргаэль, растёт с каждым днём, а её тени уже вползают в реальность. Ночи становятся в...",https://rust.litnet.com/uploads/covers/120/1744874283_67.jpg,https://litnet.com/ru/book/pesn-pavshih-pionov-b526198,"Фэнтези, Эпическое фэнтези"
Ринат Ягудин,Орк по имени Мирный,"Мир будущего заселен эльфами, орками и гоблинами. Предки у них одни - мы, люди. Но почему-то одни потомки стали кровожадными последователями тьмы - ордой, а другие све...",https://rust.litnet.com/uploads/covers/120/1745763995_74.png,https://litnet.com/ru/book/pesn-pavshih-pionov-b526198,"Фэнтези, Эпическое фэнтези"
Алиса Атарова,Драконья жемчужина,"Небеса и Ад содрогнулись, когда на Владыку Диюя было совершено покушение, а самое главное, каким образом? С помощью корзины с даром, посланной верховным божество...",https://rust.litnet.com/uploads/covers/120/1744730719_47.png,https://litnet.com/ru/book/pesn-pavshih-pionov-b526198,"Фэнтези, Эпическое фэнтези"
Ивана Тесарич,Стена ветров,"После Великой катастрофы, когда человечество оказалось на грани вымирания, нашелся человек, Первый, который собрал людей на остатках флота  и привел их в безопасно...",https://rust.litnet.com/uploads/covers/120/1744719643_10.jpg,https://litnet.com/ru/book/pesn-pavshih-pionov-b526198,"Фэнтези, Эпическое фэнтези"
Никас Славич,Опасное всемогущество,"Рыбацкая деревушка заколдована. Море и реки покрыты льдом даже в середине весны. Подростки решаются схватиться с воителями богини Мицзу, чтобы снять проклятье. Но ...",https://rust.litnet.com/uploads/covers/120/1744708525_6.jpg,https://litnet.com/ru/book/pesn-pavshih-pionov-b526198,"Фэнтези, Эпическое фэнтези"
Мария  Куликова,Черная метка,"Аннотация 1
Магическое общество Большого Континента переживает непростые времена: внутренние противоречия разрывают политические течения, вовсю действует инкви...",https://rust.litnet.com/uploads/covers/120/1745505397_69.png,https://litnet.com/ru/book/pesn-pavshih-pionov-b526198,"Фэнтези, Эпическое фэнтези"
Ната,Песня проклятой души,"Когда все вокруг считают тебя угрозой, даже небо кажется чужим.

Аннета — приёмная дочь Защитника у самого края Бездны, в мире, где чужаков не прощают, а тьму прив...",https://rust.litnet.com/uploads/covers/120/1745592576_55.png,https://litnet.com/ru/book/pesn-pavshih-pionov-b526198,"Фэнтези, Эпическое фэнтези"
Ольга Венгерова,Вор Артефактов,"Кир, Ашур и Алиса узнают ужасную новость! Похоже, война между Королевствами Мечей и Динариев вот-вот примет неожиданный поворот. 

Неизвестный Вор похитил Артефакты...",https://rust.litnet.com/common/img/empty_cover_litnet.png,https://litnet.com/ru/book/pesn-pavshih-pionov-b526198,"Фэнтези, Эпическое фэнтези"
Clevincom,Шестая печать,"«Шестая печать» – мрачное фэнтези о вере, времени и выборе. Действие разворачивается на границе древнего Леса, где, потревоженные переменами, пробуждаются ...",https://rust.litnet.com/uploads/covers/120/1746294888_46.png,https://litnet.com/ru/book/pesn-pavshih-pionov-b526198,"Фэнтези, Эпическое фэнтези"
Наталья Карачинцева,Свет во тьме,"Мир всё больше погружается во тьму, вот и на севере в приморском городе Божевске тьма стала чувствовать себя вольготно. Только немногие жители города готовы выступ...",https://rust.litnet.com/uploads/covers/120/1744296805_68.jpg,https://litnet.com/ru/book/pesn-pavshih-pionov-b526198,"Фэнтези, Эпическое фэнтези"
Елизавета Заро,Гнев Марессы,"Русалка Маресса, наследница прибрежных вод Тишины и Печали, двенадцатая дочь Богини Воды Ковентины. При рождении была наделена магией шторма и грома.
Когда ей испо...",https://rust.litnet.com/uploads/covers/120/1744274287_24.jpg,https://litnet.com/ru/book/pesn-pavshih-pionov-b526198,"Фэнтези, Эпическое фэнтези"
Тата Мун,Боги Рухты,"Двенадцать лет назад в пламени восстания Злата потеряла всё — наставника, брата, дом. Она бежала, надеясь, что навсегда оставит прошлое позади. Но когда призраки то...",https://rust.litnet.com/uploads/covers/120/1744209863_53.png,https://litnet.com/ru/book/pesn-pavshih-pionov-b526198,"Фэнтези, Эпическое фэнтези"
Павел Янчяускас,"""Последний суд""","Между льдом Рая и пламенем Ада рождается третий путь.
Андрей, продавший душу , и Софья, исцеляющая мир ценой собственного покоя, — грешник и праведница, чьи судьбы п...",https://rust.litnet.com/uploads/covers/120/1744142232_49.jpg,https://litnet.com/ru/book/pesn-pavshih-pionov-b526198,"Фэнтези, Эпическое фэнтези"
Энди Багира,Костяной цветок. Империя,"Наследник, обещанный святой королеве Летеции наконец-то появляется на свет. Но это не могучий воин, способный раз и навсегда объединить земли, но маленькая девочка...",https://rust.litnet.com/uploads/covers/120/1744100906_52.png,https://litnet.com/ru/book/pesn-pavshih-pionov-b526198,"Фэнтези, Эпическое фэнтези"
Энди Багира,Ледяной цветок,"Северные земли. Древнейший оплот королей и районак. Здесь нет места слабости и милосердию. Здесь боги живут среди людей, а люди подобны богам. Семнадцать месяцев пр...",https://rust.litnet.com/uploads/covers/120/1744031294_99.png,https://litnet.com/ru/book/pesn-pavshih-pionov-b526198,"Фэнтези, Эпическое фэнтези"
Жанна Лебедева,Сиреневый черный 2. Хитросплетения тьмы,"Став ученицей некроманта, Таша отправляется в дорогу, полную опасностей и приключений. Она не ищет славы и могущества, ей нужно лишь одно - узнать секрет воскрешени...",https://rust.litnet.com/uploads/covers/120/1723501957_64.jpg,https://litnet.com/ru/book/sirenevyi-chernyi-2-xitrospleteniya-tmy-b208152,"Фэнтези, Эпическое фэнтези"
Ирина Тигиева,Власть неживых. Поймать вампира,"Я защищаю людей от чудовищ, хотя сама и не человек. И у меня есть тайна: я тоже спасаюсь от чудовища, преследующего меня чуть ли не с момента моего рождения. Мы никогд...",https://rust.litnet.com/uploads/covers/120/1749062572_85.png,https://litnet.com/ru/book/sirenevyi-chernyi-2-xitrospleteniya-tmy-b208152,"Фэнтези, Эпическое фэнтези"
Xiao Mint (Сяо Минт),Возвращение Мудрейшего,"Небесная-феникс Ван Синьхуа погибает в запретных землях гор Куньлунь, где под магической печатью похоронен Верховный Повелитель Трёх Миров. Феникса спасает неизв...",https://rust.litnet.com/uploads/covers/120/1736936657_91.jpg,https://litnet.com/ru/book/sirenevyi-chernyi-2-xitrospleteniya-tmy-b208152,"Фэнтези, Эпическое фэнтези"
Женя Сталберг,Зов предков. Истинная генерала,"ТРИЛОГИЯ ЗАВЕРШЕНА *(I том) БЕСПЛАТНО*(Есть Визуалы)
Бывает, твой путь выбран за тебя,
это не всегда понятно почему.
Души мертвых выбирают твою судьбу,
твоё будущее, пр...",https://rust.litnet.com/uploads/covers/120/1733638254_90.png,https://litnet.com/ru/book/sirenevyi-chernyi-2-xitrospleteniya-tmy-b208152,"Фэнтези, Эпическое фэнтези"
Елена Амеличева,Древняя душа,"ТРИ ТОМА В ОДНОЙ КНИГЕ! Три мира. Два времени. Космические полеты. Война драконов и демонов. Любовь. Ненависть. Душа, разделенная надвое. Кармическая петля. Непростой...",https://rust.litnet.com/uploads/covers/120/1640778723_12.png,https://litnet.com/ru/book/sirenevyi-chernyi-2-xitrospleteniya-tmy-b208152,"Фэнтези, Эпическое фэнтези"
Алёна Цветкова,Старшая сестра его величества. Богатство,"Я почти забыла, что была принцессой. Моя новая жизнь ничуть не хуже той, которую я потеряла. 
И тем труднее сделать следующий шаг. Отказаться от любви, от счастья, от ...",https://rust.litnet.com/uploads/covers/120/1637702330_12.png,https://litnet.com/ru/book/sirenevyi-chernyi-2-xitrospleteniya-tmy-b208152,"Фэнтези, Эпическое фэнтези"
Лена Бутусова,Говорящая с Пустотой,"❤БУМАЖНАЯ КНИГА❤
Самозванная королева драконов и незаконный наследник престола. Какие чувства могут связывать их: дружба, братская любовь или все-таки страсть? К...",https://rust.litnet.com/uploads/covers/120/1725650383_71.jpg,https://litnet.com/ru/book/sirenevyi-chernyi-2-xitrospleteniya-tmy-b208152,"Фэнтези, Эпическое фэнтези"
Михаил Липарк,Облик Огня. Том 1,"Сарвилл Кхолд — обычный юноша из бедного квартала. День за днём он заботится о матери и больной сестре, мечтая когда-нибудь сбежать со своими близкими в другую ст...",https://rust.litnet.com/uploads/covers/120/1633251667_20.jpg,https://litnet.com/ru/book/sirenevyi-chernyi-2-xitrospleteniya-tmy-b208152,"Фэнтези, Эпическое фэнтези"
Екатерина Кариди,Суженый (шанс для злодея),"Шесть Проводников отправились к границе миров за невестой. Пять лучших воинов и повелитель. Зачем? Неужто мало своих красавиц? Все просто и совсем не просто.
Далека...",https://rust.litnet.com/uploads/covers/120/1738477249_48.jpg,https://litnet.com/ru/book/sirenevyi-chernyi-2-xitrospleteniya-tmy-b208152,"Фэнтези, Эпическое фэнтези"
Татьяна Донская,Заклятие Вечного Лотоса,"Только что обретённый отец не пожалел меня и бросил на растерзание кровожадному демону Кровавого Пламени, для которого я всего лишь ключ к отмщению. Оказавшись меж...",https://rust.litnet.com/uploads/covers/120/1745695819_58.jpg,https://litnet.com/ru/book/sirenevyi-chernyi-2-xitrospleteniya-tmy-b208152,"Фэнтези, Эпическое фэнтези"
