author,title,annotation,img_url,book_url,genre
Ана Адари,Юг в объятьях Севера,"Авторский мир, харизматичные герои. Наемник, чудом избежавший виселицы. Наследник Великого Дома, которому титул явно не по плечу. Первый Меч империи, но всего лишь в...",https://rust.litnet.com/uploads/covers/120/1734941456_91.jpg,https://litnet.com/ru/book/starshaya-sestra-ego-velichestva-vlast-b396291,"Фэнтези, Эпическое фэнтези"
Ксения О,Алые ленты феникса,"Она — наивный дух, попавший на небеса в облике мальчишки, скрытая печатью. Запуталась в сетях первой любви к тому, кто никогда не полюбит ее в этом облике.
Он — с...",https://rust.litnet.com/uploads/covers/120/1730731706_20.png,https://litnet.com/ru/book/starshaya-sestra-ego-velichestva-vlast-b396291,"Фэнтези, Эпическое фэнтези"
Юлия Заморская,В когтях дракона 2,"Дракон летит, куда укажет ему сердце, и берёт всё, на что упадёт его царственный взор. Криста убеждается в этом, когда её нарекают невестой императора и расторгают п...",https://rust.litnet.com/uploads/covers/120/1737561913_9.jpg,https://litnet.com/ru/book/starshaya-sestra-ego-velichestva-vlast-b396291,"Фэнтези, Эпическое фэнтези"
Юлия Заморская,В когтях дракона,"Дракон летит, куда укажет ему сердце, и берёт всё, на что упадёт его царственный взор. Криста убеждается в этом, когда её нарекают невестой императора и расторгают п...",https://rust.litnet.com/uploads/covers/120/1737561866_52.jpg,https://litnet.com/ru/book/starshaya-sestra-ego-velichestva-vlast-b396291,"Фэнтези, Эпическое фэнтези"
Яна Мелевич,Бессердечный принц. Смута,"БЕСПЛАТНО В ПРОЦЕССЕ
Российская Империя на грани краха.
Террористы устрашают народ актами насилия, экономика в стагнации, а наследник престола рискует лишиться ко...",https://rust.litnet.com/uploads/covers/120/1723790625_45.jpg,https://litnet.com/ru/book/starshaya-sestra-ego-velichestva-vlast-b396291,"Фэнтези, Эпическое фэнтези"
Энни Вилкс,Сплетение сфер. Демон и целительница,"БЕСПЛАТНО.
После предательства близкого человека светлой целительнице Лаоре остается лишь исчезнуть. Но как убежать от того, кто найдет тебя везде?
Стараясь скрыт...",https://rust.litnet.com/uploads/covers/120/1744998195_31.jpg,https://litnet.com/ru/book/starshaya-sestra-ego-velichestva-vlast-b396291,"Фэнтези, Эпическое фэнтези"
Александра Олив,Личный психотерапевт для Эльфа,"Что делать гордому эльфийскому правителю, когда на его мир обрушивается неизвестное проклятие, угрожающее жизни его народа?

Время забыть гордость и обратиться к м...",https://rust.litnet.com/uploads/covers/120/1675275906_4.jpg,https://litnet.com/ru/book/starshaya-sestra-ego-velichestva-vlast-b396291,"Фэнтези, Эпическое фэнтези"
Екатерина Слави,Обрученная с вороном,«Трижды ты познаешь предательство. Трижды предашь сама. Но только один простит тебя. Только одного простишь ты» - такое пророчество получила Равена от старой гадал...,https://rust.litnet.com/uploads/covers/120/1715080751_91.jpg,https://litnet.com/ru/book/starshaya-sestra-ego-velichestva-vlast-b396291,"Фэнтези, Эпическое фэнтези"
Надежда Черпинская,Единственное желание. Книга 1,"Если бы Рыжая знала, чем закончится её прогулка в лес, она никогда...
Стоп, стоп, стоп! Вы просто ещё не знаете Настю Романову!
Она бы всё равно туда пошла. Пропустить т...",https://rust.litnet.com/uploads/covers/120/1656002281_90.jpg,https://litnet.com/ru/book/starshaya-sestra-ego-velichestva-vlast-b396291,"Фэнтези, Эпическое фэнтези"
Васильев Ярослав,Мир в огне,"Философы рассказывают, что мир похож на составляющие его стихии. Если в нём преобладает спокойная Земля, то мир застынет в неподвижности и неизменности. Если мир ме...",https://rust.litnet.com/uploads/covers/120/1665586221_54.jpg,https://litnet.com/ru/book/starshaya-sestra-ego-velichestva-vlast-b396291,"Фэнтези, Эпическое фэнтези"
Данта Игнис,Любовь с первого... дракона,"Вы верите в любовь с первого взгляда? Я об этом даже не задумывалась, когда она со мной случилась. Как гром среди ясного неба, как цунами, сбивающее с ног. Неожиданно. ...",https://rust.litnet.com/uploads/covers/120/1715542103_20.jpg,https://litnet.com/ru/book/starshaya-sestra-ego-velichestva-vlast-b396291,"Фэнтези, Эпическое фэнтези"
Ева Ночь,Вверх тормашками в наоборот-3,"Чтобы спасти Милу, отважный отряд отправляется в путь на Север, к Острову Магов. Через невероятные приключения, через испытания, обретение новых друзей и врагов, Да...",https://rust.litnet.com/uploads/covers/120/1741103045_80.jpg,https://litnet.com/ru/book/starshaya-sestra-ego-velichestva-vlast-b396291,"Фэнтези, Эпическое фэнтези"
Ева Ночь,Вверх тормашками в наоборот-2,"Продолжение истории про попаданку Дашку в необычный мир Зеосса. Чтобы спасти Милу, снять магическое заклятие,  Дашка и её друзья отправляются в дальний путь. Новые ...",https://rust.litnet.com/uploads/covers/120/1741102923_50.jpg,https://litnet.com/ru/book/starshaya-sestra-ego-velichestva-vlast-b396291,"Фэнтези, Эпическое фэнтези"
Ольга Грон,Квенты Винкроса 3. Игра по новым правилам,"Долг крови или собственное счастье? Выбор может оказаться слишком тяжелым. Стайген становится королем Арниана, чтобы защитить Винкрос от демона, проснувшегося в а...",https://rust.litnet.com/uploads/covers/120/1713662185_85.jpg,https://litnet.com/ru/book/starshaya-sestra-ego-velichestva-vlast-b396291,"Фэнтези, Эпическое фэнтези"
Татьяна Абалова,Тайны Свон (1 книга),"Служанка важного столичного вельможи случайно узнает тайну рождения наследника короля, после чего на нее обрушивается череда несчастий: похищение, рабство, униже...",https://rust.litnet.com/uploads/covers/120/1657297971_36.jpg,https://litnet.com/ru/book/starshaya-sestra-ego-velichestva-vlast-b396291,"Фэнтези, Эпическое фэнтези"
Екатерина Слави,Сердце Сапфира. Обрученная с вороном 2,«Трижды ты познаешь предательство. Трижды предашь сама. Но только один простит тебя. Только одного простишь ты» - такое пророчество получила Равена от старой гадал...,https://rust.litnet.com/uploads/covers/120/1715080778_81.jpg,https://litnet.com/ru/book/starshaya-sestra-ego-velichestva-vlast-b396291,"Фэнтези, Эпическое фэнтези"
Татьяна Абалова,Так сошлись звезды,"Неспокойно в Корр-У. Горят костры - негодует народ, отлавливая одаренных магией. Но не ведьмы вредят людям, какой-то неведомый враг возбуждает ненависть, бросая на н...",https://rust.litnet.com/uploads/covers/120/1622433038_73.jpg,https://litnet.com/ru/book/tak-soshlis-zvezdy-b120632,"Фэнтези, Эпическое фэнтези"
Тая Шуи,Тайна Избранной. Ч. 1: Проходная пешка,"БЕСПЛАТНО!

Мир волшебства полон опасностей, его будущее под угрозой. Однажды война уже разрушила магический источник, разорила священную землю и уничтожила ее Хра...",https://rust.litnet.com/uploads/covers/120/1746217407_69.jpg,https://litnet.com/ru/book/tak-soshlis-zvezdy-b120632,"Фэнтези, Эпическое фэнтези"
Тали Аксандрова,Ледяная Орхидея,"Кристиан, сын Главного мага, влюбляется в Дэю, простую девушку. Хотя надменный отец готовит ему брак с племянницей короля.
У Кристиана всего две страсти: Дэя и магия....",https://rust.litnet.com/uploads/covers/120/1737948138_43.png,https://litnet.com/ru/book/tak-soshlis-zvezdy-b120632,"Фэнтези, Эпическое фэнтези"
Лина Амато,Стань ее тенью,"Она – райская птица, что способна вернуть жизнь. Он – секретный агент, что может легко жизнь отнять. Она прямолинейна и импульсивна. Он хитер и расчетлив. Она ме...",https://rust.litnet.com/uploads/covers/120/1724446404_92.jpg,https://litnet.com/ru/book/tak-soshlis-zvezdy-b120632,"Фэнтези, Эпическое фэнтези"
Александра Король,Сокровище Чародея,"Потакая своей тайной мечте, меня создал один из самых сильнейших чародеев нарушая все запреты. 

Всем, что я успела познать за недолгое время, проведенное в споко...",https://rust.litnet.com/uploads/covers/120/1716515653_29.png,https://litnet.com/ru/book/tak-soshlis-zvezdy-b120632,"Фэнтези, Эпическое фэнтези"
Жанна Лебедева,Сиреневый черный 4. Дракон и пепел,"Долгожданная встреча близка, но мир никогда уже не будет прежним! И у каждого в этом мире свой путь: Таша встречается лицом к лицу со своим страхом, Фиро - со своим пр...",https://rust.litnet.com/uploads/covers/120/1723501854_43.jpg,https://litnet.com/ru/book/tak-soshlis-zvezdy-b120632,"Фэнтези, Эпическое фэнтези"
Надежда Черпинская,Ворон и радуга. Книга 4,"Однажды мать сказала ему, что любовь – это самое важное на свете, это настоящее счастье. 
Ради любви он прошёл через все испытания, ради любви он вернулся из Бездны. ...",https://rust.litnet.com/uploads/covers/120/1615352687_6.jpg,https://litnet.com/ru/book/tak-soshlis-zvezdy-b120632,"Фэнтези, Эпическое фэнтези"
Лана Волкова ,Кукловод судьбы,"В королевском дворце царит разврат, истинная власть в руках могущественного колдуна, придворные строят козни вокруг престола. Маленькая служанка угодила в водово...",https://rust.litnet.com/uploads/covers/120/1658304547_21.jpg,https://litnet.com/ru/book/tak-soshlis-zvezdy-b120632,"Фэнтези, Эпическое фэнтези"
Мия Флор,Каменная кровь 2,"Анна Калазиас прошла сквозь испытания Горнила Камня и стала оружием в руках Каменной Королевы, Теперь Анна вынуждена ступить на путь, где каждая ошибка стоит жизни...",https://rust.litnet.com/uploads/covers/120/1745879392_16.jpg,https://litnet.com/ru/book/tak-soshlis-zvezdy-b120632,"Фэнтези, Эпическое фэнтези"
Ульяна Муратова,Охота на Странника: Последняя месть,"Странник сумел отомстить: после детонации портала нашу команду раскидало по разным точкам в пространстве.
Нам нужно найти друг друга, но это не так просто, ведь для ...",https://rust.litnet.com/uploads/covers/120/1738586267_3.jpg,https://litnet.com/ru/book/tak-soshlis-zvezdy-b120632,"Фэнтези, Эпическое фэнтези"
Алёна Цветкова,Юродь. Дочь пекаря,"Все девицы только об одном и мечтают: как бы замуж быстрее выйти. И Абсей расстарался, жениха дочери такого нашел, чтоб ей в замужестве худо не пришлось. Приданое щед...",https://rust.litnet.com/uploads/covers/120/1735872025_90.jpg,https://litnet.com/ru/book/tak-soshlis-zvezdy-b120632,"Фэнтези, Эпическое фэнтези"
ЮЭл,"Злодейка поневоле. Предыстория цикла ""В плену у магии""",Задача хранительницы миров — защита живых. Мари не справилась. Теперь ей придется остановить самого сильного из когда-либо существовавших темных магов. Выбор не...,https://rust.litnet.com/uploads/covers/120/1732994487_65.jpg,https://litnet.com/ru/book/tak-soshlis-zvezdy-b120632,"Фэнтези, Эпическое фэнтези"
Катарина Елан,Охота на попаданку. Во власти огня,"Моя жизнь была совершенно обычной.  Семья, друзья, учёба. Всё как у большинства.  Но всё рухнуло в один миг,  когда  погибли мои родители. Душевная травма...",https://rust.litnet.com/uploads/covers/120/1731059135_39.jpg,https://litnet.com/ru/book/tak-soshlis-zvezdy-b120632,"Фэнтези, Эпическое фэнтези"
Энни Вилкс,Сплетение сфер. Я зажгу ради тебя солнце,"Лорд демонов Седаар идёт за ней, подчиняя себе народы.
И чем дальше Лаора бежит, тем менее уверена, что поступает верно.
Почему же тот, кто казался воплощением зла, кт...",https://rust.litnet.com/uploads/covers/120/1744997826_41.jpg,https://litnet.com/ru/book/tak-soshlis-zvezdy-b120632,"Фэнтези, Эпическое фэнтези"
Ольга Ружникова ,Дочь лорда-12. Кровавая Мачеха,"Когда возвращаются древние боги и всё яростнее шипит безумный Черный Змей, стоит забыть распри между людьми. Но не все правители способны это понять.
Смогут ли Эви...",https://rust.litnet.com/uploads/covers/120/1703698824_95.jpg,https://litnet.com/ru/book/tak-soshlis-zvezdy-b120632,"Фэнтези, Эпическое фэнтези"
Энни Вилкс,Лазурь и Пурпур. Месть или Любовь?,"Я – дочь герцога, теряющего земли, власть и рассудок. После смерти братьев отец насильно отсылает меня в дом моего будущего мужа, требуя повиновения. 
Мой жених...",https://rust.litnet.com/uploads/covers/120/1745005828_49.jpg,https://litnet.com/ru/book/tak-soshlis-zvezdy-b120632,"Фэнтези, Эпическое фэнтези"
Ольга Ружникова ,Дочь лорда-6. Ветер Странствий,"Черные Жрецы нарушили равновесие, и подзвездный мир пошатнулся. Сама Дева-Смерть переступила порог.
Кто-то не удержится в фаворе, а кто-то – на престоле. Кто-то не с...",https://rust.litnet.com/uploads/covers/120/1661444750_49.jpg,https://litnet.com/ru/book/tak-soshlis-zvezdy-b120632,"Фэнтези, Эпическое фэнтези"
Ольга Ружникова ,Дочь лорда-3. Путь гладиаторов,"Она родилась дочерью северного лорда Ирией Таррент. Но отец убит, брат стал предателем, приговор вынесен, меч наточен.
Она должна была сложить голову на плахе, но ре...",https://rust.litnet.com/uploads/covers/120/1659025915_81.jpg,https://litnet.com/ru/book/tak-soshlis-zvezdy-b120632,"Фэнтези, Эпическое фэнтези"
Ольга Ружникова ,Дочь лорда-2. Замок Тенмар,"Она родилась дочерью северного лорда Ирией Таррент. Но отец убит, брат стал предателем, приговор вынесен, меч наточен. В жертву приносят тех, кого не жаль, и не жаль о...",https://rust.litnet.com/uploads/covers/120/1658331867_68.jpg,https://litnet.com/ru/book/tak-soshlis-zvezdy-b120632,"Фэнтези, Эпическое фэнтези"
Олеля Баянъ,Грани безумия,"Едва я вошёл в покои принцессы, как стал свидетелем убийства моей подопечной, чью жизнь мне доверили охранять. ""... займёшь её место"", – эхом отозвались в воспоминани...",https://rust.litnet.com/uploads/covers/120/1683483084_76.jpg,https://litnet.com/ru/book/tak-soshlis-zvezdy-b120632,"Фэнтези, Эпическое фэнтези"
Адриана Вайс,✧ Попаданка. Спасти истинную ✧,"✨ УВЛЕКАТЕЛЬНАЯ ИСТОРИЯ✨
– Попалась, иномирная мерзавка? Теперь, тебе никто не поможет! – бьет по ушам пугающий трубный голос.
Изо всех сил зажмуриваюсь, вызы...",https://rust.litnet.com/uploads/covers/120/1735271531_3.png,https://litnet.com/ru/book/popadanka-spasti-istinnuyu-b479710,"Фэнтези, Эпическое фэнтези"
Такаббир,Трон Знания. Книга 4,"Продолжение истории о престолонаследнике великой державы, которому отец подарил нищую колонию, желая разбудить в сыне правителя.

...",https://rust.litnet.com/uploads/covers/120/1712344496_14.jpg,https://litnet.com/ru/book/popadanka-spasti-istinnuyu-b479710,"Фэнтези, Эпическое фэнтези"
Иванна Флокс,Искусство соблазнения: как приручить чудовище,"Моя жизнь разрушилась в одно мгновение. Порабощенное королевство, смерть и руины, что некогда были цветущим мирком надежды, – вот все, что осталось от моего до...",https://rust.litnet.com/uploads/covers/120/1725915639_75.jpg,https://litnet.com/ru/book/popadanka-spasti-istinnuyu-b479710,"Фэнтези, Эпическое фэнтези"
Котова Ирина,Королевская кровь-10. Стальные небеса,"Первая книга серии бесплатно https://litnet.com/shrt/PmCO
У меня необыкновенная семья. Одна моя сестра помогла пустыне превратиться в зеленую страну. Вторая вошла в легенды, ос...",https://rust.litnet.com/uploads/covers/120/1670240171_0.jpg,https://litnet.com/ru/book/popadanka-spasti-istinnuyu-b479710,"Фэнтези, Эпическое фэнтези"
Котова Ирина,Королевская кровь-2. Скрытое пламя,"Первая книга серии бесплатно https://litnet.com/shrt/PmPi
В Рудлоге вновь зреет заговор, и молодой королеве нужно быстро учиться и становиться жестче, а ее мужу – прилагать все...",https://rust.litnet.com/uploads/covers/120/1670159650_64.jpg,https://litnet.com/ru/book/popadanka-spasti-istinnuyu-b479710,"Фэнтези, Эпическое фэнтези"
Котова Ирина,Королевская кровь-3. Проклятый трон,"Первая книга серии бесплатно https://litnet.com/shrt/PMmW
Приближается день рождения её величества Василины, и в Рудлоге собираются отпраздновать его со всем размахом. Готови...",https://rust.litnet.com/uploads/covers/120/1670145860_19.jpg,https://litnet.com/ru/book/popadanka-spasti-istinnuyu-b479710,"Фэнтези, Эпическое фэнтези"
Котова Ирина,Королевская кровь-1. Сорванный венец,"Семь лет назад Рудлогом правила королева. Но ее оклеветали, назвали ведьмой, а после убили. И никто тогда не догадывался, что переворот приведёт к катастрофе. Изверж...",https://rust.litnet.com/uploads/covers/120/1661267284_18.jpg,https://litnet.com/ru/book/popadanka-spasti-istinnuyu-b479710,"Фэнтези, Эпическое фэнтези"
Ника Феликс,Хроники Тинакриуса. Рухнувшие небеса 2,"✨БЕСПЛАТНО! Прошло не так много времени после первой встречи всех главных героев, а они уже бесповоротно изменились. Их судьбы соединила чья-то безжалостная воля. ...",https://rust.litnet.com/uploads/covers/120/1747257733_49.jpg,https://litnet.com/ru/book/popadanka-spasti-istinnuyu-b479710,"Фэнтези, Эпическое фэнтези"
Котова Ирина,Королевская кровь-11. Чужие боги,"Читать первую книгу серии бесплатно https://litnet.com/shrt/Pnee
Иногда самое сложное перед бурей – это ожидание.
В двух мирах ждут открытия последних межмировых врат. Ждут бо...",https://rust.litnet.com/uploads/covers/120/1670257014_91.jpg,https://litnet.com/ru/book/popadanka-spasti-istinnuyu-b479710,"Фэнтези, Эпическое фэнтези"
Котова Ирина,Королевская кровь-6. Тёмное наследие,"Первая книга серии бесплатно  https://litnet.com/shrt/Pynl
Иногда жизнь ставит перед нелегким выбором, в котором оба решения - плохи.
Люку Дармонширу предстоит завершать рассл...",https://rust.litnet.com/uploads/covers/120/1670152973_3.jpg,https://litnet.com/ru/book/popadanka-spasti-istinnuyu-b479710,"Фэнтези, Эпическое фэнтези"
