author,title,annotation,img_url,book_url,genre
Андрей Погудин,Искры стали. Танец среди руин,"Глупость политиков чуть не погубила человечество, а после глобальной войны Землю настигает следующий катаклизм. Однако, вместо катастрофы он приносит спасение и н...",https://rust.litnet.com/uploads/covers/120/1737798406_28.jpg,https://litnet.com/ru/book/smertnik-iz-roda-valevskih-kniga-7-b513267,"Фантастика, РеалРПГ"
Василий Маханенко,Смертник из рода Валевских. Книга 10,"Всё, или ничего. Жизнь или смерть. Третьего варианта не существует. Ни древние, ни сторонние силы, ни сам Хаос не находит иного способа сохранить целостность мира, кр...",https://rust.litnet.com/uploads/covers/120/1737728247_96.jpg,https://litnet.com/ru/book/smertnik-iz-roda-valevskih-kniga-7-b513267,"Фантастика, РеалРПГ"
Василий Маханенко,Смертник из рода Валевских. Книга 9,"Иномирцы повержены. Каменоиды уничтожены. Казалось, в Кострищ должен прийти долгожданный мир, вот только слуги Хаоса так же считают. Они жаждут уничтожить возмутит...",https://rust.litnet.com/uploads/covers/120/1737727454_3.jpg,https://litnet.com/ru/book/smertnik-iz-roda-valevskih-kniga-7-b513267,"Фантастика, РеалРПГ"
Коварный Светляк,Книга 1. Танцующая с кинжалами (часть 1),"Мир бесконечного противостояния на арене Лиги. Здесь бесплотный дух, Ноксус, дарует бессмертие чемпионам ради их славы и величия. Только здесь можно умереть и возр...",https://rust.litnet.com/uploads/covers/120/1737012308_66.png,https://litnet.com/ru/book/smertnik-iz-roda-valevskih-kniga-7-b513267,"Фантастика, РеалРПГ"
"Эдуард Касаткин, Юлия Клыкова",Новая характеристика,"РАССКАЗ ЗАНЯЛ 2 МЕСТО НА ЛИТЕРАТУРНОМ КОНКУРСЕ ФЕСТИВАЛЯ ИГРОВОЙ ЛИТЕРАТУРЫ LVLCON’24. 

Узнать себя настоящего можно, лишь побыв в хорошей заварушке. Сергей Переплёт,...",https://rust.litnet.com/uploads/covers/120/1736171668_10.jpg,https://litnet.com/ru/book/smertnik-iz-roda-valevskih-kniga-7-b513267,"Фантастика, РеалРПГ"
Enzo Salvatore,"О, да, я знаю, как это работает!","Границы миров нарушены. На грани гибели своего существования, раса, считающая себя достойной жизни, начала планомерное истребление в других мирах, отнимая жизнь у ...",https://rust.litnet.com/uploads/covers/120/1735997128_94.png,https://litnet.com/ru/book/smertnik-iz-roda-valevskih-kniga-7-b513267,"Фантастика, РеалРПГ"
Вадим Фарг,Призванный герой 8 18+,"И вот я снова у ваших ног…
Ну, почти. Дерамонд неплохо так по мне прошёлся, отчего даже «Мёртвая вода» помогла не сразу.
Но этот ублюдок похитил моих близких, а за это...",https://rust.litnet.com/uploads/covers/120/1735064571_68.jpg,https://litnet.com/ru/book/smertnik-iz-roda-valevskih-kniga-7-b513267,"Фантастика, РеалРПГ"
Иннокентий Белов,Сантехник 3,"Наш герой освоился в новом мире, научился разговаривать, обзавелся неплохим общественным статусом воина в отставке и теперь собирается заняться прогрессорством.
...",https://rust.litnet.com/uploads/covers/120/1734349811_2.jpg,https://litnet.com/ru/book/smertnik-iz-roda-valevskih-kniga-7-b513267,"Фантастика, РеалРПГ"
"Георгий Кесов, Idegen",Шанс на выживание,Каждый день боевых действий — это риск для жизни. Младший офицер Дмитрий с позывным Гроза оказался в критической ситуации: в реальном мире его жизнь висит на волос...,https://rust.litnet.com/uploads/covers/120/1734280450_100.jpg,https://litnet.com/ru/book/smertnik-iz-roda-valevskih-kniga-7-b513267,"Фантастика, РеалРПГ"
Влад Кас,Новая жизнь. Ученик,"Инвалид с рождения, парень, чьи родители презирали его всю его никчемную жизнь, умирает по нелепой случайности. После смерти попадает, как казалось изначально, в ми...",https://rust.litnet.com/uploads/covers/120/1733512303_98.jpg,https://litnet.com/ru/book/smertnik-iz-roda-valevskih-kniga-7-b513267,"Фантастика, РеалРПГ"
Ткачев Сергей,На два мира 2,"Приключения Олега в двух мирах продолжаются! Получив возможность выполнить основную миссию игрового мира, он сразу же берется за дело. Пришло время основать собст...",https://rust.litnet.com/uploads/covers/120/1733501712_17.jpg,https://litnet.com/ru/book/smertnik-iz-roda-valevskih-kniga-7-b513267,"Фантастика, РеалРПГ"
Дендрея,Ключи жизни: Академия млечного пути,"Далёкое будущее, из-за перенаселения, ученые стали искать пути колонизации планет и спутников солнечной системы. Стали проводиться эксперименты по усовершенствов...",https://rust.litnet.com/uploads/covers/120/1733231993_82.png,https://litnet.com/ru/book/smertnik-iz-roda-valevskih-kniga-7-b513267,"Фантастика, РеалРПГ"
Кирилл Танковский,Капитан,"Пьянки до добра не доводят. Особенно пьянки с богами. Раньше я был преуспевающим астральным героем с огромным флотом в подчинении и безграничной личной силой, но ум...",https://rust.litnet.com/uploads/covers/120/1733165350_95.jpg,https://litnet.com/ru/book/smertnik-iz-roda-valevskih-kniga-7-b513267,"Фантастика, РеалРПГ"
Гришанин Дмитрий,Практикант. Книга 3,"""Практикант"" - роман Дмитрия Гришанина, третья книга одноименного цикла, жанр РеалРПГ, городское фэнтези.
Они здесь. Они рядом. Порой на расстоянии вытянутой руки. Н...",https://rust.litnet.com/uploads/covers/120/1732883940_93.jpg,https://litnet.com/ru/book/smertnik-iz-roda-valevskih-kniga-7-b513267,"Фантастика, РеалРПГ"
Юрий Кварц,Контракт - 3,"Зомби-апокалипсис, очень весело и интересно наблюдать за ним из экрана телевизора. Фильмы, игры, сериалы, в них герои страдают, терпят лишения в тщетных попытках выж...",https://rust.litnet.com/uploads/covers/120/1732869821_97.jpg,https://litnet.com/ru/book/smertnik-iz-roda-valevskih-kniga-7-b513267,"Фантастика, РеалРПГ"
