author,title,annotation,img_url,book_url,genre
Рэд Кэррот,Целестиал. Призрак,"(Книга 4, последняя в цикле)        Элементалисты никак не успокоятся. Чертовы зверушки катаются у Халльвеги в сумке из одного конца мира в другой бесконе...",https://rust.litnet.com/uploads/covers/120/1735637512_45.jpg,https://litnet.com/ru/book/void-tom-3-zahvachennyi-dom-b484383,"Фантастика, РеалРПГ"
Алевтина Онучка,Удача. Том 2.,"Продолжение приключений Генки Овода.

Генка Овод – молодой кубанский казак из старого реестрового рода, как и положено, по исполнении 16 лет отправился на службу. ...",https://rust.litnet.com/uploads/covers/120/1734513691_47.jpg,https://litnet.com/ru/book/void-tom-3-zahvachennyi-dom-b484383,"Фантастика, РеалРПГ"
Рэд Кэррот,Целестиал. Тайны элементалистов,"(Книга 3)        Жизнь авантюристки Халльвеги наконец-то вернулась в привычное русло. Больше никаких голосов в голове, жаждущих крови. Никаких целестиалов, с...",https://rust.litnet.com/uploads/covers/120/1734073635_42.jpg,https://litnet.com/ru/book/void-tom-3-zahvachennyi-dom-b484383,"Фантастика, РеалРПГ"
Андрей Ефремов,История Попаданца-1. Цифровой мир,"Что может быть круче, чем долгожданный отпуск? Наконец-то можно выбраться из душного мегаполиса и провести целый месяц в горах. Свежий воздух, компания единомышлен...",https://rust.litnet.com/uploads/covers/120/1748895944_69.jpg,https://litnet.com/ru/book/istoriya-popadanca-1-cifrovoi-mir-b533077,"Фантастика, РеалРПГ"
Вадим Фарг,Лекс,"Я не просто выживу — я верну своё имя, свою силу и свою славу. Пусть мои враги дрожат за стенами своей охраны. Пусть молятся, чтобы я не добрался до них.

Потому что я ...",https://rust.litnet.com/uploads/covers/120/1740753405_67.jpg,https://litnet.com/ru/book/istoriya-popadanca-1-cifrovoi-mir-b533077,"Фантастика, РеалРПГ"
Андрей Ефремов,Б.А.Г. Книга пятая,"Порой, жизнь выкидывает такие фортели, что предугадать их не могут даже умнейшие и опытнейшие люди. Сопряжённый мир оказался совсем не прост и подготовил Багу нема...",https://rust.litnet.com/uploads/covers/120/1741633418_63.jpg,https://litnet.com/ru/book/istoriya-popadanca-1-cifrovoi-mir-b533077,"Фантастика, РеалРПГ"
Алекс Кох,Паноптикум. Книга 6,"Третий этап эволюции совсем близок. Стоит пройти его как можно скорее, чтобы после сосредоточиться на задании, выданном Айрой. И хотя до сих пор не понятно, чем мне м...",https://rust.litnet.com/uploads/covers/120/1745413802_27.png,https://litnet.com/ru/book/istoriya-popadanca-1-cifrovoi-mir-b533077,"Фантастика, РеалРПГ"
Андрей Ефремов,Защитник-4. Война,"Клан «Защитники» вступил в войну с узурпировавшим власть Рас аль Гулом. Теперь будущее всей галактики зависит от того, сможет ли горстка бунтовщиков отстоять Земл...",https://rust.litnet.com/uploads/covers/120/1740255779_88.jpg,https://litnet.com/ru/book/istoriya-popadanca-1-cifrovoi-mir-b533077,"Фантастика, РеалРПГ"
Андрей Ефремов,Защитник-2. Академия,"Галактическое сообщество людей во главе с мудрым Асгардом и тысячами прекрасно обученными одарёнными, что стоят на страже и защищают людей от безжалостного параз...",https://rust.litnet.com/uploads/covers/120/1711486399_86.jpg,https://litnet.com/ru/book/istoriya-popadanca-1-cifrovoi-mir-b533077,"Фантастика, РеалРПГ"
Андрей Ефремов,Б.А.Г. Книга четвёртая,Враг сделал свой ход. Ткань мироздания истончена. Мир начал стремительно меняться. Перед молодым монархом Белоземья стоит множество задач и самая главная из них – ...,https://rust.litnet.com/uploads/covers/120/1736195816_54.jpg,https://litnet.com/ru/book/istoriya-popadanca-1-cifrovoi-mir-b533077,"Фантастика, РеалРПГ"
Андрей Ефремов,Защитник-1. Искра,"Бывают моменты, когда кажется, что жизнь пошла под откос, но стоит закрыться одной двери, как открывается новая. Ярослав посвятил свою жизнь спорту. Он годами оттачи...",https://rust.litnet.com/uploads/covers/120/1698180785_70.jpg,https://litnet.com/ru/book/istoriya-popadanca-1-cifrovoi-mir-b533077,"Фантастика, РеалРПГ"
Андрей Ефремов,Защитник-3. Изгои,"Как это обычно бывает, война в галактическом сообществе людей началась неожиданно. Ну как война, произошёл тихий переворот, и загадочный Рас аль Гул перехватил все ...",https://rust.litnet.com/uploads/covers/120/1723579773_9.jpg,https://litnet.com/ru/book/istoriya-popadanca-1-cifrovoi-mir-b533077,"Фантастика, РеалРПГ"
Владимир Комаров (Vladkom),Тактик 4.,"РеалРпг в новом таинственном мире. Остатки человечества возрождают свою цивилизацию буквально с нуля. С каменного века.
Здесь будут сражения под руководством ГГ с ...",https://rust.litnet.com/uploads/covers/120/1748685234_32.jpg,https://litnet.com/ru/book/istoriya-popadanca-1-cifrovoi-mir-b533077,"Фантастика, РеалРПГ"
Ткачев Сергей,На два мира 4,"Приключения Олега Журавлёва продолжаются! Новый мир! Новая миссия! На этот раз главный герой вынужден отправиться в мир, где всем заправляют технологии киберпанк...",https://rust.litnet.com/uploads/covers/120/1748008669_54.jpg,https://litnet.com/ru/book/istoriya-popadanca-1-cifrovoi-mir-b533077,"Фантастика, РеалРПГ"
Александр Зимовец,Чернолесье,"Этот континент обречен. Медленно, но неуклонно его поглощает Чернолесье: мрачная чаща, населенная нежитью, где даже листья деревьев черны и безжизненны.

Никто не р...",https://rust.litnet.com/uploads/covers/120/1719925129_66.jpg,https://litnet.com/ru/book/istoriya-popadanca-1-cifrovoi-mir-b533077,"Фантастика, РеалРПГ"
Влад Кас,Сингулярность 1.0,"Технологии... Магия... Боевые искусства... Что если объединить все это вместе? С какой скоростью человеческая цивилизация станет осваивать космос и другие звезды?
Мар...",https://rust.litnet.com/uploads/covers/120/1748096916_53.jpg,https://litnet.com/ru/book/istoriya-popadanca-1-cifrovoi-mir-b533077,"Фантастика, РеалРПГ"
Вадим Фарг,Излом 1.0,"Митин, в прошлом тихий неприметный городок, в настоящем дьявольская аномалия. Каждому дано туда попасть, но не каждому дарован шанс вернуться. Полигон, прозванный а...",https://rust.litnet.com/uploads/covers/120/1709196707_70.jpg,https://litnet.com/ru/book/istoriya-popadanca-1-cifrovoi-mir-b533077,"Фантастика, РеалРПГ"
Иннокентий Белов,Слесарь. Книга 1,"Наш современник попадает в мир, недавно переживший подобие ядерной зимы.
Он - обычный человек, без особых умений и рояли на него не выскакивают из кустов.
Работал ав...",https://rust.litnet.com/uploads/covers/120/1749494110_33.jpg,https://litnet.com/ru/book/istoriya-popadanca-1-cifrovoi-mir-b533077,"Фантастика, РеалРПГ"
Куропятник Максим,Игра миров. Книга 1.Подключение,"Прибывшие на Землю корабли инопланетян не только поставили точку в извечном вопросе: ""одни ли мы во вселенной?"", но и положили начало новой эпохи для цивилизаций Зем...",https://rust.litnet.com/uploads/covers/120/1656313351_8.jpg,https://litnet.com/ru/book/istoriya-popadanca-1-cifrovoi-mir-b533077,"Фантастика, РеалРПГ"
Елена Кароль,И пришла она... 1,"Ходила на работу, сдавала отчеты, платила ипотеку...
Но пришла в мир система и это всё больше не актуально.
Кто ты, Настя? Растерянная девушка, даже не знающая, что так...",https://rust.litnet.com/uploads/covers/120/1745137426_91.jpg,https://litnet.com/ru/book/istoriya-popadanca-1-cifrovoi-mir-b533077,"Фантастика, РеалРПГ"
Саймон Грэй,Ghrpg: Лукавый бог (т.2),"Говорят, боги любят играть. Преимущественно – людскими судьбами и жизнями. Даже площадку себе отдельную завели, Лудус называется. Площадка продвинутая, оборудован...",https://rust.litnet.com/uploads/covers/120/1735408557_58.jpg,https://litnet.com/ru/book/istoriya-popadanca-1-cifrovoi-mir-b533077,"Фантастика, РеалРПГ"
Алекс Бредвик,Войд. Том 6. Последние шаги,"Пешки давно разыграны, ферзи уже вышли на передовую, короли сидят и с напряжением наблюдают за тем, что происходит на передовой. Только это не шахматы, здесь не две с...",https://rust.litnet.com/uploads/covers/120/1719835380_56.jpg,https://litnet.com/ru/book/istoriya-popadanca-1-cifrovoi-mir-b533077,"Фантастика, РеалРПГ"
Владимир Комаров (Vladkom),Учитель,"Я - учитель.
Я учу жить. Я учу выживать. Если ты хочешь встретить старость - значит рано или поздно ты станешь моим учеником.
Я поделюсь своими знаниями и умениями. Я д...",https://rust.litnet.com/uploads/covers/120/1657012455_1.jpg,https://litnet.com/ru/book/istoriya-popadanca-1-cifrovoi-mir-b533077,"Фантастика, РеалРПГ"
Игорь Углов,"Ты проклят, Сумеречный!","Тёрёхин, хотя теперь уже Каспер Модар, снова попал!
На этот раз вышло всё относительно по плану...
Он кандидат в Сумеречные - касту шпионов Тёмной Империи. Пройдя небо...",https://rust.litnet.com/uploads/covers/120/1732710336_20.jpg,https://litnet.com/ru/book/ty-proklyat-sumerechnyi-b503948,"Фантастика, РеалРПГ"
Евсей Рылов,На задворках неба,"Рад приветствовать Вас в системе 78-11. У нас  на задворках неба смертельная скука, никогда ничего не происходит. 
А-а, так Вы про этот корабль? Он уже находился здесь, ...",https://rust.litnet.com/uploads/covers/120/1732427120_97.jpg,https://litnet.com/ru/book/ty-proklyat-sumerechnyi-b503948,"Фантастика, РеалРПГ"
Alexzander Shilin,Эрингард 2,"Алатар, получивший новую жизнь в мире Эрингарда, продолжает свой путь. Теперь, будучи студентом магической академии, он сталкивается с древними тайнами, сложными о...",https://rust.litnet.com/uploads/covers/120/1732185985_14.jpg,https://litnet.com/ru/book/ty-proklyat-sumerechnyi-b503948,"Фантастика, РеалРПГ"
Антон Т,Попадос. Месть героя. Том четвёртый,"Тихие и спокойные деньки незаметно пролетают, оставляя за собой лишь шелуху бытовых забот и груз бесценных знаний, приобретенных в чуждом и враждебном мире. Новые ...",https://rust.litnet.com/uploads/covers/120/1731869483_63.jpg,https://litnet.com/ru/book/ty-proklyat-sumerechnyi-b503948,"Фантастика, РеалРПГ"
Антон Т,Попадос. Месть героя. Том третий,"Григорий наконец закончил зачистку огромного подземелья «Город мёртвых», при этом не раз столкнувшись с костлявой, желавшей забрать его к себе. Но, не успел он выйт...",https://rust.litnet.com/uploads/covers/120/1731778623_45.jpg,https://litnet.com/ru/book/ty-proklyat-sumerechnyi-b503948,"Фантастика, РеалРПГ"
Антон Т,Попадос. Месть героя. Том второй,"Григорий понемногу обживается в новом мире, осваивает новые навыки, например, некромантию, находит себе напарницу, симпатичную рагарку, которую все считают демони...",https://rust.litnet.com/uploads/covers/120/1731693387_60.jpg,https://litnet.com/ru/book/ty-proklyat-sumerechnyi-b503948,"Фантастика, РеалРПГ"
Игорь Углов,Рыцарь 39-го уровня,"Абсолютно рандомная зарисовка на тему рыцаря дракона и принцессы в жанре реалРПГ.
...",https://rust.litnet.com/uploads/covers/120/1731601441_2.png,https://litnet.com/ru/book/ty-proklyat-sumerechnyi-b503948,"Фантастика, РеалРПГ"
Антон Т,Попадос. Месть героя,"Разобравшись с надоедливым принцем и пристроив свою подругу к отряду героя, которым, по странному стечению обстоятельств, оказывается их общий друг. Григорий може...",https://rust.litnet.com/uploads/covers/120/1731527267_91.jpg,https://litnet.com/ru/book/ty-proklyat-sumerechnyi-b503948,"Фантастика, РеалРПГ"
Антон Т,Попадос. Герой за компанию. Том третий,"Вот живёшь ты, никого не трогаешь, и даже наоборот, помогаешь. Спасаешь принцессу, защищаешь баронессу. Да и вообще ведёшь себя как хороший, добропорядочный человек....",https://rust.litnet.com/uploads/covers/120/1731059556_48.jpg,https://litnet.com/ru/book/ty-proklyat-sumerechnyi-b503948,"Фантастика, РеалРПГ"
Ли Сергей,Боевое безумие 3. Темный властелин,"На этот раз, чтобы решить свои проблемы, Рэд оправляется на нижние планы. Он оторван от дома и может полагаться только на свою смекалку и силу. Сможет ли он приспособ...",https://rust.litnet.com/uploads/covers/120/1730872682_32.jpg,https://litnet.com/ru/book/ty-proklyat-sumerechnyi-b503948,"Фантастика, РеалРПГ"
Поток Нейтрино,Симулятор судьбы — 2,В водовороте альтернативной Москвы Саня Воронцов балансирует между реальностью и захватывающими симуляциями. Примеряя роли от гения-бизнесмена до хладнокровног...,https://rust.litnet.com/uploads/covers/120/1730825592_64.jpeg,https://litnet.com/ru/book/ty-proklyat-sumerechnyi-b503948,"Фантастика, РеалРПГ"
Антон Т,Попадос. Герой за компанию. Том второй,"Попав в другой мир Гриша не растерялся и не опустил руки. Вместо этого он окунулся с головой в приключения, которые его поджидали в новом мире. Хотя с другой стороны,...",https://rust.litnet.com/uploads/covers/120/1730269526_10.jpg,https://litnet.com/ru/book/ty-proklyat-sumerechnyi-b503948,"Фантастика, РеалРПГ"
Николай Некрасов,Цифровой призрак 2. Доппельгангер,"Нельзя быть героем на полшишечки.
К этому простому я пришел, когда разобрался с врагами. Но теперь судьба подкинула новое испытание. Охотник на призраков следует п...",https://rust.litnet.com/uploads/covers/120/1730130796_38.jpg,https://litnet.com/ru/book/ty-proklyat-sumerechnyi-b503948,"Фантастика, РеалРПГ"
Николай Некрасов,Цифровой призрак,"Ехать ночью в багажнике в лес – дурная примета. Ехать ночью в катафалке в гробу на кладбище – тоже. Но так случается, когда охотники на призраков выходят на твой сле...",https://rust.litnet.com/uploads/covers/120/1730129630_69.jpg,https://litnet.com/ru/book/ty-proklyat-sumerechnyi-b503948,"Фантастика, РеалРПГ"
София Кагорова ,Барыш. Эра Пробужденных. Дар Избранного,"2056 год. Мир изменился. Наступила эра пробужденных. Бернард Лармар, восемнадцатилетний сирота, пробуждает дар, о котором никто никогда не слышал. Подсказки в его окн...",https://rust.litnet.com/uploads/covers/120/1727155772_12.png,https://litnet.com/ru/book/ty-proklyat-sumerechnyi-b503948,"Фантастика, РеалРПГ"
Вадим Фарг,Призванный Герой 7 18+,"Я вернулся, став более могущественным. И даже желание Легиона не в силах помешать моим планам. Да, чуть помотало по другим мирам, но я уже начинаю к этому привыкать. К...",https://rust.litnet.com/uploads/covers/120/1726829463_97.jpg,https://litnet.com/ru/book/ty-proklyat-sumerechnyi-b503948,"Фантастика, РеалРПГ"
Вадим Фарг,Призванный Герой 6 18+,"Война… война никогда не меняется (С).
Ну а почему бы и не взять столь знаменитую цитату?
Так вот, война, взаправду, приближается. Остроухие не будут сидеть, сложа руч...",https://rust.litnet.com/uploads/covers/120/1724928376_88.jpg,https://litnet.com/ru/book/ty-proklyat-sumerechnyi-b503948,"Фантастика, РеалРПГ"
Вадим Фарг,Призванный Герой 5 18+,"Пройден большой путь. Вот только его края так и не видно. Зато у меня есть артефакты, о которых мечтают многие в этом безумном, но приятном (вы же понимаете, о чём я?) м...",https://rust.litnet.com/uploads/covers/120/1724755412_20.jpg,https://litnet.com/ru/book/ty-proklyat-sumerechnyi-b503948,"Фантастика, РеалРПГ"
Вадим Фарг,Призванный Герой 4 18+,"Итак, друзья, подземелье с лабиринтами и нечистью пройдено. Получена отличная плюшка и несколько слуг (ох, блин, никак не могу спокойно думать об этом). Подруги спасе...",https://rust.litnet.com/uploads/covers/120/1724575506_62.jpg,https://litnet.com/ru/book/ty-proklyat-sumerechnyi-b503948,"Фантастика, РеалРПГ"
Вадим Фарг,Призванный Герой 3 18+,"Позади осталось немало приключений. Некоторые из них будут посещать меня в виде ночных кошмаров. Но другие… другие я буду вспоминать, закатив от удовольствия глаз...",https://rust.litnet.com/uploads/covers/120/1722067008_15.jpg,https://litnet.com/ru/book/ty-proklyat-sumerechnyi-b503948,"Фантастика, РеалРПГ"
Василий Маханенко,Смертник из рода Валевских. Книга 7,"Смерть — это ещё не конец. Максимилиан Валевский был убит, но благодаря рунной магии его вернули в реальность. Ещё не все враги уничтожены, ещё не все силы изгнаны и...",https://rust.litnet.com/uploads/covers/120/1737895706_91.jpg,https://litnet.com/ru/book/smertnik-iz-roda-valevskih-kniga-7-b513267,"Фантастика, РеалРПГ"
Василий Маханенко,Смертник из рода Валевских. Книга 5,"Турнир на звание лучшего мага империи. Что может пойти не так, когда просчитана каждая мелочь, а на сам турнир заявлены лучшие из лучших? Ответ очевиден - всё! И вновь...",https://rust.litnet.com/uploads/covers/120/1737893224_33.jpg,https://litnet.com/ru/book/smertnik-iz-roda-valevskih-kniga-7-b513267,"Фантастика, РеалРПГ"
Василий Маханенко,Смертник из рода Валевских. Книга 2,"Макс, в прошлом Максимилиан Валевский, начинает понимать, что такое быть тёмным в мире, где главенствует свет. Его используют, ненавидят, боятся, стараются убить при...",https://rust.litnet.com/uploads/covers/120/1737891986_93.jpg,https://litnet.com/ru/book/smertnik-iz-roda-valevskih-kniga-7-b513267,"Фантастика, РеалРПГ"
Василий Маханенко,Смертник из рода Валевских. Книга 4,"У Максимилиана появился шанс отомстить за свою семью — герцог Одоевский принял участие в заговоре против императора и, если всё сделать правильно, то Макс сможет у...",https://rust.litnet.com/uploads/covers/120/1737881521_65.jpg,https://litnet.com/ru/book/smertnik-iz-roda-valevskih-kniga-7-b513267,"Фантастика, РеалРПГ"
Василий Маханенко,Смертник из рода Валевских. Книга 3,"Тёмный смертник Макс, в прошлом барон Максимилиан Валевский, совершает героический поступок. Император лично желает наградить своего героя, но встреча с лидером и...",https://rust.litnet.com/uploads/covers/120/1737880292_97.jpg,https://litnet.com/ru/book/smertnik-iz-roda-valevskih-kniga-7-b513267,"Фантастика, РеалРПГ"
