author,title,annotation,img_url,book_url,genre
Коварный Светляк,Книга 3. Неизвестный чемпион (часть 1),"Мир бесконечного противостояния на арене Лиги. Здесь бесплотный дух, Ноксус, дарует бессмертие чемпионам ради их славы и величия. Только здесь можно умереть и возр...",https://rust.litnet.com/uploads/covers/120/1743499753_94.png,https://litnet.com/ru/book/pepelnyi-mir-tretii-uroven-chast-1-b529580,"Фантастика, РеалРПГ"
Гришанин Дмитрий,Миры Артёма Каменистого. S-T-I-K-S. Рихтовщик. Книга 10. Заветное желание,Рихтовщик вырвался из лабиринтов силы и повёл отряд дальше к намеченной цели. Замок Ордена Хранителей уже близко. Но открывающаяся на пороге исполнения задания та...,https://rust.litnet.com/uploads/covers/120/1743431766_56.jpg,https://litnet.com/ru/book/pepelnyi-mir-tretii-uroven-chast-1-b529580,"Фантастика, РеалРПГ"
Сергей Терехов,Имильхор. На перепутье,"Из грязи, в князи. Только тут все наоборот. Разрыв с компаньоном, попытка поднять бизнес, крах надежд и потеря всего, влияния, бизнеса, семьи, по итогу тюрьма. Казалос...",https://rust.litnet.com/uploads/covers/120/1744782652_17.jpg,https://litnet.com/ru/book/pepelnyi-mir-tretii-uroven-chast-1-b529580,"Фантастика, РеалРПГ"
Михаил Троян,Эпикхантер,"Оказавшись в этом новом и страшном мире, мне придётся в нём выживать. Но самое жуткое то, что этот мир совсем недавно был нашим.
...",https://rust.litnet.com/uploads/covers/120/1742890831_91.jpg,https://litnet.com/ru/book/pepelnyi-mir-tretii-uroven-chast-1-b529580,"Фантастика, РеалРПГ"
Ткачев Сергей,На два мира 3,"Задания Олега в мире постапокалипсиса становятся всё сложнее. От развития базы до сражения с чудовищными монстрами, неведомый кукловод совершенно не собирается е...",https://rust.litnet.com/uploads/covers/120/1741379752_25.jpg,https://litnet.com/ru/book/pepelnyi-mir-tretii-uroven-chast-1-b529580,"Фантастика, РеалРПГ"
Алевтина Онучка,Я украла бога смерти,"Айка – бедная девушка из приграничной деревушки, ради спасения своей жизни идёт на крайние меры и ""крадёт"" лучшего наёмника из гильдии ""золотой червонец&q...",https://rust.litnet.com/uploads/covers/120/1741358429_38.jpg,https://litnet.com/ru/book/pepelnyi-mir-tretii-uroven-chast-1-b529580,"Фантастика, РеалРПГ"
Кай Старцев,"Новые Горизонты ""Начало""","Удачная и размеренная жизнь Дмитрия Рихтера внезапно превращается в хаос, когда он получает загадочное сообщение: “Приветствуем, Дмитрий Рихтер! Мы знаем о вашем ...",https://rust.litnet.com/uploads/covers/120/1740249798_6.png,https://litnet.com/ru/book/pepelnyi-mir-tretii-uroven-chast-1-b529580,"Фантастика, РеалРПГ"
Дмитрий Швец,Мародёр. Часть 3,"Жизнь богов длинна, но не постоянна. Еще вчера миллионы падали ниц, лишь при одном упоминании, а сегодня их имена забыты, храмы разрушены, паства мертва. И новые поко...",https://rust.litnet.com/uploads/covers/120/1740104610_98.jpg,https://litnet.com/ru/book/pepelnyi-mir-tretii-uroven-chast-1-b529580,"Фантастика, РеалРПГ"
Коварный Светляк,Книга 2. Танцующая с кинжалами (часть 2),"Мир бесконечного противостояния на арене Лиги. Здесь бесплотный дух, Ноксус, дарует бессмертие чемпионам ради их славы и величия. Только здесь можно умереть и возр...",https://rust.litnet.com/uploads/covers/120/1739864036_60.png,https://litnet.com/ru/book/pepelnyi-mir-tretii-uroven-chast-1-b529580,"Фантастика, РеалРПГ"
Эрли Моури,Опасные игры с реальностью 1,"* Боярка. Попаданство в магический мир. ЛитРпг/РеалРпг.
Авантюрные приключения ГГ (попаданец), который со своей подругой в начале книги промышляют мелким разбоем и в...",https://rust.litnet.com/uploads/covers/120/1739773230_88.jpg,https://litnet.com/ru/book/pepelnyi-mir-tretii-uroven-chast-1-b529580,"Фантастика, РеалРПГ"
Олег Рыбаченко ,Сокровища космического пирата-2 Благородная ярость,"В погоне за убийцей, вполне реально пленить Гитлера! А что не верите! Читайте супербоевик: как самка вампир и следователь-попаданец надрали лыч фюреру!
...",https://rust.litnet.com/uploads/covers/120/1739646733_47.jpg,https://litnet.com/ru/book/pepelnyi-mir-tretii-uroven-chast-1-b529580,"Фантастика, РеалРПГ"
Василий Маханенко,Смертник из рода Валевских. Книга 8,"Аннотация

Кострищ — уникальный город-автономия, не подчиняющаяся ни одной империи. Ни светлой, ни тёмной. Город-страна, что объявлена свободной экономической зоно...",https://rust.litnet.com/uploads/covers/120/1737896273_56.jpg,https://litnet.com/ru/book/pepelnyi-mir-tretii-uroven-chast-1-b529580,"Фантастика, РеалРПГ"
Лаэндэл,Заханд. Начало,"В одночасье мир изменился. Подаренные возможности ломают прошлые законы и позволяют начать новую жизнь. Те, кто примет правила и не испугается трудностей смогут до...",https://rust.litnet.com/uploads/covers/120/1736607161_21.jpg,https://litnet.com/ru/book/zahand-nachalo-b510949,"Фантастика, РеалРПГ"
Алекс Кох,Паноптикум. Книга 1,"День не задался с самого начала. Сперва я очнулся с жуткой головной болью в абсолютно незнакомом месте. Затем, когда казалось, что выход уже совсем близко, меня едва ...",https://rust.litnet.com/uploads/covers/120/1724221267_26.png,https://litnet.com/ru/book/zahand-nachalo-b510949,"Фантастика, РеалРПГ"
Владимир Комаров (Vladkom),Тактик. Игра на выживание,"О чем эта книга:
РеалРпг в новом мире. Остатки человечества возрождают свою цивилизацию буквально с нуля. С каменного века.
Здесь будут сражения под руководством ГГ...",https://rust.litnet.com/uploads/covers/120/1705930449_29.jpg,https://litnet.com/ru/book/zahand-nachalo-b510949,"Фантастика, РеалРПГ"
Куропятник Максим,Игра миров 3. Столкновение сил,"Путешествие в другой мир привело к тому, что ученик стал столь силен, что оставил позади учителя. Неудачное задание привело к тому, что драгоценные ресурсы сменили ...",https://rust.litnet.com/uploads/covers/120/1715021092_73.png,https://litnet.com/ru/book/zahand-nachalo-b510949,"Фантастика, РеалРПГ"
Иннокентий Белов,Маг 7,"Ольгу все же приходится отправиться на Север, так как прежнее вмешательство приводит к тому, что в Астор ему никак не вернуться.

Теперь он изучает магию в одной из ...",https://rust.litnet.com/uploads/covers/120/1749713361_2.jpg,https://litnet.com/ru/book/zahand-nachalo-b510949,"Фантастика, РеалРПГ"
Иннокентий Белов,Сантехник 5,"Найдя своего брата по планете рождения, герой отправляет по его следам, чтобы стать еще сильнее и проверить своит догадки.
Теперь его ждут дальние дороги, странный ...",https://rust.litnet.com/uploads/covers/120/1745143903_99.jpg,https://litnet.com/ru/book/zahand-nachalo-b510949,"Фантастика, РеалРПГ"
Нани Кроноцкая,Последний шанс Гесса,"Космический круиз, три судьбы, один роковой поворот.
Смерть? Слишком банально. Безумие? Уже почти получилось. Любовь? Вот это по-настоящему страшно. В этой смертельн...",https://rust.litnet.com/uploads/covers/120/1743060517_30.jpg,https://litnet.com/ru/book/zahand-nachalo-b510949,"Фантастика, РеалРПГ"
Вадим Фарг,Лекс 2,"Спасти друга, найти Создателя, решить проблемы на МОЕЙ космической станции! Всё это необходимо делать быстро, но аккуратно. Никаких лишних движений, ведь каждый нев...",https://rust.litnet.com/uploads/covers/120/1742800086_44.jpg,https://litnet.com/ru/book/zahand-nachalo-b510949,"Фантастика, РеалРПГ"
Иннокентий Белов,Электрик Книга 2,"Герой с друзьями выиграли свою жизнь в противостоянии, только вынуждены бежать все время, чтобы ее не потерять.
Его новые способности здорово все облегчают, но и но...",https://rust.litnet.com/uploads/covers/120/1739344958_38.jpg,https://litnet.com/ru/book/zahand-nachalo-b510949,"Фантастика, РеалРПГ"
Алекс Кох,Паноптикум. Книга 2,"Мой родной мир сильно изменился. Все, кого я когда-либо знал, давно мертвы. Но самое главное - человечество выжило. Вот только люди, похоже, смирились с новой реальнос...",https://rust.litnet.com/uploads/covers/120/1728226488_29.png,https://litnet.com/ru/book/zahand-nachalo-b510949,"Фантастика, РеалРПГ"
Вадим Фарг,Система Возрождения. Лишний игрок,"Смерть ещё не конец. Слышали такую фразу? А мне пришлось столкнуться с этим фактом лицом к лицу. Стараясь спасти племянницу, погиб в аварии, но даже смерть не принесл...",https://rust.litnet.com/uploads/covers/120/1721544029_55.jpg,https://litnet.com/ru/book/zahand-nachalo-b510949,"Фантастика, РеалРПГ"
Ткачев Сергей,Шахматы богов 3 - Кингчесс,"В процессе подготовки к турниру, а так же во время главного состязания, наш герой узнает много новых тайн относительно устройства мира Атреи, системы богов и быта п...",https://rust.litnet.com/uploads/covers/120/1577215937_55.jpg,https://litnet.com/ru/book/zahand-nachalo-b510949,"Фантастика, РеалРПГ"
Игорь Тюрин,Во славу рода. Книга 1.,"Кто ты, читатель? Студент? Менеджер по продажам? Может какой-нибудь блогер? Попав из нашего изнеженного мира в мир, где всё решает личное мужество и доблесть, сила ду...",https://rust.litnet.com/uploads/covers/120/1747414911_59.png,https://litnet.com/ru/book/zahand-nachalo-b510949,"Фантастика, РеалРПГ"
Алевтина Онучка,Зануда.,"Дар обычный мальчишка из забытого богами городка на краю империи, которому не посчастливилось родиться во времена перемен. В те тяжёлые годы когда разорённая, п...",https://rust.litnet.com/uploads/covers/120/1741159639_28.png,https://litnet.com/ru/book/zahand-nachalo-b510949,"Фантастика, РеалРПГ"
Ткачев Сергей,На два мира,"Когда  воля, разум, стремление к жизни полностью сломлены, рождается новая личность. Личность, способная выжить в любом сессионном мире, куда его отправляет игра....",https://rust.litnet.com/uploads/covers/120/1733165934_41.jpg,https://litnet.com/ru/book/zahand-nachalo-b510949,"Фантастика, РеалРПГ"
Владимир Комаров (Vladkom),Наездник,Ну я и упал - на самое дно! Ниже некуда! Впереди мрак и безнадега. И только одно утешает меня - установленный адаптационо - симбиотический комплекс «Наездник».Это пер...,https://rust.litnet.com/uploads/covers/120/1654170349_45.jpg,https://litnet.com/ru/book/zahand-nachalo-b510949,"Фантастика, РеалРПГ"
Куропятник Максим,Игра миров 2. Расстановка сил,"Достигший своей цели, Дагаз присоединился к Древним, но в тоже время невольно создал напряженную обстановку в городе. Это заставляет его действовать более аккурат...",https://rust.litnet.com/uploads/covers/120/1658833290_49.jpg,https://litnet.com/ru/book/zahand-nachalo-b510949,"Фантастика, РеалРПГ"
Анна Ахрем ,Ноль,"ЧЕТВЕРТАЯ ЗАКЛЮЧИТЕЛЬНАЯ КНИГА ЦИКЛА ФАТУМ.
В моей голове как будто что-то щелкнуло. Ноги стали ватными и я, удивленный собственным бессилием, рухнул обратно на ла...",https://rust.litnet.com/uploads/covers/120/1678114381_90.jpg,https://litnet.com/ru/book/zahand-nachalo-b510949,"Фантастика, РеалРПГ"
Adek,Пора услышать голоса,"Голоса в голове Артёма — его спутники с детства. Они спорят, пугают, но без них он не представляет жизни. Экспериментальный нейроимплант превращает их в Систему «Эх...",https://rust.litnet.com/uploads/covers/120/1750171849_21.png,https://litnet.com/ru/book/zahand-nachalo-b510949,"Фантастика, РеалРПГ"
Рэд Кэррот,Арена для героев. Часть 2,"Этот мир был понятен и привычен ровно до того момента, как звездное небо пронзил яркий луч света. Вспышкой, похожей на невероятного размера фейерверк, Ксонус ознаме...",https://rust.litnet.com/uploads/covers/120/1749649659_60.jpg,https://litnet.com/ru/book/zahand-nachalo-b510949,"Фантастика, РеалРПГ"
Алекс Бредвик,Войд. Том 3. Захваченный дом,"Возвращение домой не всегда радостное. Дома не всегда тепло и уют. Всего восемь месяцев назад я улетал из уютного мирка, где каждый помогал каждому, а вернулся в оси...",https://rust.litnet.com/uploads/covers/120/1719834007_80.jpg,https://litnet.com/ru/book/void-tom-3-zahvachennyi-dom-b484383,"Фантастика, РеалРПГ"
Алекс Бредвик,Войд. Том 1. Начало,"Кланы и их владения, игра интриг и мелких войн. Все это мелочно, все это порочно. Я никогда не понимал, зачем все это, я всегда презирал главную ветвь. И было за что. Он...",https://rust.litnet.com/uploads/covers/120/1719833448_12.jpg,https://litnet.com/ru/book/void-tom-3-zahvachennyi-dom-b484383,"Фантастика, РеалРПГ"
Рокси Торн,Лисса. Закат последнего дня,"Что остается в конце пути? Ответы или новые вопросы? Выбор без выбора? Или выбор одного за миллионы? Не знаю, но свое решение я уже приняла.

 

P.S. Третья часть, фин...",https://rust.litnet.com/uploads/covers/120/1750152631_94.jpg,https://litnet.com/ru/book/void-tom-3-zahvachennyi-dom-b484383,"Фантастика, РеалРПГ"
Рокси Торн,Лисса. Новый рассвет,"Моя жизнь разделилась на ""до"" и ""после"". И нет, этим знаменательным событием не стал приход Системы. Мой мир рухнул раньше. Система спасла мне жизнь, дала ша...",https://rust.litnet.com/uploads/covers/120/1750079900_76.jpg,https://litnet.com/ru/book/void-tom-3-zahvachennyi-dom-b484383,"Фантастика, РеалРПГ"
"Александр Мануйлов, Ольга Мануйлова",Выбор моей реальности Том 2,"На протяжении шести месяцев Александр и его семнадцатилетний сын готовились к «эмиграции» в виртуальную реальность раннего средневековья, вместе с ними в 1070...",https://rust.litnet.com/uploads/covers/120/1717314737_56.jpg,https://litnet.com/ru/book/void-tom-3-zahvachennyi-dom-b484383,"Фантастика, РеалРПГ"
Андрей Ефремов,Симбиоз-2. Ген древних,"Симбиоз с инопланетной расой открывает массу возможностей, но, к сожалению, не делает человека бессмертным. У Игоря остался всего один шанс сохранить жизнь и разда...",https://rust.litnet.com/uploads/covers/120/1661626193_28.jpg,https://litnet.com/ru/book/void-tom-3-zahvachennyi-dom-b484383,"Фантастика, РеалРПГ"
Куропятник Максим,Игра миров 4.  Освоение сил,"Вернулся в родной мир и победил всех предателей? Красавчик! Но не стоило расслабляться, ведь дорога судьбы столь изменчива. И там где ты должен получить награду, фат...",https://rust.litnet.com/uploads/covers/120/1659207408_60.jpg,https://litnet.com/ru/book/void-tom-3-zahvachennyi-dom-b484383,"Фантастика, РеалРПГ"
Алекс Бредвик,Войд. Том 2. Новые возможности,"Три месяца суровой подготовки позади, впереди первая проба наших сил. Вроде простая миссия, месяц быть в составе караула и обеспечивать сохранность какого-то компл...",https://rust.litnet.com/uploads/covers/120/1749236014_94.jpg,https://litnet.com/ru/book/void-tom-3-zahvachennyi-dom-b484383,"Фантастика, РеалРПГ"
Вадим Фарг,Излом 2.0,"Крымский Излом – мир Меча и Магии. Новые игроки, новые опасности, новая жизнь.
Но куда забросило Нелли? И где её искать? Ведь нет ни единой зацепки.
И что, в конце кон...",https://rust.litnet.com/uploads/covers/120/1709215711_50.jpg,https://litnet.com/ru/book/void-tom-3-zahvachennyi-dom-b484383,"Фантастика, РеалРПГ"
Ткачев Сергей,Шахматы богов 4 - Лорд Хаоса,"Божественный турнир закончился и, казалось бы, для главного героя настало время наконец-то отдохнуть и заняться вплотную обустройством города, доставшегося ему в ...",https://rust.litnet.com/uploads/covers/120/1489677811_59.jpg,https://litnet.com/ru/book/void-tom-3-zahvachennyi-dom-b484383,"Фантастика, РеалРПГ"
Ткачев Сергей,Шахматы богов 5 - Экспансия,"Угроза уничтожения всего мира была предотвращена и в Атрее настали казалось бы мирные деньки. Боги облегченно вздохнув, занялись своими текущими делами в других м...",https://rust.litnet.com/uploads/covers/120/1498052494_83.jpg,https://litnet.com/ru/book/void-tom-3-zahvachennyi-dom-b484383,"Фантастика, РеалРПГ"
Игорь Тюрин,Во славу рода. Книга 2.,"Главный герой выжил в новом для себя мире и нашёл своё место. Он смог основать свой клан и стать князем, найти верных соратников и надёжных друзей. Но врагов от этого...",https://rust.litnet.com/uploads/covers/120/1747474244_64.png,https://litnet.com/ru/book/void-tom-3-zahvachennyi-dom-b484383,"Фантастика, РеалРПГ"
Рэд Кэррот,Арена для героев. Часть 1,"Этот мир был понятен и привычен ровно до того момента, как звездное небо пронзил яркий луч света. Вспышкой, похожей на невероятного размера фейерверк, Ксонус ознаме...",https://rust.litnet.com/uploads/covers/120/1746547229_83.jpg,https://litnet.com/ru/book/void-tom-3-zahvachennyi-dom-b484383,"Фантастика, РеалРПГ"
Ghost Writer,Вновь пережить 80 лет?,"Совсем недавно мне было 80 лет и я считал дни когда попрощаюсь с семьёй

 
...",https://rust.litnet.com/uploads/covers/120/1742785374_71.png,https://litnet.com/ru/book/void-tom-3-zahvachennyi-dom-b484383,"Фантастика, РеалРПГ"
Сергей,Андроген. Демиурги,"Завершение истории про Романа и его команду. Враги почуяв ценность того, что Роман получил подняли ставки. Теперь на кону не только жизнь, но и само существование вс...",https://rust.litnet.com/uploads/covers/120/1741521107_72.png,https://litnet.com/ru/book/void-tom-3-zahvachennyi-dom-b484383,"Фантастика, РеалРПГ"
Алекс Кох,Паноптикум. Книга 5,"Угроза родному миру больше не актуальна. А значит, пришла пора познакомиться и с другими мирами. Заодно можно заняться поисками информации о забытом виде. Интуиция ...",https://rust.litnet.com/uploads/covers/120/1741006116_70.png,https://litnet.com/ru/book/void-tom-3-zahvachennyi-dom-b484383,"Фантастика, РеалРПГ"
Лев Храбров,Один из ста,"""Один из ста"" - это захватывающая история о молодом маге, который случайно попадает в обитель древнего ордена ста, открывая перед собой невероятные приключения и во...",https://rust.litnet.com/uploads/covers/120/1737042513_81.png,https://litnet.com/ru/book/void-tom-3-zahvachennyi-dom-b484383,"Фантастика, РеалРПГ"
