author,title,annotation,img_url,book_url,genre
greenand,Умереть запрещается,Будущее может быть разным...,https://rust.litnet.com/common/img/empty_cover_litnet.png,https://litnet.com/ru/book/predki-i-potomki-b111620,"Фантастика, Юмористическая фантастика"
Alter Alba,Бета-ридер особого назначения,"Продолжение приключений бета-ридера Нео в виртуальном мире, и не только.
Начало здесь: https://litnet.com/shrt/Pe2s
ВАЖНО! Читателям, не знакомым с предыдущей книгой, настоятел...",https://rust.litnet.com/uploads/covers/120/1544083277_35.png,https://litnet.com/ru/book/predki-i-potomki-b111620,"Фантастика, Юмористическая фантастика"
Константин Погодаев,Эра правообладания,"Главный герой - историк по профессии - противостоит корпорации, которая доит любую творческую работу,  любого потребителя прекрасного, умного, вечного, ради достиже...",https://rust.litnet.com/uploads/covers/120/1543635739_55.png,https://litnet.com/ru/book/predki-i-potomki-b111620,"Фантастика, Юмористическая фантастика"
Валерий Проняев,Потомки великой цивилизации,"Цивилизация далёкого будущего, несмотря на совсем непригодные для жизни, с нашей точки зрения, условия,  отлично живёт и процветает. Лишь изредка, её особи задумыва...",https://rust.litnet.com/uploads/covers/120/1543577034_40.jpg,https://litnet.com/ru/book/predki-i-potomki-b111620,"Фантастика, Юмористическая фантастика"
Валерий Проняев,Муж на заказ,"Красавица Клара стояла перед сложным выбором. Годы идут, а мужа всё нет. Где найти настоящего спутника жизни?  ...",https://rust.litnet.com/uploads/covers/120/1543486768_40.jpg,https://litnet.com/ru/book/predki-i-potomki-b111620,"Фантастика, Юмористическая фантастика"
Валерий Проняев,Ностальгия Везунчика,"Это продолжение серии о Везунчике: “Везунчик”, “Везунчик на планете амазонок”, и этот рассказ”. Для понимания рекомендую читать с первой части. Ищите её на автор...",https://rust.litnet.com/uploads/covers/120/1543222885_11.jpg,https://litnet.com/ru/book/predki-i-potomki-b111620,"Фантастика, Юмористическая фантастика"
Надежда Ходаковская,Зеркальный друг,"Современные технологии уверенно входят в нашу жизнь. Хорошо это или плохо, покажет время. Рассказ об одинокой,но очень смешной девушке, которая увидев рекламу в инт...",https://rust.litnet.com/uploads/covers/120/1542704142_96.jpg,https://litnet.com/ru/book/predki-i-potomki-b111620,"Фантастика, Юмористическая фантастика"
Ирина Векка,"Любовь, Смерть и *****грам",Любовь и Смерть соревнуются...,https://rust.litnet.com/uploads/covers/120/1542478868_97.jpg,https://litnet.com/ru/book/predki-i-potomki-b111620,"Фантастика, Юмористическая фантастика"
Ирина Векка,Смерть и Дружок,Смерть и Любовь решают проблемы по-своему...,https://rust.litnet.com/uploads/covers/120/1542478081_74.jpg,https://litnet.com/ru/book/predki-i-potomki-b111620,"Фантастика, Юмористическая фантастика"
Андрей Буторин,"Там, где не верят в чудо","История о новом деле сыщика Брока, который не верит в чудеса. На этот раз ему очень трудно в них не поверить, ведь расследование заносит его с помощницей – дочкой Са...",https://rust.litnet.com/uploads/covers/120/1542443504_24.jpg,https://litnet.com/ru/book/predki-i-potomki-b111620,"Фантастика, Юмористическая фантастика"
Валерий Проняев,Хэллоуин,"Сам Джим и его жена Сара не могли распознать в этом экзотическом каламбуре где Смиты, а где Джефферсоны. Все “черти” на одно лицо!
Появление “трёх инопланетян” ни...",https://rust.litnet.com/uploads/covers/120/1542183122_5.jpg,https://litnet.com/ru/book/predki-i-potomki-b111620,"Фантастика, Юмористическая фантастика"
Андрей Буторин,Старый боцман,Старый отставной боцман получает поистине удивительное письмо от пропавшего внука....,https://rust.litnet.com/uploads/covers/120/1541924400_8.jpg,https://litnet.com/ru/book/predki-i-potomki-b111620,"Фантастика, Юмористическая фантастика"
Валерий Проняев,Шерлок Холмс против инопланетян. Глава 4,Финал этой истории оказался неожиданным......,https://rust.litnet.com/uploads/covers/120/1541795249_38.jpg,https://litnet.com/ru/book/predki-i-potomki-b111620,"Фантастика, Юмористическая фантастика"
Валерий Проняев,Шерлок Холмс против инопланетян. Глава 3,Детективы напали на след преступников......,https://rust.litnet.com/uploads/covers/120/1541784322_56.jpg,https://litnet.com/ru/book/predki-i-potomki-b111620,"Фантастика, Юмористическая фантастика"
Валерий Проняев,Шерлок Холмс против инопланетян. Глава 2,Детективы пошли по следу......,https://rust.litnet.com/uploads/covers/120/1541621997_11.jpg,https://litnet.com/ru/book/predki-i-potomki-b111620,"Фантастика, Юмористическая фантастика"
Валерий Проняев,Кураторы,"Элл уже владел всей информацией и готовился отправить файл администратору станции Билонгу. Сменив цвет на официально-чёрный, он даже приподнял своё тело и завис на...",https://rust.litnet.com/uploads/covers/120/1560872410_84.jpg,https://litnet.com/ru/book/kuratory-b149905,"Фантастика, Юмористическая фантастика"
Forsaken,Возвращение Карла Великого,"Карл Бергман умер и попал неизвестно куда. Теперь у него есть возможность вернуться в прошлое, чтобы исправить ошибки молодости и достичь успехов, о которых он не м...",https://rust.litnet.com/uploads/covers/120/1560792925_8.jpg,https://litnet.com/ru/book/kuratory-b149905,"Фантастика, Юмористическая фантастика"
Евгений Марков,Договор подряда,"Кто бы мог подумать, что люди вовсе не хозяева своей планете, а ведь до недавнего времени все было иначе....",https://rust.litnet.com/common/img/empty_cover_litnet.png,https://litnet.com/ru/book/kuratory-b149905,"Фантастика, Юмористическая фантастика"
Алексей Евтушенко,Челобитная,"Чиновнику Трентиньянову придётся через многое пройти, прежде чем решить проблему, которую его предшественники не могли решить веками....",https://rust.litnet.com/uploads/covers/120/1560524733_89.jpg,https://litnet.com/ru/book/kuratory-b149905,"Фантастика, Юмористическая фантастика"
Александр Уваров,Убить Буку,"На далёкой планете, в затерянном мире есть один древний обычай: детей отправляют в лес, чтобы они выследили и убили страшного Буку. Иначе им не стать взрослыми......",https://rust.litnet.com/uploads/covers/120/1560429804_19.png,https://litnet.com/ru/book/kuratory-b149905,"Фантастика, Юмористическая фантастика"
Адский лаборант,Востребованная специальность,У главного транспортника отдаленной колонии сломался гиперскоростной трансгалактический двигатель...,https://rust.litnet.com/uploads/covers/120/1560238326_88.jpg,https://litnet.com/ru/book/kuratory-b149905,"Фантастика, Юмористическая фантастика"
Евгений Марков,Неудачное вложение,"Хорошо, когда ты — бизнес-ангел и имеешь достаточно средств, чтобы  вкладывать их в науку и быть винтиком в двигателе прогресса человечества. И хорошо бы, чтобы с тв...",https://rust.litnet.com/common/img/empty_cover_litnet.png,https://litnet.com/ru/book/kuratory-b149905,"Фантастика, Юмористическая фантастика"
Степан Кайманов,Демон Креатива,"Город Теней — место, где в тугой клубок сплелись магия и наука.  Где по улицам бродят оборотни, горгульи и призраки. Где так много загадок и тайн, что раскрыть их все ...",https://rust.litnet.com/uploads/covers/120/1597311253_50.jpg,https://litnet.com/ru/book/kuratory-b149905,"Фантастика, Юмористическая фантастика"
"Kaira Vlna, Literary Yandere",Принцесса в скафандре,"Много десятков лет назад императорская семья погибла. Вокруг произошедшего до сих пор вьются домыслы один другого фантастичнее. Прошло много лет, и вот Конклав Сор...",https://rust.litnet.com/uploads/covers/120/1559233381_15.jpg,https://litnet.com/ru/book/kuratory-b149905,"Фантастика, Юмористическая фантастика"
Евгений Марков,Во имя дружбы,Первое в истории человечества путешествие во времени идет не по плану и оборачивается невероятной встречей....,https://rust.litnet.com/common/img/empty_cover_litnet.png,https://litnet.com/ru/book/kuratory-b149905,"Фантастика, Юмористическая фантастика"
Валерий Проняев,Продавец гаджетов,"До поступления в салон сотовой связи Александр считал должность продавца-консультанта пределом своих мечтаний. Казалось, что он «попал в струю». Даже находиться в ...",https://rust.litnet.com/uploads/covers/120/1557953312_4.jpg,https://litnet.com/ru/book/kuratory-b149905,"Фантастика, Юмористическая фантастика"
Никита Густомесов,Её тело,Уподобление Шишкову и грязная ирония утонули в графомании! ...,https://rust.litnet.com/uploads/covers/120/1557652759_21.jpg,https://litnet.com/ru/book/kuratory-b149905,"Фантастика, Юмористическая фантастика"
Владимир Кривонос,Сапиенс,Это небольшой ироничный рассказ о возможной эволюции человека. Прошу отнестись с пониманием....,https://rust.litnet.com/uploads/covers/120/1557747916_74.jpg,https://litnet.com/ru/book/kuratory-b149905,"Фантастика, Юмористическая фантастика"
Пьер Бильчински,Faceless,"Про котов, свиней и трансцендентность нексуса. Густая эссенция реальных историй и махрового безумия. Пробитая блендером. Немного прогретая и поданная в аккуратнен...",https://rust.litnet.com/uploads/covers/120/1591080222_68.jpg,https://litnet.com/ru/book/kuratory-b149905,"Фантастика, Юмористическая фантастика"
Alter Alba,"Бета-ридер. ""Возлюби конкурента своего...""","Завершающая часть трилогии ""Бета-ридер"". Рекомендуется читать книги по порядку.
Начало: https://litnet.com/shrt/Purm
Продолжение: https://litnet.com/shrt/Putm...",https://rust.litnet.com/uploads/covers/120/1557462748_61.png,https://litnet.com/ru/book/kuratory-b149905,"Фантастика, Юмористическая фантастика"
Адский лаборант,Швабра Дьявола,"Внезапная смерть не позволила мне искупить свои грехи и встать на путь исправления, я неумолимо приближаюсь к аду. Посмотрим получится ли у меня договориться с Дья...",https://rust.litnet.com/uploads/covers/120/1557328184_37.jpg,https://litnet.com/ru/book/kuratory-b149905,"Фантастика, Юмористическая фантастика"
Валерий Проняев,Оракул с Мкс,"Первый в истории освоения космоса артист юмористического жанра выступил, как турист и рекламный агент крупного холдинга. Он и представить себе не мог, что бывает н...",https://rust.litnet.com/uploads/covers/120/1557257306_63.jpg,https://litnet.com/ru/book/kuratory-b149905,"Фантастика, Юмористическая фантастика"
Iolka Eson,Небо без лун - 2 Город Теней,"Вторая книга из серии Небо без Лун. Пишется на конкурс по миру игры Hidden City издателя G5 interactive. 

Над ничего не подозревающей главной героиней, а по совместительству и ...",https://rust.litnet.com/uploads/covers/120/1557046677_68.jpg,https://litnet.com/ru/book/kuratory-b149905,"Фантастика, Юмористическая фантастика"
Йен Странник,Сервер,"Люди больше не умирают, а переходят из биологической стадии в цифровую. Сколько цифровых сущностей готовы поддерживать все серверные станции Земли? К чему приведё...",https://rust.litnet.com/uploads/covers/120/1556875867_42.jpg,https://litnet.com/ru/book/kuratory-b149905,"Фантастика, Юмористическая фантастика"
Евгений Марков,"Да здравствует ""Центавр""!","Дома вокруг нас строятся каждый день, но иногда это не простой дом с не простыми жильцами....",https://rust.litnet.com/common/img/empty_cover_litnet.png,https://litnet.com/ru/book/kuratory-b149905,"Фантастика, Юмористическая фантастика"
Олег Рыбаченко ,Геном Варвары-красы и Крымская война,Профессор и  Таша создают квазиоружие и пытаются изменить ход истории в проигранной Россией Крымской войне.  Неожиданно им приходит на подмогу сам Олег Рыбаченко. ...,https://rust.litnet.com/uploads/covers/120/1555401101_22.jpg,https://litnet.com/ru/book/genom-varvary-krasy-i-krymskaya-voina-b135259,"Фантастика, Юмористическая фантастика"
Алёна Барнашова ,Эрфикс,"Драконы, замки, рыцари - сказки? Нет, это будущее....",https://rust.litnet.com/uploads/covers/120/1554830541_75.jpg,https://litnet.com/ru/book/genom-varvary-krasy-i-krymskaya-voina-b135259,"Фантастика, Юмористическая фантастика"
Алёна Барнашова ,В поисках разума на Земле,"В поисках разума на Земле
И тревожит меня мысль
Не один среди звезд я живу
Визит этот будет вечен
Встреча братьев по уму 

 (Мумий Тролль - Инопланетный гость)

Ка...",https://rust.litnet.com/uploads/covers/120/1554830092_41.jpg,https://litnet.com/ru/book/genom-varvary-krasy-i-krymskaya-voina-b135259,"Фантастика, Юмористическая фантастика"
Михаил Леккор,Антон всемогущий,. Антон Иванов – наш современник из города Москвы. Обычный человек из общего ряда россиян. Но внезапно остановится могущественным и сильным магом и ему все станови...,https://rust.litnet.com/common/img/empty_cover_litnet.png,https://litnet.com/ru/book/genom-varvary-krasy-i-krymskaya-voina-b135259,"Фантастика, Юмористическая фантастика"
Добрыня Зарубай,Беседа со студентом из галактического союза.,Разговор двух разных лиц. ...,https://rust.litnet.com/uploads/covers/120/1559342401_12.jpg,https://litnet.com/ru/book/genom-varvary-krasy-i-krymskaya-voina-b135259,"Фантастика, Юмористическая фантастика"
Валерий Проняев,Фрагмент,"Оглянувшись назад, оба поняли, что выбора нет. Лучше погибнуть, разбившись о скалы, чем быть растерзанными кровожадными агрессорами с чёрной планеты Чакча. Эти суще...",https://rust.litnet.com/uploads/covers/120/1553203054_4.jpg,https://litnet.com/ru/book/genom-varvary-krasy-i-krymskaya-voina-b135259,"Фантастика, Юмористическая фантастика"
Грац Анатольев,Т-150,"Т-150, или мой новый знакомый, называйте, как хотите, приподнял рукав кофты. На его запястье красовалось число — 100. Если рассуждать логически, то при рождении у него д...",https://rust.litnet.com/uploads/covers/120/1552672000_24.jpg,https://litnet.com/ru/book/genom-varvary-krasy-i-krymskaya-voina-b135259,"Фантастика, Юмористическая фантастика"
Taisia Ganina,Сценарий. Дочку замуж выдать - ни пирог испечь,"Это сценарий для спектакля. Сам спектакль уже был поставлен и имел большой успех. Текст в стихотворной форме. Ниже прилагается видео с премьеры.
Что делать, если ца...",https://rust.litnet.com/uploads/covers/120/1552067153_28.jpg,https://litnet.com/ru/book/genom-varvary-krasy-i-krymskaya-voina-b135259,"Фантастика, Юмористическая фантастика"
Валерий Проняев,Точка отсчета,"Учёные почти признали, что палеоконтакты нашей цивилизации с ""богами"" были. Это очередное явление ""богов"" тоже попало в аналы истории человечества. ...",https://rust.litnet.com/uploads/covers/120/1551633441_16.jpg,https://litnet.com/ru/book/genom-varvary-krasy-i-krymskaya-voina-b135259,"Фантастика, Юмористическая фантастика"
Вадим Векслер,Как создать шедевр,"Шедевр – это капля предрассветной росы на молодой травинке в поле вечности, и в этом поле каждая травинка ценна, каждая способна преобразить маленьким чудом суров...",https://rust.litnet.com/common/img/empty_cover_litnet.png,https://litnet.com/ru/book/genom-varvary-krasy-i-krymskaya-voina-b135259,"Фантастика, Юмористическая фантастика"
Яра Рута,Рекурсия кирпича,"—  Их род очень древний. Но не всем удалось прожить долгую жизнь. — Торвик печально вздохнул. — Знаешь, с гениями всегда так. Они не похожи на других людей… Их часто ...",https://rust.litnet.com/uploads/covers/120/1550481625_50.jpg,https://litnet.com/ru/book/genom-varvary-krasy-i-krymskaya-voina-b135259,"Фантастика, Юмористическая фантастика"
Ксения Пильщикова,Варвара-Краса и жертва Инквизиции,"Молодой специалист в области генной инженерии Карен и его красавица жена Таша, клонированная им же на базе редких древнеславянских ген, приезжают в Италию исследо...",https://rust.litnet.com/uploads/covers/120/1587744439_33.jpg,https://litnet.com/ru/book/genom-varvary-krasy-i-krymskaya-voina-b135259,"Фантастика, Юмористическая фантастика"
Аванесов Сергей,Вторжение,"После праздника 8-го марта, в тела жителей страны начали вселяться инопланетяне, не переносящие алкоголя....",https://rust.litnet.com/uploads/covers/120/1549792821_66.jpg,https://litnet.com/ru/book/genom-varvary-krasy-i-krymskaya-voina-b135259,"Фантастика, Юмористическая фантастика"
Дарья Шулико,Контакт,"Многие мечтают увидеть нло, инопланетян, может даже, вступить с ними в контакт. А что если пришельцы среди нас? Что если они давно пытаются наладить с нами связь?...",https://rust.litnet.com/uploads/covers/120/1549279113_99.png,https://litnet.com/ru/book/genom-varvary-krasy-i-krymskaya-voina-b135259,"Фантастика, Юмористическая фантастика"
Валерий Проняев,Разведчик,"Они, как передовой отряд своей цивилизации, ведут разведку потенциально обитаемых планет......",https://rust.litnet.com/uploads/covers/120/1549137563_20.jpg,https://litnet.com/ru/book/genom-varvary-krasy-i-krymskaya-voina-b135259,"Фантастика, Юмористическая фантастика"
Андрей Буторин,Свобьи выборы,"На недавно открытой землянами феодальной планете местный правитель решил поиграть в демократию и устроил выборы, что едва не привело к революции. Однако причина б...",https://rust.litnet.com/uploads/covers/120/1549097522_66.jpg,https://litnet.com/ru/book/genom-varvary-krasy-i-krymskaya-voina-b135259,"Фантастика, Юмористическая фантастика"
Ольга Осенняя,От имени Галактики или капитанша Бесконечности,"Хотите узнать, что такое нано-чип, почему земляне стремятся вступить в Межгалатический Союз, кто такие вечные демиурги, как выглядит космолет, что происходит с план...",https://rust.litnet.com/uploads/covers/120/1586101372_78.jpg,https://litnet.com/ru/book/genom-varvary-krasy-i-krymskaya-voina-b135259,"Фантастика, Юмористическая фантастика"
