author,title,annotation,img_url,book_url,genre
Анастасия Сильва,"Дракон, Барс и ведьма. Ну, здравствуй, война!","И снова стало скучно неразлучной троице. Переворот в стране, напали соседи? Не беспокойся! Теперь скучно не будет точно! Весело будет всем! Кто не успел убежать......",https://rust.litnet.com/uploads/covers/120/1534012031_35.jpg,https://litnet.com/ru/book/povelitel-podvalov-b132016,"Фантастика, Юмористическая фантастика"
Валерий Проняев,Мотивация,"Серж не мог себе представить, как этот выходной день изменит его судьбу. Он просто ""повелся"" на пирожки с клубникой......",https://rust.litnet.com/uploads/covers/120/1529759093_99.jpeg,https://litnet.com/ru/book/povelitel-podvalov-b132016,"Фантастика, Юмористическая фантастика"
Александр Лойер,Вчера я нашел волшебную палочку,"Как вы относитесь к неожиданным находкам, тем более если этой находкой окажется волшебная палочка? Счастье привалило? Счастье - это результат. Его еще надо уметь на...",https://rust.litnet.com/uploads/covers/120/1526478565_44.jpg,https://litnet.com/ru/book/povelitel-podvalov-b132016,"Фантастика, Юмористическая фантастика"
Александр Лойер,Почти аксиома,"Насколько мы продвинулись в поисках братьев по разуму на просторах Вселенной? Все зависит от критериев, которые мы используем в соответствии со своими предствлени...",https://rust.litnet.com/uploads/covers/120/1524077689_15.jpg,https://litnet.com/ru/book/povelitel-podvalov-b132016,"Фантастика, Юмористическая фантастика"
Ирина Кочеткова,"Василий, Васька, инопланетяне","Вопрос: где можно встретиться с инопланетянами? Где?.. А на своей кухне слабо? Василий вот там с ними и познакомился. Васька, правда, раньше, но что-то не вышло у него д...",https://rust.litnet.com/uploads/covers/120/1518894426_80.jpg,https://litnet.com/ru/book/povelitel-podvalov-b132016,"Фантастика, Юмористическая фантастика"
Егор Кратчий,Секретная стерва в процессе протогенезиса,"Прекрасная секретная агентша мечтала совершить что-то ""супергеройское"", и ей такую возможность предоставили... При этом может случиться просто трындец... А может и с...",https://rust.litnet.com/uploads/covers/120/1518621300_71.jpg,https://litnet.com/ru/book/povelitel-podvalov-b132016,"Фантастика, Юмористическая фантастика"
Erixxx,Космические странники: книга 1 Миссия неизбежна,"Режим Верховной Судейской Власти, оплот закона и справедливости,  правивший Галактикой долгие века,  пал в беспощадной гражданской войне. Отныне, повсюду  царят пре...",https://rust.litnet.com/uploads/covers/120/1518023550_63.jpg,https://litnet.com/ru/book/povelitel-podvalov-b132016,"Фантастика, Юмористическая фантастика"
Ольга Жакова,О сущности вдохновения,"Когда грустно и не пишется... не рассказ даже, набросок для развлечения....",https://rust.litnet.com/uploads/covers/120/1515484855_23.jpg,https://litnet.com/ru/book/povelitel-podvalov-b132016,"Фантастика, Юмористическая фантастика"
Юрий,Приключение в райской  долине,"Как  поведешь себя ты и твои друзья, если вдруг вы попадете в необычную ситуацию, где нужно выложиться полностью, где от тебя и от них  потребуется смелость, готовно...",https://rust.litnet.com/uploads/covers/120/1513700256_68.jpg,https://litnet.com/ru/book/povelitel-podvalov-b132016,"Фантастика, Юмористическая фантастика"
Валерий Проняев,Краш-тест,"Никто, кроме их самих, не мог точно сказать в каких переделках они побывали: чуть не сгорели при посадке на Лавию, тонули на Даканге, отбивались от местных аборигено...",https://rust.litnet.com/uploads/covers/120/1505846877_54.jpg,https://litnet.com/ru/book/povelitel-podvalov-b132016,"Фантастика, Юмористическая фантастика"
"Леся Тихомирова, Елена Сергеева",Землянка. Отряд галактического альянса,"— Валерия Кострова? Мы вас эвакуируем. Срочно…
Кто же знал, что эти слова, сказанные высоким опасным инопланетянином с фиолетовыми волосами,  разделят мо...",https://rust.litnet.com/uploads/covers/120/1748464331_57.png,https://litnet.com/ru/book/zemlyanka-otryad-galakticheskogo-alyansa-b532293,"Фантастика, Юмористическая фантастика"
Каролин Дейвуд,Землянка для генералов титанов,"Одной из планет, которую захватили титаны, стала и земля. 

Жестокие, огромные и жуткие. Высшая раса.

Всё, что у меня осталось, это младшая сестрёнка и старень...",https://rust.litnet.com/uploads/covers/120/1743309402_0.png,https://litnet.com/ru/book/zemlyanka-otryad-galakticheskogo-alyansa-b532293,"Фантастика, Юмористическая фантастика"
Каролин Дейвуд,Станешь нашей. Жена для пятерых,"-Завтра мы вернёмся за тобой. И еще приведём Лиса, Психа и Палача. - И голубоглазый красавчик мягко сжимает моё правое плечо, а второй - черноволосый качок со змеиным ...",https://rust.litnet.com/uploads/covers/120/1749387328_13.png,https://litnet.com/ru/book/zemlyanka-otryad-galakticheskogo-alyansa-b532293,"Фантастика, Юмористическая фантастика"
Мартиша Риш,Мне его подарили! Дом-портал 3,"- Его можно просто так купить, этого человека?

Парень стоял посреди рынка между корзинами и саженцами. Прямая осанка, широкий разворот плеч. Смуглая кожа чуточку зо...",https://rust.litnet.com/uploads/covers/120/1745696821_63.jpg,https://litnet.com/ru/book/zemlyanka-otryad-galakticheskogo-alyansa-b532293,"Фантастика, Юмористическая фантастика"
Каролин Дейвуд,В плену у орков. Жена для четверых,"-Топай, человечка! - На ломаном ифисском произносит орк мне на ухо, одной рукой удерживая острие ножа у меня возле глотки, а второй рукой за талию в свой каменный прес...",https://rust.litnet.com/uploads/covers/120/1747155562_62.png,https://litnet.com/ru/book/zemlyanka-otryad-galakticheskogo-alyansa-b532293,"Фантастика, Юмористическая фантастика"
Tommy Glub,Невеста изумрудных принцев,"Меня считают сумасшедшей.

Семья отправила в психушку, парень публично высмеял и бросил, а назойливые журналисты не дают прохода из-за моих странных рассказов. Каже...",https://rust.litnet.com/uploads/covers/120/1747772311_39.jpg,https://litnet.com/ru/book/zemlyanka-otryad-galakticheskogo-alyansa-b532293,"Фантастика, Юмористическая фантастика"
Эмили Гунн,Бракованная Землянка для Легенды,"Всё произошло в одно мгновение.
Мы просто проснулись однажды утром и увидели перед глазами голографические символы.
Время, показатели здоровья, уровень.Меня броси...",https://rust.litnet.com/uploads/covers/120/1738787933_58.jpg,https://litnet.com/ru/book/zemlyanka-otryad-galakticheskogo-alyansa-b532293,"Фантастика, Юмористическая фантастика"
Виктория Эри,Беглянка для опасных маршалов,"Моя земная жизнь рухнула, когда к ногам упал космический артефакт! Телепортация в купальню к опасным маршалам - лишь начало. Вся Галактика ищет артефакт, и теперь я -...",https://rust.litnet.com/uploads/covers/120/1744784877_8.png,https://litnet.com/ru/book/zemlyanka-otryad-galakticheskogo-alyansa-b532293,"Фантастика, Юмористическая фантастика"
Мартиша Риш,Мне его подарили! Дом-портал 4,"- Его можно просто так купить, этого человека?

Парень стоял посреди рынка между корзинами и саженцами. Прямая осанка, широкий разворот плеч. Смуглая кожа чуточку ...",https://rust.litnet.com/uploads/covers/120/1749948882_40.jpg,https://litnet.com/ru/book/zemlyanka-otryad-galakticheskogo-alyansa-b532293,"Фантастика, Юмористическая фантастика"
Каролин Дейвуд,Будешь нашей. Пять звезд землянки,"Закончена!))) Однотомник с ХЭ))

Что мы имеем?

Одну землянку, которая сейчас умрёт от страха - то бишь меня. Одного зверочеловека. Одного хвостатого вианшийца. Одног...",https://rust.litnet.com/uploads/covers/120/1746731668_75.png,https://litnet.com/ru/book/zemlyanka-otryad-galakticheskogo-alyansa-b532293,"Фантастика, Юмористическая фантастика"
Каролин Дейвуд,Только наша. Шесть звёзд землянки,"Завершена!! Шесть мужчин. Одна раздевалка. И я. Я всех их видела много раз в интернете, но когда вживую на них смотришь...

Душа в пятки уходит от страха и одновременно...",https://rust.litnet.com/uploads/covers/120/1729526684_44.png,https://litnet.com/ru/book/zemlyanka-otryad-galakticheskogo-alyansa-b532293,"Фантастика, Юмористическая фантастика"
"Ева Арманда, Миа Мори",Мой Хищный Командор,"На дворе 2024 год. Я обычная девушка, но мне приходится прятаться в глуши от бандитов. Я думала, хоть тут поживу спокойно. Но однажды раздался гром, и с неба свалился му...",https://rust.litnet.com/uploads/covers/120/1729332995_97.jpg,https://litnet.com/ru/book/zemlyanka-otryad-galakticheskogo-alyansa-b532293,"Фантастика, Юмористическая фантастика"
Дина Дружинина,Малышка для двух альф,"Меня спасли двое чертовски привлекательных инопланетян. Трижды. Но на четвертый раз они решили, что  хватит с них мотаться каждый раз ко мне на Землю. Поэтому они пр...",https://rust.litnet.com/uploads/covers/120/1740687754_70.png,https://litnet.com/ru/book/zemlyanka-otryad-galakticheskogo-alyansa-b532293,"Фантастика, Юмористическая фантастика"
Мария Лунёва,Космический приют для хищных растений,"Солнечная система уже давно обжита. Теперь взор человечества и Даллии Одуманд, в частности, обращён к далёким звёздам.
И зачем ей эти далёкие планеты, спросите вы?
И...",https://rust.litnet.com/uploads/covers/120/1725537294_21.jpg,https://litnet.com/ru/book/zemlyanka-otryad-galakticheskogo-alyansa-b532293,"Фантастика, Юмористическая фантастика"
Мартиша Риш,Мне его подарили! Дом-портал 2,"Мне достался дом-портал. С огородом и садом. Вдобавок я из жалости купила раба. Красавец стоял на рынке среди саженцев и корзин.

Пусть бы он помог с огородом. Да не пл...",https://rust.litnet.com/uploads/covers/120/1742942577_0.jpg,https://litnet.com/ru/book/zemlyanka-otryad-galakticheskogo-alyansa-b532293,"Фантастика, Юмористическая фантастика"
Мартиша Риш,Мне его подарили! Дом-портал,"Бесплатно‍❤️‍
- Его можно просто так купить, этого человека?

Парень стоял посреди рынка между корзинами и саженцами. Прямая осанка, широкий разворот плеч. Смуг...",https://rust.litnet.com/uploads/covers/120/1741150943_84.jpg,https://litnet.com/ru/book/zemlyanka-otryad-galakticheskogo-alyansa-b532293,"Фантастика, Юмористическая фантастика"
Ольга Райская,Звездная Академия. Алька Верник и наследие предков,"⭐БЕСПЛАТНО НЕСКОЛЬКО ДНЕЙ⭐
А и расскажу я вам сказочку про дали космические, академию басурманскую, дружбу верную, да любовь вечную. Много дорог будет пройдено, д...",https://rust.litnet.com/uploads/covers/120/1599953075_74.jpg,https://litnet.com/ru/book/zemlyanka-otryad-galakticheskogo-alyansa-b532293,"Фантастика, Юмористическая фантастика"
Каролин Дейвуд,"Землянка, ты наша навеки!","У Ники на планете у всех девочек по два, по три мужика, и даже больше. А нашу героиню бросили её парни. И прямо перед Новым Годом!! И что же делать бедной девушке? Придё...",https://rust.litnet.com/uploads/covers/120/1733250886_61.png,https://litnet.com/ru/book/zemlyanka-otryad-galakticheskogo-alyansa-b532293,"Фантастика, Юмористическая фантастика"
Каролин Дейвуд,Самая слабая землянка в академии? Дикие мужья помогут!,ЗАКОНЧЕНА! Самая слабая землянка в академии - это я. И моё отчисление уже не за горами. Но тут мне дом внезапно в наследство достаётся от сводного брата моей матери. В...,https://rust.litnet.com/uploads/covers/120/1743863868_4.png,https://litnet.com/ru/book/zemlyanka-otryad-galakticheskogo-alyansa-b532293,"Фантастика, Юмористическая фантастика"
Лея Арис,Землянка для космического босса,MIN ЦЕНА В ПОДПИСКЕ! Измена жениха подтолкнула меня к отчаянному шагу - бегству с Земли на другую планету. Теперь я - эколог в серьезной  межгалактической корпораци...,https://rust.litnet.com/uploads/covers/120/1741723271_43.png,https://litnet.com/ru/book/zemlyanka-otryad-galakticheskogo-alyansa-b532293,"Фантастика, Юмористическая фантастика"
Кристина Выборнова (Аделя Хильман),Догонялки,"Далекое будущее. Валя Козлова, девушка 19 лет, посредственная ученица пятнадцатого класса средней школы, выбрана в качестве представителя среднестатистических люд...",https://rust.litnet.com/uploads/covers/120/1505155565_86.jpg,https://litnet.com/ru/book/dogonyalki-b42927,"Фантастика, Юмористическая фантастика"
Валерий Проняев,Отпуск холостяка,"Друг перебил его: - Если не срочно, то я сам тебе чуть позже позвоню…, тут такое дело…, вобщем, я тут помирил двух пациентов, так они прямо в моём кабинете занялись лю...",https://rust.litnet.com/uploads/covers/120/1500838664_34.jpg,https://litnet.com/ru/book/dogonyalki-b42927,"Фантастика, Юмористическая фантастика"
Эли Эшер,В Интересах Высшей Расы,"Вы когда-нибудь пытались принять сигналы из космоса от мудрых пришельцев? А знаете как трудно это сделать, когда под ногами крутится тупое нахальное животное???
...",https://rust.litnet.com/uploads/covers/120/1691015269_91.jpg,https://litnet.com/ru/book/dogonyalki-b42927,"Фантастика, Юмористическая фантастика"
Виктория Радионова,Побочный эффект,"Если у вас есть мечта, и вы устали ждать, а кругом только проблемы и серые будни, просто прочтите это. Для вас - легкий рецепт хорошего настроения, но есть побочный эф...",https://rust.litnet.com/uploads/covers/120/1491451958_10.jpg,https://litnet.com/ru/book/dogonyalki-b42927,"Фантастика, Юмористическая фантастика"
Павел Аваста,Чокнутая больница,Совершенно неправдоподобная идиотская история....,https://rust.litnet.com/uploads/covers/120/1482576866_99.jpg,https://litnet.com/ru/book/dogonyalki-b42927,"Фантастика, Юмористическая фантастика"
Жанна Чиржикова,Маленькая месть,"Всё начинается маленькой, почти реальной, новогодней и актуальной для студентов (и не только) историей. Во что это выльется не знает даже автор...
Эти истории объеди...",https://rust.litnet.com/uploads/covers/120/1490397409_99.jpg,https://litnet.com/ru/book/dogonyalki-b42927,"Фантастика, Юмористическая фантастика"
Fluid,"Привет, оружие!","Юмор — не дар ума, это дар сердца, сама добродетель... Вот пошлёшь кого-нибудь с горяча. А в душе переживаешь... дошёл?... не дошёл?......",https://rust.litnet.com/uploads/covers/120/1647766689_4.jpg,https://litnet.com/ru/book/dogonyalki-b42927,"Фантастика, Юмористическая фантастика"
Далёкий гость,Время вспять,Необычный рассказ о путешественниках во времени.....,https://rust.litnet.com/uploads/covers/120/1645797093_40.jpg,https://litnet.com/ru/book/dogonyalki-b42927,"Фантастика, Юмористическая фантастика"
Алексей Черемисов,Сказ о деде и лисе,"Странное происходит на хозяйстве - у деда куры пропадают. Дело попахивает помётом, хм, нет, простите, мистикой...

Примечания автора:
Однажды мне это приснилось, я пос...",https://rust.litnet.com/uploads/covers/120/1640778616_36.jpg,https://litnet.com/ru/book/dogonyalki-b42927,"Фантастика, Юмористическая фантастика"
Азат Камский,Чудо-пилюля 2,"Продолжение истории, о начинающем спортсмене. В этот раз герой пробует свои силы в боксе с новым чудодейственным препаратом....",https://rust.litnet.com/uploads/covers/120/1639771054_35.jpg,https://litnet.com/ru/book/dogonyalki-b42927,"Фантастика, Юмористическая фантастика"
СА Соколов ,Мир пустых Горизонтов,Луна как масштабная мистификация...Человек как промежуточная ступень социальной эволюции...Творчество как предмет изучения под микроскопом...И другое......,https://rust.litnet.com/uploads/covers/120/1637576994_97.jpg,https://litnet.com/ru/book/dogonyalki-b42927,"Фантастика, Юмористическая фантастика"
Олег Татаренко,Кто спросил рулетку?,"Текст содержит адаптированную к написанию речь инопланетян, читать невозможно...",https://rust.litnet.com/uploads/covers/120/1635502480_55.jpg,https://litnet.com/ru/book/dogonyalki-b42927,"Фантастика, Юмористическая фантастика"
Alex Yastreb ,Домовой,В доме у неверующего священника заводится домовой...,https://rust.litnet.com/common/img/empty_cover_litnet.png,https://litnet.com/ru/book/dogonyalki-b42927,"Фантастика, Юмористическая фантастика"
Татьяна Юрэй,"Горит Сибирь, горят и люди","Книга отсылает в альтернативное будущее. Это мир - антиутопия, приправленная чёрным юмором/сатирой и современными политическими отсылками.
Смогут ли простые люди ...",https://rust.litnet.com/uploads/covers/120/1631107956_50.jpg,https://litnet.com/ru/book/dogonyalki-b42927,"Фантастика, Юмористическая фантастика"
Афанасий Рогин,Приходите через год!,"Не всякому выпадает шанс выбиться в настоящие писатели. Если его профукать, то придется ждать целый год....",https://rust.litnet.com/uploads/covers/120/1630683163_90.jpg,https://litnet.com/ru/book/dogonyalki-b42927,"Фантастика, Юмористическая фантастика"
Афанасий Рогин,Кэш,"Хорошо, когда деловая поездка сопряжена с отдыхом на море. Но надо быть начеку, чтобы не сорвалось одно, и никто не смог помешать другому....",https://rust.litnet.com/uploads/covers/120/1630151579_54.jpg,https://litnet.com/ru/book/dogonyalki-b42927,"Фантастика, Юмористическая фантастика"
Валерий Посиделов,Сказочник в законе,"Воображаемый киноповесть в стиле криминальных лент Балабанова и Тарантино, а также прозы Виктора Пелевина и Владимира Нестеренко, где есть любовь, бандиты и роман...",https://rust.litnet.com/uploads/covers/120/1629290393_11.png,https://litnet.com/ru/book/dogonyalki-b42927,"Фантастика, Юмористическая фантастика"
