author,title,annotation,img_url,book_url,genre
Anonimen,"Искусственный интеллект. Здравствуй, папа!","Искусственный Интеллект ставит человека перед выбором: стать сверхчеловеком или исчезнуть. Бывший госсекретарь США Киссинджер, бывший гендиректор Google Шмидт и быв...",https://rust.litnet.com/uploads/covers/120/1734774787_23.jpg,https://litnet.com/ru/book/popytka-nomer-b514157,"Нон-фикшн, Нон-фикшн"
Катерина Пехтерева,Киа и Тая,"Существует ли женская дружба? Можно ли дружить, когда у вас совершенно противоположные взгляды на жизнь? Возможно ли построить дружбу двум людям с разной жизнью? Др...",https://rust.litnet.com/uploads/covers/120/1734474348_14.jpeg,https://litnet.com/ru/book/popytka-nomer-b514157,"Нон-фикшн, Нон-фикшн"
Ираида Агафонова,"Как мы с Олей застряли в поле, или русские своих не бросают.","История о том, как две подруги застряли зимой в поле. Подруга оказалась настоящая, муж надёжный, а люди, оказавшиеся рядом - золотые....",https://rust.litnet.com/uploads/covers/120/1733220715_46.jpeg,https://litnet.com/ru/book/popytka-nomer-b514157,"Нон-фикшн, Нон-фикшн"
Кенан Лещ,Осенний суп,"У наших мужчин, как и у большинства,  любимыми  темами  разговоров  является  алкоголь и техника. Ночью был очередной  осенний  заморозок и тема горячительных нап...",https://rust.litnet.com/uploads/covers/120/1732385851_36.jpg,https://litnet.com/ru/book/popytka-nomer-b514157,"Нон-фикшн, Нон-фикшн"
Наталья Карабут,Жизнь женщины с безуминкой,"Прошел не один, к сожалению десяток лет, как я решилась на ЭТО.
Нынче модно быть писателем, даже сильнее, чем читателем, но жертвой моды я не стала, скорее жертвой обс...",https://rust.litnet.com/uploads/covers/120/1745846379_61.jpg,https://litnet.com/ru/book/zhizn-zhenshchiny-s-bezuminkoi-b527410,"Нон-фикшн, Нон-фикшн"
Анна Шнейдер,Точка силы,"Моя история, рассказанная мной.
...",https://rust.litnet.com/uploads/covers/120/1745819206_53.png,https://litnet.com/ru/book/zhizn-zhenshchiny-s-bezuminkoi-b527410,"Нон-фикшн, Нон-фикшн"
Федор Ром,Вкус Бури Морской У Тебя На Губах,"ВКУС БУРИ МОРСКОЙ У ТЕБЯ НА ГУБАХ
...",https://rust.litnet.com/uploads/covers/120/1745651288_34.png,https://litnet.com/ru/book/zhizn-zhenshchiny-s-bezuminkoi-b527410,"Нон-фикшн, Нон-фикшн"
Федор Ром,Пираты Xx Века : Самый Кассовый Фильм в Ссср,"Пираты XX века : самый кассовый фильм 1979 года в СССР и за всю историю советского кино...
...",https://rust.litnet.com/uploads/covers/120/1745643346_62.png,https://litnet.com/ru/book/zhizn-zhenshchiny-s-bezuminkoi-b527410,"Нон-фикшн, Нон-фикшн"
Федор Ром,Архип Куинджи,"История жизни великого художника.
...",https://rust.litnet.com/uploads/covers/120/1745552483_2.png,https://litnet.com/ru/book/zhizn-zhenshchiny-s-bezuminkoi-b527410,"Нон-фикшн, Нон-фикшн"
Евгения Магнит,Размышления простого избирателя,"Это не художественная литература. В этой книге автор делится своими размышлениями простого человека с обычной судьбой. Но все же это простой человек, от которого м...",https://rust.litnet.com/uploads/covers/120/1745350341_19.png,https://litnet.com/ru/book/zhizn-zhenshchiny-s-bezuminkoi-b527410,"Нон-фикшн, Нон-фикшн"
Минтао,Код писателя,"Хотите понять, как улучшить свои навыки писательства? С помощью этого сборника мы разберёмся в основных писательских моментах, применяя теорию литературы и собира...",https://rust.litnet.com/uploads/covers/120/1745145007_73.png,https://litnet.com/ru/book/zhizn-zhenshchiny-s-bezuminkoi-b527410,"Нон-фикшн, Нон-фикшн"
Федор Ром,"Маркиз Де Сад - "" Да, Я развратник и горжусь этим ""","Маркиз де Сад, настоящее имя которого Донатиен Альфонс Франсуа, родился 2 июня 1743 года в Париже в обеспеченной аристократической семье. Известный своими провокацио...",https://rust.litnet.com/uploads/covers/120/1745038040_30.png,https://litnet.com/ru/book/zhizn-zhenshchiny-s-bezuminkoi-b527410,"Нон-фикшн, Нон-фикшн"
Кенан Лещ,Кулер,"Наши парни любят работать,  особенно если нужно что-то разобрать. А тут такой повод... 
...",https://rust.litnet.com/uploads/covers/120/1745001817_83.jpg,https://litnet.com/ru/book/zhizn-zhenshchiny-s-bezuminkoi-b527410,"Нон-фикшн, Нон-фикшн"
Вадим Нестеров (Сергей Волчок),Тот самый длинный день в году...,"Казалось бы – ну что интересного можно найти в довоенной подшивке институтской малотиражки ""Сталь""?
Итоги сессии? Репортажи с летней практики студентов на ...",https://rust.litnet.com/uploads/covers/120/1744820915_48.jpg,https://litnet.com/ru/book/zhizn-zhenshchiny-s-bezuminkoi-b527410,"Нон-фикшн, Нон-фикшн"
Дороти Би,"Не благодаря, а вопреки. Как я поборола рак?","Вы когда-нибудь задумывались, что такое рак? С чем у вас ассоциируется этот диагноз? О чём вам говорит это слово? Знаете ли вы как рак распространяется по организму? ...",https://rust.litnet.com/uploads/covers/120/1744708427_90.jpg,https://litnet.com/ru/book/zhizn-zhenshchiny-s-bezuminkoi-b527410,"Нон-фикшн, Нон-фикшн"
Ясмина Сапфир,Как убедить мужа похудеть и при этом не поседеть,"Как убедить мужа похудеть и при этом не поседеть.
Кулинарно-медицинская юмористическая драма (А вот как хотите, так и понимайте).
Аннотация: в шутку и всерьез, о наше...",https://rust.litnet.com/uploads/covers/120/1745411830_79.jpg,https://litnet.com/ru/book/zhizn-zhenshchiny-s-bezuminkoi-b527410,"Нон-фикшн, Нон-фикшн"
Анна Чудесная,Технология души,"Иногда случайные встречи значат больше, чем мы думаем.
...",https://rust.litnet.com/uploads/covers/120/1743098242_61.jpg,https://litnet.com/ru/book/zhizn-zhenshchiny-s-bezuminkoi-b527410,"Нон-фикшн, Нон-фикшн"
Таня Стар,Сквозь года,"Короткий рассказ о любви и преданности...
...",https://rust.litnet.com/uploads/covers/120/1743071868_74.png,https://litnet.com/ru/book/zhizn-zhenshchiny-s-bezuminkoi-b527410,"Нон-фикшн, Нон-фикшн"
Таня Стар,Пенсионный возраст,"Грустная правда жизни!!!
...",https://rust.litnet.com/uploads/covers/120/1742904000_43.png,https://litnet.com/ru/book/zhizn-zhenshchiny-s-bezuminkoi-b527410,"Нон-фикшн, Нон-фикшн"
 Makezzz,из пункта А,"А что , если вся наша жизнь, это задача из математики за 2 класс, а мы в ней поезд...
...",https://rust.litnet.com/uploads/covers/120/1742902078_51.jpg,https://litnet.com/ru/book/zhizn-zhenshchiny-s-bezuminkoi-b527410,"Нон-фикшн, Нон-фикшн"
Аня Гордейчук,Древние римляне и мы: разница в мировоззрении,"Люди в античности, на самом деле, не сильно отличались от нас, но в некоторых аспектах расхождения всё же есть.
...",https://rust.litnet.com/uploads/covers/120/1742830548_64.png,https://litnet.com/ru/book/zhizn-zhenshchiny-s-bezuminkoi-b527410,"Нон-фикшн, Нон-фикшн"
Виктор Агеев-Полторжицкий,Майтрея и учение тысячи богов: путь героя,"Майтрея, будущий Будда, занимает особое место в буддийской традиции. Его приход ассоциируется с новой эпохой, когда человечество будет готово воспринять высшее зн...",https://rust.litnet.com/uploads/covers/120/1742737173_73.jpg,https://litnet.com/ru/book/zhizn-zhenshchiny-s-bezuminkoi-b527410,"Нон-фикшн, Нон-фикшн"
Тимур Ахмеров,Стихами об исламе,"О пророках Ибрахиме (Аврааме) и Юсуфе (Иосифе Прекрасном) на основе ""Рассказов о пророках"" Али Надви, ""Рассказов из Корана"" Сеохарви и др....",https://rust.litnet.com/uploads/covers/120/1742312918_78.png,https://litnet.com/ru/book/zhizn-zhenshchiny-s-bezuminkoi-b527410,"Нон-фикшн, Нон-фикшн"
Виктор Агеев-Полторжицкий,Возможности чипирования и постоянного отравления людей,"В современном мире, где технологии развиваются с невероятной скоростью, вопросы безопасности и этики их применения становятся все более актуальными. Одной из наиб...",https://rust.litnet.com/uploads/covers/120/1742311272_19.jpg,https://litnet.com/ru/book/zhizn-zhenshchiny-s-bezuminkoi-b527410,"Нон-фикшн, Нон-фикшн"
Домина,Железный Дровосек,"Реальная жизнь всегда круче выдумки. История про обычных взрослых людей, кризис среднего возраста, секс, фантазии и сексуальные девиации владения-подчинения. ...",https://rust.litnet.com/uploads/covers/120/1749908442_76.jpg,https://litnet.com/ru/book/zheleznyi-drovosek-b535043,"Нон-фикшн, Нон-фикшн"
Вадим Нестеров (Сергей Волчок),От Алисы до Карлсона,"Книга для всех, кто любит сказки. Она создана на основе моего блога, где я пытаюсь рассказать про рождение культовых сказочных героев, созданных зарубежными автора...",https://rust.litnet.com/uploads/covers/120/1748508700_63.jpg,https://litnet.com/ru/book/zheleznyi-drovosek-b535043,"Нон-фикшн, Нон-фикшн"
Камила Клюнова,Таро от А до Я. Полный учебник для понимания и практики,"Хочешь читать карты Таро уверенно, без подсказок и сомнений? Добро пожаловать в мир, где Таро становится понятным, живым и доступным.

Этот учебник — не просто на...",https://rust.litnet.com/uploads/covers/120/1739218251_60.png,https://litnet.com/ru/book/zheleznyi-drovosek-b535043,"Нон-фикшн, Нон-фикшн"
Дарья Гущина,"30 советов, или Вы не одиноки в своём писательстве",В процессе работы писатель сталкивается с массой проблем. Как же одолеть эту проклятую середину? Как написать в тренд? Для себя писать или для читателей? А если нет ...,https://rust.litnet.com/uploads/covers/120/1701949587_46.jpg,https://litnet.com/ru/book/zheleznyi-drovosek-b535043,"Нон-фикшн, Нон-фикшн"
Громова Ульяна,Шпаргалки для редакторов и писателей,"Дорогие коллеги, эта книга для вас. В своеобразном сборнике вы найдёте всё от уроков по русскому языку до разборов текстов в качестве примера. Очень многие статьи в...",https://rust.litnet.com/uploads/covers/120/1521095724_40.png,https://litnet.com/ru/book/zheleznyi-drovosek-b535043,"Нон-фикшн, Нон-фикшн"
Даниэль Кирштейн,Кодекс хищницы,"Забудь сказки про дружный коллектив и справедливых боссов. Корпоративный мир – это джунгли. Здесь ты либо хищник, либо добыча.
Алиса пришла в сияющий офис «МегаКор...",https://rust.litnet.com/uploads/covers/120/1745080014_39.png,https://litnet.com/ru/book/zheleznyi-drovosek-b535043,"Нон-фикшн, Нон-фикшн"
Николай Наседкин,"Гуд бай, май...","«Гуд бай, май…» — это своеобразный «донжуанский список» автора-героя книги. Ему захотелось и самому понять, и Небесам, что ли, попробовать объяснить — почему кажды...",https://rust.litnet.com/uploads/covers/120/1728803858_20.jpg,https://litnet.com/ru/book/zheleznyi-drovosek-b535043,"Нон-фикшн, Нон-фикшн"
Ана Ховская,Заметки редкора. Методичка для авторов,"❤️Бесплатно. Методичка для всех, кто хочет видеть свои тексты грамотными стилистически, технически, структурированными и лёгкими. Простым доступным языком с масс...",https://rust.litnet.com/uploads/covers/120/1708869481_11.jpg,https://litnet.com/ru/book/zheleznyi-drovosek-b535043,"Нон-фикшн, Нон-фикшн"
Владимир Анатолиевич,"Прочти, когда опять научишься читать (часть 1)","Доигрался!
Ведь сколько раз слышал, мол, не делай добра!
Но связь между сторонами известной поговорки всегда неясна Марку в то время, когда он берётся сотворить добр...",https://rust.litnet.com/uploads/covers/120/1622531078_100.jpg,https://litnet.com/ru/book/zheleznyi-drovosek-b535043,"Нон-фикшн, Нон-фикшн"
Федор Ром,Международные Фестивали Еды,"Международные и региональные фестивали пищи и праздники вкусов.
...",https://rust.litnet.com/uploads/covers/120/1750098994_29.png,https://litnet.com/ru/book/zheleznyi-drovosek-b535043,"Нон-фикшн, Нон-фикшн"
Тынчтыкбек Анваркулов,"Классификация Заболеваний, Не Подлежащих Обнародованию","Этот сборник содержит описания заболеваний, официально удалённых из медицинских классификаторов.

Их не найдёте в МКБ, о них не упоминают в учебниках.

Но они были.

...",https://rust.litnet.com/uploads/covers/120/1750093672_46.png,https://litnet.com/ru/book/zheleznyi-drovosek-b535043,"Нон-фикшн, Нон-фикшн"
Федор Ром,Не Простой Путь,"Твой путь по которому ты идёшь...
...",https://rust.litnet.com/uploads/covers/120/1750045459_12.png,https://litnet.com/ru/book/zheleznyi-drovosek-b535043,"Нон-фикшн, Нон-фикшн"
Федор Ром,Паганини,"История о жизни Николо Паганини...
...",https://rust.litnet.com/uploads/covers/120/1749486305_39.png,https://litnet.com/ru/book/zheleznyi-drovosek-b535043,"Нон-фикшн, Нон-фикшн"
Федор Ром,Слепой Супермен,"История о слепом герое первым покорившим вершину Эвереста
...",https://rust.litnet.com/uploads/covers/120/1749356157_35.png,https://litnet.com/ru/book/zheleznyi-drovosek-b535043,"Нон-фикшн, Нон-фикшн"
Федор Ром,Куйрам Байрама,"Куйрам байрама 
...",https://rust.litnet.com/uploads/covers/120/1749323938_50.png,https://litnet.com/ru/book/zheleznyi-drovosek-b535043,"Нон-фикшн, Нон-фикшн"
Аксакал,Свобода от часов,"Жизнь – это не гонка, а путешествие. Но как наслаждаться этим путешествием, когда тебя постоянно подгоняет календарь? Эта книга предлагает новый взгляд на время – ...",https://rust.litnet.com/uploads/covers/120/1749072780_38.png,https://litnet.com/ru/book/zheleznyi-drovosek-b535043,"Нон-фикшн, Нон-фикшн"
Ольга Альфирова,"Элиза и ""Ласточка""","Приключения Элизы в разных жизненных ситуациях
Здесь собраны несколько рассказов

""Элиза и Ласточка""
""История одной фотографии""
""Элиза в Доме Писателе...",https://rust.litnet.com/uploads/covers/120/1748883276_96.png,https://litnet.com/ru/book/zheleznyi-drovosek-b535043,"Нон-фикшн, Нон-фикшн"
Федор Ром,История Буфорда Пассера,"История самого легендарного шерифа в Америке ..
...",https://rust.litnet.com/uploads/covers/120/1748751685_100.png,https://litnet.com/ru/book/zheleznyi-drovosek-b535043,"Нон-фикшн, Нон-фикшн"
Камила Клюнова,"Сказки, в которых я нашла себя","А если сказка — это не просто выдумка?

А способ прикоснуться к себе. Услышать свою боль, свою силу, свою глубину — и, наконец, полюбить себя по - настоящему.

В ...",https://rust.litnet.com/uploads/covers/120/1748635280_48.png,https://litnet.com/ru/book/zheleznyi-drovosek-b535043,"Нон-фикшн, Нон-фикшн"
Таша Воин,Впечатления после прочтения,"Я помешана на систематизации данных. Вот и здесь я пришла к выводу, что мне будет чрезвычайно удобно, если я все свои отзывы, рецензии и более-менее объемные коммент...",https://rust.litnet.com/uploads/covers/120/1748583273_76.jpg,https://litnet.com/ru/book/zheleznyi-drovosek-b535043,"Нон-фикшн, Нон-фикшн"
Владимир Гриньков,Сокровище русской истории. Библиотека Ивана Грозного,"Бесследно исчезнувшая библиотека Ивана Грозного, ценность которой невообразима - одна из самых таинственных загадок русской истории. В книге рассказывается и о са...",https://rust.litnet.com/uploads/covers/120/1683317464_71.png,https://litnet.com/ru/book/sokrovishche-russkoi-istorii-biblioteka-ivana-groznogo-b436199,"Нон-фикшн, Нон-фикшн"
Васильев Ярослав,Киевская Русь: история и личности,"Немного истории от Владимира Крестителя до Владимира Мономаха
Сборник статей по Руси IX - XII веков как научно-популярный комментарий для исторического романа ""Дорог...",https://rust.litnet.com/uploads/covers/120/1683195226_63.jpg,https://litnet.com/ru/book/sokrovishche-russkoi-istorii-biblioteka-ivana-groznogo-b436199,"Нон-фикшн, Нон-фикшн"
Вадим Нестеров (Сергей Волчок),История в карикатурах - 1923,"Хотите на экскурсию в 100 лет тому назад?

Все очень просто - я открываю журнал ""Крокодил"" 1920-х годов, показываю вам карикатуру и рассказываю историю, связанную с ней. П...",https://rust.litnet.com/uploads/covers/120/1683094453_45.jpg,https://litnet.com/ru/book/sokrovishche-russkoi-istorii-biblioteka-ivana-groznogo-b436199,"Нон-фикшн, Нон-фикшн"
Вадим Нестеров (Сергей Волчок),Двинулись земли низы. Том 2. Индустриализация,"Второй том серии. Рассказ о жизни бывших студентов Московской горной академии после выпуска. В стране начинается индустриализация. 

Первый том - здесь: https://litnet.com/s...",https://rust.litnet.com/uploads/covers/120/1683029095_74.jpg,https://litnet.com/ru/book/sokrovishche-russkoi-istorii-biblioteka-ivana-groznogo-b436199,"Нон-фикшн, Нон-фикшн"
Николай Хрипков (Копа),Шатается земля как пьяная,"В книге история величайших предательств и предателей, имя которых, к сожалению, известно каждому человеку. Многие ли знают, кто создатель храма Артемиды, но все зна...",https://rust.litnet.com/uploads/covers/120/1747391418_57.png,https://litnet.com/ru/book/sokrovishche-russkoi-istorii-biblioteka-ivana-groznogo-b436199,"Нон-фикшн, Нон-фикшн"
Вадим Нестеров (Сергей Волчок),История в карикатурах - 1922,"Люди всегда смеются над собой, но вот конкретные темы для шуток меняются во времени. Меняются настолько, что по карикатурам в юмористических журналах можно изучать...",https://rust.litnet.com/uploads/covers/120/1675925421_15.jpg,https://litnet.com/ru/book/sokrovishche-russkoi-istorii-biblioteka-ivana-groznogo-b436199,"Нон-фикшн, Нон-фикшн"
Васильев Ярослав,Политэкономия фэнтези,"Мы читаем фэнтези и совсем не задумываемся: а каков бы этот мир был в реальности? А как и по каким принципам он мог бы существовать и работать? Почему он именно такой,...",https://rust.litnet.com/uploads/covers/120/1674044365_56.jpg,https://litnet.com/ru/book/sokrovishche-russkoi-istorii-biblioteka-ivana-groznogo-b436199,"Нон-фикшн, Нон-фикшн"
Лала Габор,"Антиразрушение. Отвоюй себя, для себя самой","Вы когда-нибудь задумывались о том, как сильно привычный образ мысли способен повлиять на наше счастье? Это повествование о силе убеждений, способных как разрушить...",https://rust.litnet.com/uploads/covers/120/1691054761_3.png,https://litnet.com/ru/book/sokrovishche-russkoi-istorii-biblioteka-ivana-groznogo-b436199,"Нон-фикшн, Нон-фикшн"
Алла Благовещенская,Змейка-спирейка,"Мы все неотъемлемая часть живой природы нашей планеты. Будьте внимательны, чтобы вовремя распознать ее мудрые знаки....",https://rust.litnet.com/uploads/covers/120/1691920987_39.jpg,https://litnet.com/ru/book/zmeika-spireika-b447838,"Нон-фикшн, Нон-фикшн"
