author,title,annotation,img_url,book_url,genre
Кенан Лещ,"Госты, правила, дизайн","История о сказочной лени молодёжи.
Примечание - Сайт автоматически исправляет в сокращении ГОСТ в названии буквы на маленькие, поэтому слово в обложке дано с учёто...",https://rust.litnet.com/uploads/covers/120/1738667722_77.jpg,https://litnet.com/ru/book/xaarp-i-upravlenie-pogodoi-mify-i-realnost-b516586,"Нон-фикшн, Нон-фикшн"
Летняя Анна,"Почему Джек в конце ""Ночного рейса"" пытается убить Лиз?","Джек - не подготовленная машина для убийств, его задача - чтобы политик по имени Киф был убит, а задача Лиз - чтобы он выжил. Но так ли это на самом деле?
...",https://rust.litnet.com/uploads/covers/120/1738470201_69.jpg,https://litnet.com/ru/book/xaarp-i-upravlenie-pogodoi-mify-i-realnost-b516586,"Нон-фикшн, Нон-фикшн"
Вадим Нестеров (Сергей Волчок),От Чудовища до Снежной королевы,"Книга для всех, кто любит сказки. Она создана на основе моего блога, где я пытаюсь рассказать про рождение культовых сказочных героев, созданных зарубежными автора...",https://rust.litnet.com/uploads/covers/120/1748504665_100.jpg,https://litnet.com/ru/book/ot-chudovishcha-do-snezhnoi-korolevy-b532336,"Нон-фикшн, Нон-фикшн"
Вадим Нестеров (Сергей Волчок),От древних греков до Золушки,"Книга для всех, кто любит сказки. Она создана на основе моего блога, где я пытаюсь рассказать про рождение культовых сказочных героев, созданных зарубежными автора...",https://rust.litnet.com/uploads/covers/120/1748358208_53.jpg,https://litnet.com/ru/book/ot-chudovishcha-do-snezhnoi-korolevy-b532336,"Нон-фикшн, Нон-фикшн"
Федор Ром,М У Х А,"Психологический Анализ фильма "" М У ХА "" Девида Кроненберга...и продолжение фильма с другим режиссёром...
...",https://rust.litnet.com/uploads/covers/120/1748193600_94.png,https://litnet.com/ru/book/ot-chudovishcha-do-snezhnoi-korolevy-b532336,"Нон-фикшн, Нон-фикшн"
Федор Ром,В Южном Городе Гаснет Свет,"Город в погасшем забвении...
...",https://rust.litnet.com/uploads/covers/120/1748080687_26.png,https://litnet.com/ru/book/ot-chudovishcha-do-snezhnoi-korolevy-b532336,"Нон-фикшн, Нон-фикшн"
Ираида Агафонова,Как Зоя Фёдоровна не прошла сертификацию.,"Рассказ о том, как героиня не справилась со своими эмоциями. 
...",https://rust.litnet.com/uploads/covers/120/1747926051_31.jpg,https://litnet.com/ru/book/ot-chudovishcha-do-snezhnoi-korolevy-b532336,"Нон-фикшн, Нон-фикшн"
Федор Ром,Марш Маленького Народа,"Жизнь муравья подобно человеку
...",https://rust.litnet.com/uploads/covers/120/1747915667_38.png,https://litnet.com/ru/book/ot-chudovishcha-do-snezhnoi-korolevy-b532336,"Нон-фикшн, Нон-фикшн"
Таша Воин,Первые шаги. Откровения,"В этой книге будут собраны короткие рассказы, посвященные моей творческой жизни. Это и памятные моменты в музыкальной деятельности, и последующие шаги в сторону пи...",https://rust.litnet.com/uploads/covers/120/1747884786_14.jpg,https://litnet.com/ru/book/ot-chudovishcha-do-snezhnoi-korolevy-b532336,"Нон-фикшн, Нон-фикшн"
Федор Ром,Город Пророчества,"Город в котором нас нет...
...",https://rust.litnet.com/uploads/covers/120/1747747894_61.png,https://litnet.com/ru/book/ot-chudovishcha-do-snezhnoi-korolevy-b532336,"Нон-фикшн, Нон-фикшн"
Мансур Аль-Гураши,Робот-бедуин Али Хаким,"Нейросуфийские опыты

 
...",https://rust.litnet.com/uploads/covers/120/1748117527_56.jpg,https://litnet.com/ru/book/ot-chudovishcha-do-snezhnoi-korolevy-b532336,"Нон-фикшн, Нон-фикшн"
Федор Ром,""" Нечто "" Джона Карпентера","Анализ фильма Джона Карпентера "" Нечто "" , являющийся ремейком фильма из 50-х годов по повести "" Стой , кто идёт !? ""

 
...",https://rust.litnet.com/uploads/covers/120/1747556265_74.png,https://litnet.com/ru/book/ot-chudovishcha-do-snezhnoi-korolevy-b532336,"Нон-фикшн, Нон-фикшн"
Федор Ром,С О М Н Е Н И Я,"Внутренний страх нелегко перебороть.
...",https://rust.litnet.com/uploads/covers/120/1747545294_23.png,https://litnet.com/ru/book/ot-chudovishcha-do-snezhnoi-korolevy-b532336,"Нон-фикшн, Нон-фикшн"
Федор Ром,Псориаз,"Проблемная кожа и кожаные заболевания.
...",https://rust.litnet.com/uploads/covers/120/1747373615_43.png,https://litnet.com/ru/book/ot-chudovishcha-do-snezhnoi-korolevy-b532336,"Нон-фикшн, Нон-фикшн"
Александр Бугаёв,Индустрия Кндр. Развитие развлечений в Северной Корее,"Книга «Индустрия КНДР: Как развивались развлечения в Северной Корее?» погружает читателя в малоизученный мир северокорейской культуры, раскрывая эволюцию телеви...",https://rust.litnet.com/uploads/covers/120/1747162574_27.jpg,https://litnet.com/ru/book/ot-chudovishcha-do-snezhnoi-korolevy-b532336,"Нон-фикшн, Нон-фикшн"
Федор Ром,Карри Из Гундулу,"Острая пища.
...",https://rust.litnet.com/uploads/covers/120/1746933801_84.png,https://litnet.com/ru/book/ot-chudovishcha-do-snezhnoi-korolevy-b532336,"Нон-фикшн, Нон-фикшн"
Федор Ром,В Честь Дня Победы...,"День победы. 🎗️

Жизнь во время великой отечественной войны.

Как питались бойцы на войне.
...",https://rust.litnet.com/uploads/covers/120/1746790649_90.png,https://litnet.com/ru/book/ot-chudovishcha-do-snezhnoi-korolevy-b532336,"Нон-фикшн, Нон-фикшн"
Рушковская Юлия,Зоопарк,Жизненный сюр по воспоминаниям автора. Содержит нецензурные выражения....,https://rust.litnet.com/uploads/covers/120/1746633176_19.jpg,https://litnet.com/ru/book/ot-chudovishcha-do-snezhnoi-korolevy-b532336,"Нон-фикшн, Нон-фикшн"
Федор Ром,Шакшука,"Шакшука - наивкуснейшая история древнего блюда..
...",https://rust.litnet.com/uploads/covers/120/1746468292_56.png,https://litnet.com/ru/book/ot-chudovishcha-do-snezhnoi-korolevy-b532336,"Нон-фикшн, Нон-фикшн"
Михаил Октябрьский,Мыслить параллельно,"Вы когда-нибудь чувствовали, что мир ускоряется, а ваш мозг — нет? Что объем информации, задач и идей растет быстрее, чем ваша способность их обрабатывать? До...",https://rust.litnet.com/uploads/covers/120/1746462416_44.jpg,https://litnet.com/ru/book/ot-chudovishcha-do-snezhnoi-korolevy-b532336,"Нон-фикшн, Нон-фикшн"
Федор Ром,Волшебство,"Волшебство морского трилистника.
...",https://rust.litnet.com/uploads/covers/120/1746339466_100.png,https://litnet.com/ru/book/ot-chudovishcha-do-snezhnoi-korolevy-b532336,"Нон-фикшн, Нон-фикшн"
Есси Юн,Жемчужина подсознания: путь к осознанным снам,"Как понять, что ты спишь — и не проснуться от этого?

Эта книга — практическое и личное руководство по осознанным сновидениям.
Ты узнаешь, как запоминать сны, осозна...",https://rust.litnet.com/uploads/covers/120/1746283635_60.jpg,https://litnet.com/ru/book/ot-chudovishcha-do-snezhnoi-korolevy-b532336,"Нон-фикшн, Нон-фикшн"
Самойлова Анна,"Мои потницы, откройтесь!","Говорят, что женщины управляют миром ногами. Это действительно так. Женская энергетика проходит через все тело, наполняясь мыслями, чувствами и желанием и выходит ...",https://rust.litnet.com/uploads/covers/120/1731869641_7.png,https://litnet.com/ru/book/moi-potnicy-otkroites-b502273,"Нон-фикшн, Нон-фикшн"
Ксения Толкачева,Мир на вершине башни,"Книга о том, как навести порядок в башне и не спалить все к чертям, если дракон - это ты....",https://rust.litnet.com/uploads/covers/120/1730587701_27.jpg,https://litnet.com/ru/book/moi-potnicy-otkroites-b502273,"Нон-фикшн, Нон-фикшн"
Александр Костин.,Почему мы любим фэнтези,Что делает фэнтези таким притягательным? Почему миллионы читателей по всему миру снова и снова возвращаются к мифическим мирам и магическим приключениям? В этой к...,https://rust.litnet.com/uploads/covers/120/1730224556_27.jpg,https://litnet.com/ru/book/moi-potnicy-otkroites-b502273,"Нон-фикшн, Нон-фикшн"
Александр Костин.,Курс писательского мастерства: Как писать фэнтези,"Мечтаете создать свой уникальный фэнтези-мир, где магия реальна, а герои совершают великие подвиги? Хотите, чтобы ваша история захватывала дух и оставалась в памят...",https://rust.litnet.com/uploads/covers/120/1730222775_67.jpg,https://litnet.com/ru/book/moi-potnicy-otkroites-b502273,"Нон-фикшн, Нон-фикшн"
Григорий Богорад,Урок астрономии,Будни сельской библиотеки....,https://rust.litnet.com/uploads/covers/120/1729794210_15.jpg,https://litnet.com/ru/book/moi-potnicy-otkroites-b502273,"Нон-фикшн, Нон-фикшн"
Григорий Богорад,Две истории,"Порой грустно, порой смешно! Порой очень грустно!
...",https://rust.litnet.com/uploads/covers/120/1729697110_92.jpg,https://litnet.com/ru/book/moi-potnicy-otkroites-b502273,"Нон-фикшн, Нон-фикшн"
ДИГА,Тревожность,"написано в состоянии тревоги

 
...",https://rust.litnet.com/common/img/empty_cover_litnet.png,https://litnet.com/ru/book/moi-potnicy-otkroites-b502273,"Нон-фикшн, Нон-фикшн"
Кенан Лещ,Зубчатая пара,"Нашему бюро поручили немного изменить конструкцию вертолета. Парни у нас рукастые и умеют думать, но вот изготовить некоторые детали, как бы ни хотелось начальству...",https://rust.litnet.com/uploads/covers/120/1728123654_72.png,https://litnet.com/ru/book/moi-potnicy-otkroites-b502273,"Нон-фикшн, Нон-фикшн"
ДИГА,грёзы,"в данном стихотворении отражену мои мысли, преследующие меня по завещанию каждого дня
...",https://rust.litnet.com/common/img/empty_cover_litnet.png,https://litnet.com/ru/book/moi-potnicy-otkroites-b502273,"Нон-фикшн, Нон-фикшн"
Дубинин,Когда я плачу. Письмо философа,"Личное письмо-исповедь, написанное от лица человека, глубоко погруженного в размышления о смысле жизни и собственной роли в мире. Находясь в состоянии глубокой душ...",https://rust.litnet.com/uploads/covers/120/1726009444_68.jpg,https://litnet.com/ru/book/moi-potnicy-otkroites-b502273,"Нон-фикшн, Нон-фикшн"
Кирилл Ракитин,О медицине и не только,"Небольшие рассказы и заметки, тематически связанные с медициной
...",https://rust.litnet.com/uploads/covers/120/1724956919_53.jpg,https://litnet.com/ru/book/moi-potnicy-otkroites-b502273,"Нон-фикшн, Нон-фикшн"
Кенан Лещ,"Не наш интерес, но мы обсудим","Советы у нас раздаются всем и на любую тематику. Бесплатно, с приправой из шуток. 
...",https://rust.litnet.com/uploads/covers/120/1723990088_99.png,https://litnet.com/ru/book/moi-potnicy-otkroites-b502273,"Нон-фикшн, Нон-фикшн"
Кенан Лещ,Повестка на военные сборы,"В послелние годы парни фирмы стали активно ходить на сборы, где учатся ходить строем и держать оружие, а также могут почувствовать себя солдатом в окопе - уставшим и...",https://rust.litnet.com/uploads/covers/120/1723475679_1.png,https://litnet.com/ru/book/moi-potnicy-otkroites-b502273,"Нон-фикшн, Нон-фикшн"
Греднев Илья,Что не так с Крымом?,"Нереализованный потенциал туристического рая

Ответ на вопрос:
Как превратить Крым в туристический рай в ближайшие годы?

Книга не лишена юмора, наполнена образным...",https://rust.litnet.com/uploads/covers/120/1721158424_56.jpg,https://litnet.com/ru/book/moi-potnicy-otkroites-b502273,"Нон-фикшн, Нон-фикшн"
Алёна Романова ,Голод,"Говард Лавкрафт,  разочаровашись  в семейной жизни, возвращается домой из Нью-Йорка, по дороге встречает озабоченную женщину, которая хочет накормить его пельменя...",https://rust.litnet.com/common/img/empty_cover_litnet.png,https://litnet.com/ru/book/moi-potnicy-otkroites-b502273,"Нон-фикшн, Нон-фикшн"
Алёна Романова ,Козявочка,"Маленький Говард Лавкрафт навещает с матерью отца и сталкивается со странностями.
...",https://rust.litnet.com/uploads/covers/120/1721196804_27.jpg,https://litnet.com/ru/book/moi-potnicy-otkroites-b502273,"Нон-фикшн, Нон-фикшн"
Рада Дар,Проживая травму,"Один из вариантов пути проживания посттравматического расстройства. Психология, эзотерика, духовные практики. В 30 лет детские травмы начинают напоминать о себе...",https://rust.litnet.com/uploads/covers/120/1720863089_37.jpg,https://litnet.com/ru/book/moi-potnicy-otkroites-b502273,"Нон-фикшн, Нон-фикшн"
Андрей Тиеров,Как я мыл кастрюлю в Карибском море,"Воспоминания о работе волонтером на Гаити, где я провел почти год своей жизни. Мелочи жизни, различные случаи, запомнившиеся события. Столичная пробка из-за Билла К...",https://rust.litnet.com/uploads/covers/120/1720380305_54.jpg,https://litnet.com/ru/book/moi-potnicy-otkroites-b502273,"Нон-фикшн, Нон-фикшн"
Владимир Веретенников (Савва),Что может рассказать Ии о русской философии,"Что мне поведали две нейросети о русской философии...
...",https://rust.litnet.com/common/img/empty_cover_litnet.png,https://litnet.com/ru/book/moi-potnicy-otkroites-b502273,"Нон-фикшн, Нон-фикшн"
Владимир Веретенников (Савва),Вопросы для Ии и для всего человечества,"Что мне ответил ИИ на вопросы фундаментальные для всего человеческого общества...
...",https://rust.litnet.com/common/img/empty_cover_litnet.png,https://litnet.com/ru/book/moi-potnicy-otkroites-b502273,"Нон-фикшн, Нон-фикшн"
Катерина Пехтерева,Попытка номер...,"«Ой, ну чего ты ревешь-то? Когда вырастешь, знаешь сколько у тебя этих подруг будет?!» - мне мама так всегда говорила, когда я ссорилась с подругами или однокласс...",https://rust.litnet.com/uploads/covers/120/1738632827_72.jpg,https://litnet.com/ru/book/popytka-nomer-b514157,"Нон-фикшн, Нон-фикшн"
Камила Клюнова,Сказки для сердца! Путеводитель по пути исцеления,"Эта книга — волшебный путеводитель к внутренним переменам, исполнению желаний и обретению гармонии. В её страницах оживают удивительные сказки, каждая из котор...",https://rust.litnet.com/uploads/covers/120/1739218127_8.png,https://litnet.com/ru/book/popytka-nomer-b514157,"Нон-фикшн, Нон-фикшн"
Ираида Агафонова,Как друзья мечтали на пенсии порыбачить,"История о том, как собака вернула интерес к жизни.


Обложка создана при помощи нейросети Kandinsky....",https://rust.litnet.com/uploads/covers/120/1737559137_52.jpg,https://litnet.com/ru/book/popytka-nomer-b514157,"Нон-фикшн, Нон-фикшн"
Катерина Пехтерева,Моя Варя,"Девушка Аля делится с подругой Варварой, своей историей. Предательство.

В конце стихотворение посвященное мужу Али. История основанна на реальных события...",https://rust.litnet.com/uploads/covers/120/1737474547_17.jpeg,https://litnet.com/ru/book/popytka-nomer-b514157,"Нон-фикшн, Нон-фикшн"
Елена Ашкаар,Предложили интим на первом свидании. Как ответить,"Здесь вы найдёте подсказку, как достойно ответить на предложение интима на первом свидании, при этом остаться в хорошем настроении и, вполне возможно, даже повысит...",https://rust.litnet.com/uploads/covers/120/1737046060_99.jpg,https://litnet.com/ru/book/popytka-nomer-b514157,"Нон-фикшн, Нон-фикшн"
Ираида Агафонова,Как жизнь железнодорожника чуть не потеряла смысл.,"Рассказ о том, что нет в мире стабильности. Или есть, но она может дать сбой.

Обложка создана при помощи нейросети Kandinsky....",https://rust.litnet.com/uploads/covers/120/1736790966_84.jpg,https://litnet.com/ru/book/popytka-nomer-b514157,"Нон-фикшн, Нон-фикшн"
Ираида Агафонова,Как Зинаида Ивановна получила пенсию в купюрах ...,"Как сотрудники почты, магазина и полиции сделали жизнь пенсионерки более интересной.


Обложка создана при помощи нейросети Kandinsky....",https://rust.litnet.com/uploads/covers/120/1736788271_100.jpg,https://litnet.com/ru/book/popytka-nomer-b514157,"Нон-фикшн, Нон-фикшн"
Таня Стар,"Сочи, море, пляж","Правдивая и печальная история из жизни...
...",https://rust.litnet.com/uploads/covers/120/1736765934_8.png,https://litnet.com/ru/book/popytka-nomer-b514157,"Нон-фикшн, Нон-фикшн"
Ираида Агафонова,Как мама проработала мои детские травмы,"История о том, что не все детские драмы нужно холить и лелеять. ...",https://rust.litnet.com/uploads/covers/120/1736606095_12.jpg,https://litnet.com/ru/book/popytka-nomer-b514157,"Нон-фикшн, Нон-фикшн"
Елена Свительская,Песня сердца матери,"Мои стихи и песни разных лет, о материнстве и детях...

Мои разные воспоминания, мечты и слёзы о детях, моём умершем и о детках прежде срока умерших мертворожденных др...",https://rust.litnet.com/uploads/covers/120/1736473688_47.jpg,https://litnet.com/ru/book/popytka-nomer-b514157,"Нон-фикшн, Нон-фикшн"
Кенан Лещ,Подготовка к корпоративу,"В нашей фирме работают, в основном, ребята молодые и здоровые. Естественно, они любят не только поесть, но выпить, да и разнообразно отдохнуть. За процессом подготов...",https://rust.litnet.com/uploads/covers/120/1736431324_23.jpg,https://litnet.com/ru/book/popytka-nomer-b514157,"Нон-фикшн, Нон-фикшн"
Виктор Лугинин,Топ-3 мошенниц на сайтах знакомств,"Сайты знакомств самый простой способ найти вторую половинку. В теории тысячи людей по лайкам могут устраивать свидания, приятно проводить время, начинать отношени...",https://rust.litnet.com/uploads/covers/120/1736240450_39.jpg,https://litnet.com/ru/book/popytka-nomer-b514157,"Нон-фикшн, Нон-фикшн"
Ираида Агафонова,Как я получила приз в розыгрыше подгузников,"История о уверенности в своём будущем выигрыше.



Обложка создана при помощи нейросети Kandinsky....",https://rust.litnet.com/uploads/covers/120/1735417241_53.jpg,https://litnet.com/ru/book/popytka-nomer-b514157,"Нон-фикшн, Нон-фикшн"
Эвелина Шегай,Путеводитель по Мальдоре,"На страницах путеводителя вы найдете всю актуальную информацию по написанным циклам, общие сведения о географии мира, расах, устройстве системы образования у ведь...",https://rust.litnet.com/uploads/covers/120/1735367502_31.jpg,https://litnet.com/ru/book/popytka-nomer-b514157,"Нон-фикшн, Нон-фикшн"
Алексей Коробков,Краткий былинник,"Я не видел в интернете такого сверхкороткого пересказа, чтобы в один присест познакомиться со всеми былинами. Тут почти все сюжеты, кроме самых редких. К былинам я п...",https://rust.litnet.com/uploads/covers/120/1735059364_86.jpg,https://litnet.com/ru/book/popytka-nomer-b514157,"Нон-фикшн, Нон-фикшн"
Катерина Пехтерева,Майя,"Вы хотели свободные отношения? Получите распишитесь как говориться.
История про Майю и её свободные отношения в серьёзных отношениях. Тавтология, ммм, обожаю.
Возм...",https://rust.litnet.com/uploads/covers/120/1734897279_1.jpg,https://litnet.com/ru/book/popytka-nomer-b514157,"Нон-фикшн, Нон-фикшн"
