author,title,annotation,img_url,book_url,genre
Лия Титова,Семейная легенда: рождение легенды,Каждая легенда опирается на события прошлого. Василий Полонский пережил в свои юные восемнадцать лет весь кошмар взрослых политических игр и сделал свой выбор. Пе...,https://rust.litnet.com/uploads/covers/120/1721400235_69.png,https://litnet.com/ru/book/xrupkaya-melodiya-b491035,"Фэнтези, Историческое фэнтези "
Натаниэль Воронцов,Когда я встретила тебя,"В один обыкновенный день все поразила новость: дофин женится на неблагородной слепой эльфийке Сесиль. Полину, старательную и молодую служанку ставят служить новои...",https://rust.litnet.com/uploads/covers/120/1721077624_97.png,https://litnet.com/ru/book/xrupkaya-melodiya-b491035,"Фэнтези, Историческое фэнтези "
Лилиана,4 волшебных камня,"Маленькая принцесса оказывается в волшебном измерении совершенно случайно - из-за своего любопытства. Чтобы вернуться домой, ей нужно доказать, что она умеет храни...",https://rust.litnet.com/uploads/covers/120/1732570704_74.png,https://litnet.com/ru/book/xrupkaya-melodiya-b491035,"Фэнтези, Историческое фэнтези "
Лилиана,Легенда о фиолетовой сове,"Когда-то давным-давно простая девушка, потерявшая родителей в раннем возрасте выросшая с тётей и ничего не знающая о магии, неожиданно для себя обнаружила в лесу мо...",https://rust.litnet.com/uploads/covers/120/1732655006_33.png,https://litnet.com/ru/book/xrupkaya-melodiya-b491035,"Фэнтези, Историческое фэнтези "
Лилиана,Сказка о фее,"Обычно в сказках все влюбляются в принцесс, а в этой сказке герой влюбится в фею.

 
...",https://rust.litnet.com/uploads/covers/120/1732570178_24.png,https://litnet.com/ru/book/xrupkaya-melodiya-b491035,"Фэнтези, Историческое фэнтези "
Лика Семенова,"Мама для Пиявки, или Дракона в мужья не предлагать","❤️  Угораздило же нарваться на эту липучую милаху! Прицепилась, как пиявка – не отдерешь! Лепешку мою отъела! И что теперь с ней делать? Просит отвести к отцу &nd...",https://rust.litnet.com/uploads/covers/120/1721026873_58.jpg,https://litnet.com/ru/book/xrupkaya-melodiya-b491035,"Фэнтези, Историческое фэнтези "
Джи Спот,Часы Дьявола,"У Идана умирает отец, открывая ему секрет, который поможет спасти их семейное дело - часовую мастерскую. В поисках бесценного артефакта, часов Дьявола, Идан попадае...",https://rust.litnet.com/uploads/covers/120/1714420465_12.png,https://litnet.com/ru/book/chasy-dyavola-b472835,"Фэнтези, Историческое фэнтези "
Елена Княжинская,Невеста проклятого горца,"Седьмой дочери обедневшего лорда не пристало думать о любви. Она должна быть благодарна уже за то, что нашелся мужчина, готовый взять ее в жены, несмотря на скромное...",https://rust.litnet.com/uploads/covers/120/1710215426_36.png,https://litnet.com/ru/book/chasy-dyavola-b472835,"Фэнтези, Историческое фэнтези "
Мак Роберт,Перегрин 9,"Здравствуйте ! Представляю Вашему вниманию цикл рассказов в стиле Кельтское Фэнтези с общим именем ""Перегрин"" /Peregrinus/  

Перегринами в Древнем Риме тазывали свободн...",https://rust.litnet.com/uploads/covers/120/1710190886_92.png,https://litnet.com/ru/book/chasy-dyavola-b472835,"Фэнтези, Историческое фэнтези "
Ирина Ваганова,Секретарша злодея,"В поместье моего отца, графа Довери, празднуют «ночь оборотня». Незнакомец в толпе привлёк внимание прикованным ко мне пристальным взглядом, знать бы тогда, что это...",https://rust.litnet.com/uploads/covers/120/1710095639_35.jpg,https://litnet.com/ru/book/chasy-dyavola-b472835,"Фэнтези, Историческое фэнтези "
Олег Рыбаченко ,Витязи против Архимага,"Никогда еще отважным попаданцам в эпоху Ивана Грозного в своей боевой карьере не приходилось иметь дело со столь могучей, дьявольской силой волшебства. Но смекалк...",https://rust.litnet.com/uploads/covers/120/1709903329_61.png,https://litnet.com/ru/book/chasy-dyavola-b472835,"Фэнтези, Историческое фэнтези "
Жанна Хохлова,Единственная для царя,"Я стала наложницей и спасла свой народ, пожертвовав свободой. Но никто не ведал, что только мне суждено быть единственной. Единственной для царя...

Ретеллинг ""Кни...",https://rust.litnet.com/uploads/covers/120/1709572608_83.png,https://litnet.com/ru/book/chasy-dyavola-b472835,"Фэнтези, Историческое фэнтези "
Эльвира Князева,Проклятье голубого лотоса,"Древний Египет. Богатый город Пер-Рамзес.
Яхмос, из потомственной семьи воинов, встречает дочь вельможи Эфер возле обелиска.
Она западает ему в душу так же сильно, ...",https://rust.litnet.com/uploads/covers/120/1709496805_31.jpg,https://litnet.com/ru/book/chasy-dyavola-b472835,"Фэнтези, Историческое фэнтези "
Элеонора Лазарева,Императрица-попаданка 2,"Наша попаданка в теле императрицы Анны Иоановны продолжает свой путь в 18 веке. 
Теперь она не испуганная женщина, не помнящая даже уроки истории, а вполне сформиров...",https://rust.litnet.com/uploads/covers/120/1709552032_33.jpg,https://litnet.com/ru/book/chasy-dyavola-b472835,"Фэнтези, Историческое фэнтези "
Рина Храновская,Сын Нила,"Кровосмешение, магия, смерть и зло, пески древнего Египта хранят множество тайн. Тайн крови, что пугают до смерти маленькую невесту, тайн богов, что манят молодого п...",https://rust.litnet.com/uploads/covers/120/1709359442_43.png,https://litnet.com/ru/book/chasy-dyavola-b472835,"Фэнтези, Историческое фэнтези "
Loren Norel,Хищный брак,"Принцесса Лия написала предсмертную записку перед свадьбой.

Сделала она это, поскольку была уверена, что умрет после первой брачной ночи; несчастный конец принце...",https://rust.litnet.com/uploads/covers/120/1708792939_89.jpg,https://litnet.com/ru/book/chasy-dyavola-b472835,"Фэнтези, Историческое фэнтези "
Павлова Зарина,Обратная сторона счастья,"Каково живется святой? В почете и славе? Да, конечно. Я получала и почет, и славу, и любовь народа. Я стала невестой кронпринца, который, казалось, любил меня всей душо...",https://rust.litnet.com/uploads/covers/120/1708596649_16.png,https://litnet.com/ru/book/chasy-dyavola-b472835,"Фэнтези, Историческое фэнтези "
Ивар Рагнарссон,Дверь,"Иногда самые обыденные вещи начинают внушать безотчетный страх. Дверь, которую не отпирали много лет. Чулан, в который очень давно никто не входил. Со временем они о...",https://rust.litnet.com/uploads/covers/120/1708110327_93.png,https://litnet.com/ru/book/chasy-dyavola-b472835,"Фэнтези, Историческое фэнтези "
Ивар Рагнарссон,Оруженосец,"Когда начали пропадать люди в прусской деревне, жрец заподозрил, что это дело рук неупокоенного мертвеца. И это чертовски походило на правду....",https://rust.litnet.com/uploads/covers/120/1708035148_81.png,https://litnet.com/ru/book/chasy-dyavola-b472835,"Фэнтези, Историческое фэнтези "
"Никитин Юрий, Генер Марго",Трое из Леса возвращаются. Меч Томаса,"""Трое из Леса возвращаются. Меч Томаса"" - роман Юрия Никитина и Марго Генер, жанр фэнтези, приключенческое фэнтези, славянское фэнтези, историческое фэнтези.
Всегда ...",https://rust.litnet.com/uploads/covers/120/1707943153_1.jpg,https://litnet.com/ru/book/chasy-dyavola-b472835,"Фэнтези, Историческое фэнтези "
Олег Рыбаченко ,Комар погубивший человечество,"Случайно раздавленный комар стал причиной того, что динозавры не вымерли и путешественники во времени, вернувшись назад, попали в мир, где царствуют разумные репти...",https://rust.litnet.com/uploads/covers/120/1707734168_25.png,https://litnet.com/ru/book/chasy-dyavola-b472835,"Фэнтези, Историческое фэнтези "
Арогаста,Под свинцовым небом,"Близится зима 1925 года. 
Последние ноябрьские дни несут с собой изменения в укладе жизни небольшого лесного отеля. Сворачиваются до весны археологические раскопки ...",https://rust.litnet.com/uploads/covers/120/1715959114_30.png,https://litnet.com/ru/book/chasy-dyavola-b472835,"Фэнтези, Историческое фэнтези "
Ивар Рагнарссон,Хольда,"Местное предание, из тех, что обычно включают в путеводители. Лапша, которую вешают на уши доверчивым туристам. Но, как говорится, сказка - ложь да в ней намек....",https://rust.litnet.com/uploads/covers/120/1707643078_43.png,https://litnet.com/ru/book/chasy-dyavola-b472835,"Фэнтези, Историческое фэнтези "
Евгения Зимина,Академия Пламени,"Что делать, если отправляют в Академию на территорию, с которой всегда враждовали? Она узнала тайну матери и теперь ей нужно сделать всё, чтобы покинуть эти стены. А ...",https://rust.litnet.com/uploads/covers/120/1710222399_7.jpg,https://litnet.com/ru/book/chasy-dyavola-b472835,"Фэнтези, Историческое фэнтези "
К Разумовская,Голод Беса,"Этран - Бес, сражающийся со своим голодом. Возможно ли победить в войне, где главный враг - ты сам? 

Дополнение к циклу ""Двуглавые Змеи""...",https://rust.litnet.com/uploads/covers/120/1707190675_85.jpg,https://litnet.com/ru/book/chasy-dyavola-b472835,"Фэнтези, Историческое фэнтези "
Мария Берестова,Чистая нота,"Юный ординарец принца учится играть на свирели - но почему-то принц крайне разгневан этим обстоятельством!

- музыкальный рассказ, наполненный звучанием свирели
- и...",https://rust.litnet.com/uploads/covers/120/1707151667_23.jpg,https://litnet.com/ru/book/chasy-dyavola-b472835,"Фэнтези, Историческое фэнтези "
Иван Неклютин,Герр Маннелинг,"Старая история, рассказанная в средневековой европейской народной балладе Herr Manneling, повествующая о страсти девы из рода троллей к молодому рыцарю. Что таится за ин...",https://rust.litnet.com/uploads/covers/120/1713604287_57.jpeg,https://litnet.com/ru/book/gerr-manneling-b477164,"Фэнтези, Историческое фэнтези "
Kassi Dulcet,Мятный шелк в лунном свете. Часть 2,"Представьте, что вам обещали перезвонить, но так и не перезвонили, и вот, когда вы уже забылись, ваш возлюбленный торжественно входит через главные ворота. Он не под...",https://rust.litnet.com/uploads/covers/120/1713377226_86.jpg,https://litnet.com/ru/book/gerr-manneling-b477164,"Фэнтези, Историческое фэнтези "
Наталья Савчук,Воровка,"– Воровка, которая торгует своим телом, – Аарон презрительно морщится. – Тебе понравится моё предложение. К тому же ты готова на всё ради монет. Раз уж твой д...",https://rust.litnet.com/uploads/covers/120/1713105278_5.jpg,https://litnet.com/ru/book/gerr-manneling-b477164,"Фэнтези, Историческое фэнтези "
Олег Рыбаченко ,Оракулы мрачного ада,"Но в одной из альтернативных реальностей нашелся колдун, который подсказал нацисту номер как вернуть силу пересказывать зеркалу Дьявола. На отражающую поверхност...",https://rust.litnet.com/uploads/covers/120/1713077703_33.jpg,https://litnet.com/ru/book/gerr-manneling-b477164,"Фэнтези, Историческое фэнтези "
Веле Штылвелд,Веле Штылвелд и Игорь Сокол: Сказочный мираж Почемучки,Современная добрая сказка...,https://rust.litnet.com/uploads/covers/120/1712941848_93.png,https://litnet.com/ru/book/gerr-manneling-b477164,"Фэнтези, Историческое фэнтези "
Елена Алеева,Дерзкая леди или По праву сильнейшего,"Король умер… Не то, чтобы я слишком переживала о смерти правителя, но вместе с ним канули в лету большинство договоренностей и привилегий. Иначе, с чего это новый пр...",https://rust.litnet.com/uploads/covers/120/1712714749_38.jpg,https://litnet.com/ru/book/gerr-manneling-b477164,"Фэнтези, Историческое фэнтези "
Елена Алеева,Элина,"БОНУС к книге ""Пропавшая жена князя"" по вашим просьбам))
История Элины, старшей дочери Аны и Ромуса, будущей княгини Риинтийского княжества. ...",https://rust.litnet.com/uploads/covers/120/1750225106_39.jpg,https://litnet.com/ru/book/gerr-manneling-b477164,"Фэнтези, Историческое фэнтези "
Бренда Рoуз,Проклятый дар,"Юная девушка становится объектом подозрений и ненависти со стороны сообщества, обвиняющего ее в необъяснимых явлениях и тревожащих убийствах в городке. Она оказы...",https://rust.litnet.com/uploads/covers/120/1712354488_56.png,https://litnet.com/ru/book/gerr-manneling-b477164,"Фэнтези, Историческое фэнтези "
Валерия Демина,Теплые истории на одну страничку,"Очерки, новые и старые, родившиемя по разным случаям, буду складывать в эту корзинку с теплом — берите по одной к чашечке чая)
1. История первая: Бал.Написана как вд...",https://rust.litnet.com/uploads/covers/120/1712315698_0.jpg,https://litnet.com/ru/book/gerr-manneling-b477164,"Фэнтези, Историческое фэнтези "
Кора Бек,У неё гранитный камушек в груди,"- Здравствуйте! Оперативный дежурный Чеботарёв слушает. Чем мы можем вам помочь? 
- Товарищ, пожалуйста, пришлите наряд полиции. Ко мне в квартиру забрался незнако...",https://rust.litnet.com/uploads/covers/120/1713288226_49.jpg,https://litnet.com/ru/book/gerr-manneling-b477164,"Фэнтези, Историческое фэнтези "
Сима Гольдман ,Фиктивная жена Артефактора,"Выдуманный жених появился на пороге моего дома и утверждает, что страстно влюблен и готов жениться. Выход только один, чтобы моя тайна не была раскрыта – изобраз...",https://rust.litnet.com/uploads/covers/120/1712070726_93.jpg,https://litnet.com/ru/book/gerr-manneling-b477164,"Фэнтези, Историческое фэнтези "
Марина Дунаева ,Ведьмины сказки,"В те времена, когда на земле жила магия, ходило пророчество. Что когда люди прекратят устраивать праздник в честь своих потомков, духи останутся на земле. Салима не ...",https://rust.litnet.com/uploads/covers/120/1741150857_60.png,https://litnet.com/ru/book/gerr-manneling-b477164,"Фэнтези, Историческое фэнтези "
Кира РАЙТ,Трофей Отставного генерала,"Отец решил выдать меня замуж против воли, и я сбежала. Раз в сотый. Или в тысячный. Тогда он отправил за мной наёмника – отставного генерала, беспринципного, бессерд...",https://rust.litnet.com/uploads/covers/120/1715344053_74.jpg,https://litnet.com/ru/book/gerr-manneling-b477164,"Фэнтези, Историческое фэнтези "
Валерия Соколова,Неблагой двор,"Самые мрачные кошмары, которые только можно представить, творятся во дворце темных фей.
Случайно познакомившись с молодым человеком по имени Кайден, Вивиан понима...",https://rust.litnet.com/uploads/covers/120/1711897891_74.jpg,https://litnet.com/ru/book/gerr-manneling-b477164,"Фэнтези, Историческое фэнтези "
Татьяна Ма,Тайна лорда Кавендиша,"Лорд Кавендиш представил лондонскому свету свою племянницу мисс Маргарет, о которой тут же поползли слухи. Очень уж прекрасная Маргарет похожа на давнюю любовь ло...",https://rust.litnet.com/uploads/covers/120/1711876899_58.jpg,https://litnet.com/ru/book/gerr-manneling-b477164,"Фэнтези, Историческое фэнтези "
Валерия Соколова,Дворцовый переворот,Тайная представительница императорского рода Дракона чудом выживает в дворцовом перевороте. Ей приходится притворяться простолюдинкой и учиться быть правильной...,https://rust.litnet.com/uploads/covers/120/1711612024_63.png,https://litnet.com/ru/book/gerr-manneling-b477164,"Фэнтези, Историческое фэнтези "
Иннокентий Белов,Комсорг,Обычный попаданец во времена СССР. В свое личное прошлое. Внезапно все вспомнил и теперь готов занять активную жизненную позицию. Тем более появился повод записать...,https://rust.litnet.com/uploads/covers/120/1711389338_51.jpg,https://litnet.com/ru/book/gerr-manneling-b477164,"Фэнтези, Историческое фэнтези "
Олег Рыбаченко ,Царская дыба не для нас,"Недовольные объединением России, Польши и Литвы в единое государство правительства Запада и в первую очередь Ватикан его верный пес - Орден Иезуитов поднимают мят...",https://rust.litnet.com/uploads/covers/120/1711279347_32.jpeg,https://litnet.com/ru/book/gerr-manneling-b477164,"Фэнтези, Историческое фэнтези "
Екатерина Неизвестная,Волкодав,"На этот стих меня вдохновил прочитанный мной цикл Марии Семёновой ""Волкодав"". Собственно и сам стих как раз о главном герое...",https://rust.litnet.com/uploads/covers/120/1711121601_94.jpg,https://litnet.com/ru/book/gerr-manneling-b477164,"Фэнтези, Историческое фэнтези "
Ольга Романовская,Королева из тени,"Вильгельмина и Арман были предначертаны друг другу судьбой. Их объединяло не только происхождение, но и запретная магия, у каждого своя. Вильгельмина принесла Арма...",https://rust.litnet.com/uploads/covers/120/1710787429_36.jpg,https://litnet.com/ru/book/gerr-manneling-b477164,"Фэнтези, Историческое фэнтези "
"Ая Ветова, Светлана Романюк",Три ошибки Софии,"У Софии за плечами неудачный брак, и она уже не верит в семейную идиллию. Да и высокое происхождение обязывает жертвовать личным ради благополучия других.
Ферран р...",https://rust.litnet.com/uploads/covers/120/1707148281_9.jpg,https://litnet.com/ru/book/tri-oshibki-sofii-b467860,"Фэнтези, Историческое фэнтези "
Ева Финова,Соблазнение по-королевски,"Когда тебя предали дважды, а жизнь катится к чертям, не очень-то ждёшь подарков от судьбы. Александр прибыл с консульским визитом в неположенное место в неположенно...",https://rust.litnet.com/uploads/covers/120/1734349499_43.jpg,https://litnet.com/ru/book/tri-oshibki-sofii-b467860,"Фэнтези, Историческое фэнтези "
крыло вальдшнепа,мавка,"рассказ о том ка мама попросила парня сходить в лес, и он наткнулся на прекрасную девушку...",https://rust.litnet.com/common/img/empty_cover_litnet.png,https://litnet.com/ru/book/tri-oshibki-sofii-b467860,"Фэнтези, Историческое фэнтези "
