author,title,annotation,img_url,book_url,genre
Светлана Казакова,Любимый из прошлого,"Поддавшись уговорам подруг погадать на Святки, студентка Полина оказывается в теле своей тёзки из девятнадцатого века и встречает Мстислава Зарецкого — мужчин...",https://rust.litnet.com/uploads/covers/120/1734789635_56.jpg,https://litnet.com/ru/book/zhena-faraona-b108344,"Фэнтези, Историческое фэнтези "
Бернад ,Царевы невесты,"Сказка ложь да в ней намек, красным девицам урок… Сказка и быль причудливо переплетаются. Две девушки – красавицы неожиданно попадают туда, куда попасть, точно, не ...",https://rust.litnet.com/uploads/covers/120/1734787079_33.jpg,https://litnet.com/ru/book/zhena-faraona-b108344,"Фэнтези, Историческое фэнтези "
"Яра Горина, Алёна Соловьёва",Леди любят артефакты 2,"Стать гувернанткой не лучшая участь для благородной леди. Особенно, если воспитанница — сущий кошмар, а ее отец, сиятельный лорд, пытается все держать под контроле...",https://rust.litnet.com/uploads/covers/120/1731938925_31.jpg,https://litnet.com/ru/book/zhena-faraona-b108344,"Фэнтези, Историческое фэнтези "
Алекса Корр,Дикий мир,"Это история про двух непримиримых врагов из 21 века, оказавшихся в далеком прошлом и пытающихся выжить и вернуться обратно. Судьба-злодейка при этом посмеялась над ...",https://rust.litnet.com/uploads/covers/120/1734540351_76.jpg,https://litnet.com/ru/book/zhena-faraona-b108344,"Фэнтези, Историческое фэнтези "
Svetlana,Сквозь туман времени,"Одна ночь изменила судьбу девушки. Теперь она не студентка МГУ, а боярская дочь.
Московия 1606 год, в стране назревает Смута. Встреча Василисы и польского шляхтича бы...",https://rust.litnet.com/uploads/covers/120/1574768963_52.png,https://litnet.com/ru/book/skvoz-tuman-vremeni-b169803,"Фэнтези, Историческое фэнтези "
Майя Тень,Мой хан. Покорюсь тебе,"Все банально и больно. Корпоратив на свежем воздухе. Дождь, начавшийся не вовремя и я, не вовремя вернувшаяся домой. Чужие туфли в коридоре, смутно знакомая блузка н...",https://rust.litnet.com/uploads/covers/120/1743598383_88.jpg,https://litnet.com/ru/book/skvoz-tuman-vremeni-b169803,"Фэнтези, Историческое фэнтези "
"Анна Ромова, Анна Рейнер",Мой (не) любимый колдун,"Случайно вернула к жизни Ледяного колдуна, а он вдруг решил, что я его собственность, да к тому же прекрасно подхожу на роль пешки в его игре. Вот только магия колдун...",https://rust.litnet.com/uploads/covers/120/1732077553_10.jpg,https://litnet.com/ru/book/skvoz-tuman-vremeni-b169803,"Фэнтези, Историческое фэнтези "
Елена Гринн,Истинная королева,"- ...Скажите, пожалуйста, король… умер? 
- Да, король Геранд скончался. И теперь Вы наша королева...
●°●°● 
Двадцать лет назад ее нашли новорожденным младенцем в весе...",https://rust.litnet.com/uploads/covers/120/1701197299_18.jpg,https://litnet.com/ru/book/skvoz-tuman-vremeni-b169803,"Фэнтези, Историческое фэнтези "
Мария Самтенко,Последнее пророчество Эллады: Переиграть Афродиту,"Владыка Аид вернулся в Подземный мир, но покой ему только снится. Теперь Аиду нужно не только спасти Персефону (опять!), но и остановить Афродиту, которая вознамерил...",https://rust.litnet.com/uploads/covers/120/1699085629_82.jpg,https://litnet.com/ru/book/skvoz-tuman-vremeni-b169803,"Фэнтези, Историческое фэнтези "
Арина Теплова,Печать Индиго. Дочь Сварога (1 книга),"Бесплатно ❤️Буктрейлер❤️
1706. Русское царство.
Юная целительница Светослава получает в дар древний кристалл Инглии, открывающий Врата Междумирья. Желая завладет...",https://rust.litnet.com/uploads/covers/120/1655881976_87.jpg,https://litnet.com/ru/book/skvoz-tuman-vremeni-b169803,"Фэнтези, Историческое фэнтези "
Джейд Дэвлин,Королевский тюльпан 2,"Казалось бы, что может сделать со своей судьбой попаданка, всю жизнь посвятившая работе с цветами? А это смотря в какой мир попасть! Когда судьба королевской династ...",https://rust.litnet.com/uploads/covers/120/1634724225_83.jpeg,https://litnet.com/ru/book/skvoz-tuman-vremeni-b169803,"Фэнтези, Историческое фэнтези "
Ана Сакру,Награда ярла Бьорка,"Оля. Мы были любовниками.
Но он предал меня - во всем зависящую от него попаданку. Выбрал власть, женившись на другой и отдав меня своему врагу. Я сбежала, решив разви...",https://rust.litnet.com/uploads/covers/120/1639643907_52.png,https://litnet.com/ru/book/skvoz-tuman-vremeni-b169803,"Фэнтези, Историческое фэнтези "
Джейд Дэвлин,Королевский тюльпан,"Казалось бы, что может сделать со своей судьбой попаданка, всю жизнь посвятившая работе с цветами? А это смотря в какой мир попасть! Когда судьба королевской династ...",https://rust.litnet.com/uploads/covers/120/1626849099_18.jpeg,https://litnet.com/ru/book/skvoz-tuman-vremeni-b169803,"Фэнтези, Историческое фэнтези "
Жанна Штиль,Аллигат. Исход,"Книга третья
Жизнь продолжается.
Возвратившись в своё время, Ольга выясняет, что её душа попала в чужое тело не случайно. Чтобы разобраться во всём, она решает поех...",https://rust.litnet.com/uploads/covers/120/1704296658_27.jpg,https://litnet.com/ru/book/skvoz-tuman-vremeni-b169803,"Фэнтези, Историческое фэнтези "
Анна Осокина,Возвращение снежной совы,"Остаться свободной птицей или вернуть человеческий облик? Для меня выбор очевиден. Но что делать, если обратное превращение грозит смертью, а жених, чтобы не дать э...",https://rust.litnet.com/uploads/covers/120/1688395067_81.jpg,https://litnet.com/ru/book/skvoz-tuman-vremeni-b169803,"Фэнтези, Историческое фэнтези "
"Ева Пик, Ванда Мирская",Огненная избранница Альфы,"На пути из монастыря в отчий дом юная целительница попадает в опасную ловушку. Магический дар спасает от смерти, Альфа волколаков — от жизни без истинной, настояще...",https://rust.litnet.com/uploads/covers/120/1742566566_14.jpg,https://litnet.com/ru/book/skvoz-tuman-vremeni-b169803,"Фэнтези, Историческое фэнтези "
Арина Теплова,Печать Индиго. Владыко Миров (3 книга),"1718 год. Чудом спасаясь из “лап” тьмы, Светослава и ее возлюбленный пытаются скрыться от Тёмных жрецов и их бесчисленного войска. Молодые люди решают отправиться в ...",https://rust.litnet.com/uploads/covers/120/1739558036_17.jpg,https://litnet.com/ru/book/skvoz-tuman-vremeni-b169803,"Фэнтези, Историческое фэнтези "
Ольга Ружникова ,Приютская. Отбор для принца,"Если ты – оборотень-рысь и выросла в Магическом Приюте, то на отбор для принца попадешь разве что охранницей.
А уж если твою сводную сестру зовут Синди... эта сказка ...",https://rust.litnet.com/uploads/covers/120/1632562700_82.jpg,https://litnet.com/ru/book/skvoz-tuman-vremeni-b169803,"Фэнтези, Историческое фэнтези "
Агаша Колч,Немая 2,"Вторая книга цикла ""Немая"".
Хорошо, когда есть любимое дело и окружают люди, ставшие родными. Новый мир принял, Светлые боги благоволят, а прежняя жизнь воспринимает...",https://rust.litnet.com/uploads/covers/120/1618489059_11.jpg,https://litnet.com/ru/book/skvoz-tuman-vremeni-b169803,"Фэнтези, Историческое фэнтези "
Елена Княжинская,Крылья за спиной,"Оставшись одна, Мира оказалась в доме тетки, где не знала ни любви, ни заботы. Ее мир ограничивался небольшим селением, в котором она родилась, а дни были наполнены  б...",https://rust.litnet.com/uploads/covers/120/1684413301_95.png,https://litnet.com/ru/book/skvoz-tuman-vremeni-b169803,"Фэнтези, Историческое фэнтези "
Счастная Елена,Воин Забвения. Гранитный чертог,"Млада, искусная наёмная убийца, приходит в стольный Кирият, чтобы поступить на службу к правителю. Её ведёт ненависть к общему врагу – племени вельдов, что много ле...",https://rust.litnet.com/uploads/covers/120/1484644816_79.jpg,https://litnet.com/ru/book/skvoz-tuman-vremeni-b169803,"Фэнтези, Историческое фэнтези "
Анна Русинова,Целитель душ. Огородница,"Я ж опытный геймер! Стезя хилера у меня на лбу написана, а значит выбираю начальные параметры – красота, красота и ещё раз красота! Меняю силу на внешний вид, ловкост...",https://rust.litnet.com/uploads/covers/120/1644154001_27.jpg,https://litnet.com/ru/book/skvoz-tuman-vremeni-b169803,"Фэнтези, Историческое фэнтези "
Юлия Цыпленкова,Дорогой интриг,"Ах, как же нелегко живется благородной девушке среди предрассудков, царящих в высшем обществе... Замужество и забота о благе супруга - вот и весь путь, что предназнач...",https://rust.litnet.com/uploads/covers/120/1601223109_42.jpg,https://litnet.com/ru/book/skvoz-tuman-vremeni-b169803,"Фэнтези, Историческое фэнтези "
"Олег Ростов, Аника Лиин",Княжна,"В вашу машину попала молния во время грозы? Это ерунда. Нарвались на толпу диких хазар и полян, которые уже тысячу лет как должны были исчезнуть? Тоже не проблема. По...",https://rust.litnet.com/uploads/covers/120/1539824249_20.png,https://litnet.com/ru/book/skvoz-tuman-vremeni-b169803,"Фэнтези, Историческое фэнтези "
Валерия Чернованова,"Похищенная, или Красавица для Чудовища","Желаешь приворожить чужого жениха? Будь готова к самым непредсказуемым последствиям. Тебя могут похитить и привезти в старый дом на болотах, полный загадок и призр...",https://rust.litnet.com/uploads/covers/120/1518251468_48.jpg,https://litnet.com/ru/book/pohishchennaya-ili-krasavica-dlya-chudovishcha-b41482,"Фэнтези, Историческое фэнтези "
Арина Теплова,Печать Индиго. В сиянии Зари (2 книга),"Трилогия.❤️ 1 книга: Дочь Сварога - бесплатно ❤️
1718 год. Русское царство.
Ведунья Светослава всеми силами старается избегать общества фон Рембера, считая его чудо...",https://rust.litnet.com/uploads/covers/120/1625247961_88.png,https://litnet.com/ru/book/pohishchennaya-ili-krasavica-dlya-chudovishcha-b41482,"Фэнтези, Историческое фэнтези "
"Илона Волынская, Кирилл Кащеев",Ведьма и компания,"Эй, оглянись! Дракон идет по соседней улице!
Эта компания знает, что в другой мир не обязательно ПОПАДАТЬ. Туда можно съездить в командировку или сбегать на свидани...",https://rust.litnet.com/uploads/covers/120/1581707208_53.jpg,https://litnet.com/ru/book/pohishchennaya-ili-krasavica-dlya-chudovishcha-b41482,"Фэнтези, Историческое фэнтези "
Делия Росси,Ловушка для светлой леди,"ЧАСТЬ 1 ДОЧЬ ЮГА
""Это история падения и восстания, борьбы и смирения, поражения и победы.
Эта история - о ненависти и любви, о горении и страсти, о горечи расставаний ...",https://rust.litnet.com/uploads/covers/120/1617962602_80.jpg,https://litnet.com/ru/book/pohishchennaya-ili-krasavica-dlya-chudovishcha-b41482,"Фэнтези, Историческое фэнтези "
Лина Олан,Воскресшая,"Безумную жену герцога Кая Соранто ссылают в обитель Молчаливых Матерей. Туда, откуда не возвращаются. Он был так счастлив избавиться от ненавистной и нелюбимой жен...",https://rust.litnet.com/uploads/covers/120/1621417364_32.png,https://litnet.com/ru/book/pohishchennaya-ili-krasavica-dlya-chudovishcha-b41482,"Фэнтези, Историческое фэнтези "
Полина Белова,Касси,"Скромная, порядочная, нежная девушка из-за безответной первой любви к мерзавцу попадает в водоворот событий и оказывается подарком для жестокого альфы степной ста...",https://rust.litnet.com/uploads/covers/120/1558033212_71.png,https://litnet.com/ru/book/pohishchennaya-ili-krasavica-dlya-chudovishcha-b41482,"Фэнтези, Историческое фэнтези "
Регина Грез,Ведунья и богатырь,"Нечай спас в лесу молодую травницу, она залечила его рану и проводила в город. А после вызвалась вместе идти на опасное княжеское задание. По пути придется спросить ...",https://rust.litnet.com/uploads/covers/120/1606810263_73.jpg,https://litnet.com/ru/book/pohishchennaya-ili-krasavica-dlya-chudovishcha-b41482,"Фэнтези, Историческое фэнтези "
Елена Белильщикова,Наставница для попаданца,"- Тёмный князь бросил тебя! - В бешенстве проговорил Алекс. - Сделал своей игрушкой, впутал в интриги, а потом исчез! 
- Чем ты лучше?! - Диана гневно сверкнула глазами. - ...",https://rust.litnet.com/uploads/covers/120/1626347308_19.jpg,https://litnet.com/ru/book/pohishchennaya-ili-krasavica-dlya-chudovishcha-b41482,"Фэнтези, Историческое фэнтези "
Делия Росси,Ловушка для светлой леди 2,"ЧАСТЬ 2 РОЗА СЕВЕРА
""Это история падения и восстания, борьбы и смирения, поражения и победы.
Эта история - о ненависти и любви, о горении и страсти, о горечи расставан...",https://rust.litnet.com/uploads/covers/120/1619946444_18.jpg,https://litnet.com/ru/book/pohishchennaya-ili-krasavica-dlya-chudovishcha-b41482,"Фэнтези, Историческое фэнтези "
Марина Дунаева ,Ведьма из сумрачного леса.,"Мне пришлось убежать от родителей и лес стал моим домом, там скрылась у старой ведьмы.
И все было хорошо, пока в один день на лесной полянке я не встретила сына лорда....",https://rust.litnet.com/uploads/covers/120/1713360924_95.jpg,https://litnet.com/ru/book/pohishchennaya-ili-krasavica-dlya-chudovishcha-b41482,"Фэнтези, Историческое фэнтези "
Наталья Лакота (Ната Лакомка),Танцовщица для подземного бога,"Чтобы завоевать любовь царя богов, танцовщица Анджали готова на всё. Даже спуститься в подземное царство Паталу, где обитают наги - полулюди-полузмеи, и стать покор...",https://rust.litnet.com/uploads/covers/120/1690178808_29.jpg,https://litnet.com/ru/book/pohishchennaya-ili-krasavica-dlya-chudovishcha-b41482,"Фэнтези, Историческое фэнтези "
Делия Росси,Лед твоих объятий,"Когда отец отправил меня в древний замок, я и представить не могла, во что выльется эта поездка.

Ночь, проведенная в древнем склепе, портрет Истинного Ледяного, веч...",https://rust.litnet.com/uploads/covers/120/1621237285_3.jpg,https://litnet.com/ru/book/pohishchennaya-ili-krasavica-dlya-chudovishcha-b41482,"Фэнтези, Историческое фэнтези "
Олла Дез,Клариса. По ту сторону холста,"Каждый из нас ищет свой путь, своё место в этом мире. Но возможно ли, что твоё место вовсе не в родном мире. Иногда стоит лишь приглядеться к самой обычной картине в п...",https://rust.litnet.com/uploads/covers/120/1628922339_49.jpg,https://litnet.com/ru/book/pohishchennaya-ili-krasavica-dlya-chudovishcha-b41482,"Фэнтези, Историческое фэнтези "
Елена Амеличева,"Мне нельзя тебя любить, оборотень","Красавчику-оборотню, рожденному служить нашему ковену, не позволено даже думать обо мне, младшей дочери Верховной ведьмы. Но его медовые глаза так сияют, когда вопр...",https://rust.litnet.com/uploads/covers/120/1597764816_68.png,https://litnet.com/ru/book/pohishchennaya-ili-krasavica-dlya-chudovishcha-b41482,"Фэнтези, Историческое фэнтези "
Регина Птица,Ведьмы отряда Огненный Феникс,"Прошли годы с тех пор, как ведьмы победили в войне света и тьмы. Теперь последний тёмный маг томится в плену подземелий света. Ната - ветеран войны и капитан секретно...",https://rust.litnet.com/uploads/covers/120/1627825450_74.jpg,https://litnet.com/ru/book/pohishchennaya-ili-krasavica-dlya-chudovishcha-b41482,"Фэнтези, Историческое фэнтези "
Татьяна Рябинина,Поцелуй Ледяной розы,"Леди Мэрион Беннет, дочь графа Скайворта, за красоту и неприступность прозвали Ледяной розой. Рыцарь Анри де Дюньер единственный, кому удалось сорвать поцелуй с ее ...",https://rust.litnet.com/uploads/covers/120/1724791621_68.jpg,https://litnet.com/ru/book/pohishchennaya-ili-krasavica-dlya-chudovishcha-b41482,"Фэнтези, Историческое фэнтези "
Вика Мельникова,Жених для васконки,"Что скажет сердце Эвон, когда денежный вопрос больше не стоит, а сама юная васконка попадает в столицу, полную искушений и интриг? Что произойдет с дружбой трех мале...",https://rust.litnet.com/uploads/covers/120/1510602747_96.jpg,https://litnet.com/ru/book/pohishchennaya-ili-krasavica-dlya-chudovishcha-b41482,"Фэнтези, Историческое фэнтези "
Тори Озолс,"С днем рождения, фейри","Миниатюра написанная для флэшмоба, группы ВК ""Для тех, кто любит читать фэнтези"".
Празднуют ли фейри день рождение....",https://rust.litnet.com/uploads/covers/120/1510436801_53.jpg,https://litnet.com/ru/book/pohishchennaya-ili-krasavica-dlya-chudovishcha-b41482,"Фэнтези, Историческое фэнтези "
Татьяна Богатырева и Евгения Соловьева,Обрученная с фениксом,"Слава Генри Моргана гремит от Средиземноморья до Карибов. Но никто не знает, что самый удачливый пират семи морей — Марина, дочь морского фейри, сбежавшая от ненави...",https://rust.litnet.com/uploads/covers/120/1546602296_12.jpg,https://litnet.com/ru/book/pohishchennaya-ili-krasavica-dlya-chudovishcha-b41482,"Фэнтези, Историческое фэнтези "
Ева Финова,Милашка из магической общаги,"Комендант мужского общежития некромантов по прозвищу Милашка, как думаете, о ком это?
А если обо мне? Повезло? Увы, нет. 
Ведь я притворилась парнем и стала временной ...",https://rust.litnet.com/uploads/covers/120/1733357689_48.jpg,https://litnet.com/ru/book/pohishchennaya-ili-krasavica-dlya-chudovishcha-b41482,"Фэнтези, Историческое фэнтези "
Эйлин Торен,Ошибка архитектора,"Многогранная история о семье, о чувствах, над которыми мы не властны. Очень эмоциональные отношения, запутанные и кажется безысходные. Судьбы, жизни и чувства герое...",https://rust.litnet.com/uploads/covers/120/1704891319_77.png,https://litnet.com/ru/book/oshibka-arhitektora-b464526,"Фэнтези, Историческое фэнтези "
Элис Карма,Измена. Охотница из графства Медведя,"— Я хочу расторгнуть наш брак, — произносит муж, и Эссиль кажется, что её сердце остановилось.
Она до последнего надеялась, что у Фалко просто интрижка. Но если ...",https://rust.litnet.com/uploads/covers/120/1714073937_22.jpg,https://litnet.com/ru/book/oshibka-arhitektora-b464526,"Фэнтези, Историческое фэнтези "
