author,title,annotation,img_url,book_url,genre
Арина Теплова,Наследница Дивной усадьбы,"Я очутилась в теле юной графини Шереметьевой. Двадцати двух лет от роду и с маленькой дочкой на руках. С неверным мужем, который жаждет выгнать меня из своего помест...",https://rust.litnet.com/uploads/covers/120/1719331871_65.jpg,https://litnet.com/ru/book/naslednica-divnoi-usadby-b483842,"Фэнтези, Историческое фэнтези "
Яна Павлова,Все люди как люди. Княгиня,"Высшие силы дали Акулине шанс - если она справится с заданием, то сможет вернуться к мужу и прожить жизнь так, как сама захочет. Но задача поставлена со звездочкой. Н...",https://rust.litnet.com/uploads/covers/120/1749484561_16.png,https://litnet.com/ru/book/naslednica-divnoi-usadby-b483842,"Фэнтези, Историческое фэнтези "
Боярова Мелина,Брак по расчету. Счастью не прикажешь,"Рядовая поездка в приют для одаренных сирот приводит княжну Орлову в лапы к мастеру крови и темных искусств. Кошмар, преследующий в снах со студенческих времен, воз...",https://rust.litnet.com/uploads/covers/120/1710366938_84.jpg,https://litnet.com/ru/book/naslednica-divnoi-usadby-b483842,"Фэнтези, Историческое фэнтези "
Теплая Елена,Когда-то много лет назад...,( БЕСПЛАТНО) Забытая родней пенсионерка Валерия по воле рока оказывается в теле юной девушки и переносится в далекую доисторическую эпоху. Здесь ей предстоит не то...,https://rust.litnet.com/uploads/covers/120/1696765165_91.jpg,https://litnet.com/ru/book/naslednica-divnoi-usadby-b483842,"Фэнтези, Историческое фэнтези "
Вернэлия Хайд,Пленница его величества,"‍❤️‍Промо первые 7 дней ‍❤️‍
Бежав от ненавистного брака, я и представить не могла, что очнусь в теле пленной принцессы, чье королевство на грани гибели. Еди...",https://rust.litnet.com/uploads/covers/120/1745982877_97.jpg,https://litnet.com/ru/book/naslednica-divnoi-usadby-b483842,"Фэнтези, Историческое фэнтези "
Александр Зимовец,Военный сезон,"Прошло полгода после окончания Дуэльного сезона в Маринбурге. Даша с тех пор не видала Кирилла Стужева, с которым они нынче служат на разных участках Разлома – ж...",https://rust.litnet.com/uploads/covers/120/1741680090_44.jpg,https://litnet.com/ru/book/naslednica-divnoi-usadby-b483842,"Фэнтези, Историческое фэнтези "
Тата Шах,Верю или не верю!,"Девушка не верит никому и ничему, но даже она поддается любопытству и оказывается в другом мире, совсем не похожем на ее родной. Стать ведьмочкой? Пожалуйста. Найти ...",https://rust.litnet.com/uploads/covers/120/1605293752_1.jpg,https://litnet.com/ru/book/naslednica-divnoi-usadby-b483842,"Фэнтези, Историческое фэнтези "
Наталья Лакота (Ната Лакомка),Мельничиха из Тихого Омута-2,"Моя жизнь в деревне Тихий Омут продолжается. Теперь я - не забитая и запуганная вдова мельника, а почти что деловая леди. Вот поставлю на поток производство бумаги, к...",https://rust.litnet.com/uploads/covers/120/1610463777_15.jpg,https://litnet.com/ru/book/naslednica-divnoi-usadby-b483842,"Фэнтези, Историческое фэнтези "
Юлия Меллер,"Не жизнь, а роман!","— Что это? Телепорт, машина времени или звёздные врата? – усмехнулась Катюша.
— А вот это тебе предстоит узнать самой, – и он с силой втолкнул её внутрь.
Кат...",https://rust.litnet.com/uploads/covers/120/1692197685_64.png,https://litnet.com/ru/book/naslednica-divnoi-usadby-b483842,"Фэнтези, Историческое фэнтези "
Такаббир,Династия. Белая Кость,"Первая часть цикла

Правительница Шамидана скончалась. Герцог Рэн Хилд возвращается из изгнания, чтобы взойти на престол и стать родоначальником династии Хилдов. ...",https://rust.litnet.com/uploads/covers/120/1714138726_67.jpg,https://litnet.com/ru/book/naslednica-divnoi-usadby-b483842,"Фэнтези, Историческое фэнтези "
Кати Владмар,"Нежеланный брак, или уроки любви для герцога","Говорят, учитель должен находить подход к любому ученику. Но что делать учительнице начальных классов, если её задача: воспитать не школьника, а высокомерного герц...",https://rust.litnet.com/uploads/covers/120/1742569943_0.jpg,https://litnet.com/ru/book/naslednica-divnoi-usadby-b483842,"Фэнтези, Историческое фэнтези "
Елена Милютина,"Боярин Воеводин, или чересчур громкий Тишайший","Бегут года, взрослеют и даже стареют герои. Что способствовало смерти Михаила, первого царя династии Романовых? Откуда взялась пресловутая меланхолия и ""водяная бо...",https://rust.litnet.com/uploads/covers/120/1736873590_32.jpg,https://litnet.com/ru/book/naslednica-divnoi-usadby-b483842,"Фэнтези, Историческое фэнтези "
Мелиса Ригер,Фальшивая невеста для графа,"Я всегда оставалась в тени своей идеальной сестры, Адель — гордости семьи Ланкастер. Но всё изменилось, когда она сбежала с любовником, бросив нашу семью на гр...",https://rust.litnet.com/uploads/covers/120/1738877576_33.png,https://litnet.com/ru/book/naslednica-divnoi-usadby-b483842,"Фэнтези, Историческое фэнтези "
Наталья Лакота (Ната Лакомка),(с)нежная роза,"В нашей семье меня считают умной, а мою сестру Айрис - красивой. Но говорят: не родись красивой, а родись счастливой. И странная женщина со странной белой кошкой нага...",https://rust.litnet.com/uploads/covers/120/1737367353_67.jpg,https://litnet.com/ru/book/naslednica-divnoi-usadby-b483842,"Фэнтези, Историческое фэнтези "
Юлия Марлин,Жена Хозяина темного замка,"Один поворот Колеса, и я очнулась в теле бывшей фаворитки Императора. Месть ревнивой правительницы была страшна. Она сослала меня на самый край Империи и отдала в ж...",https://rust.litnet.com/uploads/covers/120/1726745037_29.png,https://litnet.com/ru/book/naslednica-divnoi-usadby-b483842,"Фэнтези, Историческое фэнтези "
Наталья Лакота (Ната Лакомка),Его (с)нежность,"Правитель севера приехал в наше королевство, чтобы женить своих сыновей. Но проблема в том, что сыновей двое, а нас – ровно семь принцесс. Так что повезёт не всем. И е...",https://rust.litnet.com/uploads/covers/120/1737378415_39.jpg,https://litnet.com/ru/book/naslednica-divnoi-usadby-b483842,"Фэнтези, Историческое фэнтези "
Ольга Иконникова,Хозяйка старого поместья,"Чтобы избежать позора и обвинения в колдовстве, мне пришлось выйти замуж за мрачного графа де Валенсо. Но наш семейный союз оказался недолгим – мой супруг ушел на в...",https://rust.litnet.com/uploads/covers/120/1692732641_94.jpg,https://litnet.com/ru/book/naslednica-divnoi-usadby-b483842,"Фэнтези, Историческое фэнтези "
Полина Змееяд (Аманда Франкон),Я - жена злодея?! Требую развод!,"Это же надо было так попасть! Мало того, что в мир мрачного, жестокого романа, так еще и в тело жены главного злодея, которая умрет раньше, чем герой успеет расправить...",https://rust.litnet.com/uploads/covers/120/1739186963_6.png,https://litnet.com/ru/book/naslednica-divnoi-usadby-b483842,"Фэнтези, Историческое фэнтези "
Жанна Штиль,Леди из будущего. Приглашение на казнь,"Книга вторая
Волей судьбы Наташа попала из двадцать первого века в одиннадцатый. Ей ничего не остаётся как с болью и мукой принять действительность.
Жизнь продолжа...",https://rust.litnet.com/uploads/covers/120/1704838854_61.jpg,https://litnet.com/ru/book/naslednica-divnoi-usadby-b483842,"Фэнтези, Историческое фэнтези "
Олег Ростов,Александра,"Не знаю чьей волей, но явно ко мне недоброжелательной, я оказалась в далёком прошлом своего народа. 16 век, страшная и кровавая эпоха. Мои предки русичи противостоят ...",https://rust.litnet.com/uploads/covers/120/1626360475_67.jpeg,https://litnet.com/ru/book/naslednica-divnoi-usadby-b483842,"Фэнтези, Историческое фэнтези "
Хэйли Джейкобс,Обречены на поражение,"Патриция Олдрин живет с теткой-опекуншей и совсем скоро снимет траурное платье, чтобы вновь заявить о себе на рынке невест. Увы, данное положение дел совсем не раду...",https://rust.litnet.com/uploads/covers/120/1746697928_42.png,https://litnet.com/ru/book/obrecheny-na-porazhenie-b528758,"Фэнтези, Историческое фэнтези "
Наталья Смеречинская,"Любовь, ферма и коза в придачу","Не всем попаданкам везет! Кто-то получает принца, внешность, статус, а кому-то  приходиться пробивать себе дорогу в магическом мире самостоятельно. Вот как Лидии на...",https://rust.litnet.com/uploads/covers/120/1641622664_79.jpg,https://litnet.com/ru/book/obrecheny-na-porazhenie-b528758,"Фэнтези, Историческое фэнтези "
Полина Белова,Самая старшая,"Руководитель кружка ""умелые ручки"" в доме культуры, учитель на пенсии, Мария Михайловна попадает в другой мир, где есть магия, но по бытовому развитию соответствующ...",https://rust.litnet.com/uploads/covers/120/1621792068_8.jpeg,https://litnet.com/ru/book/obrecheny-na-porazhenie-b528758,"Фэнтези, Историческое фэнтези "
Наталья Лакота (Ната Лакомка),Фея придёт под новый год,"Под новый год все ждут прихода феи, которая исполняет заветные желания. Но у меня лишь одно желание – спрятаться, чтобы никакая фея меня не нашла. Скрываясь от корол...",https://rust.litnet.com/uploads/covers/120/1609175375_1.jpg,https://litnet.com/ru/book/obrecheny-na-porazhenie-b528758,"Фэнтези, Историческое фэнтези "
Оксана Зиентек,Женить дипломата,"Что делать, если отец и долг перед страной срочно приказывают остепениться и завести наследника? Конечно, жениться. 
Что делать, если тебе катастрофически не везет ...",https://rust.litnet.com/uploads/covers/120/1567795594_92.jpg,https://litnet.com/ru/book/obrecheny-na-porazhenie-b528758,"Фэнтези, Историческое фэнтези "
Евгения Бергер,Хозяйка Айфорд-мэнор,"Поступив как послушная дочь и пойдя к алтарю с нелюбимым, Аделия не могла и представить, что ждет ее впереди... Красивая свадьба? Любящий и богатый супруг? Дом — полн...",https://rust.litnet.com/uploads/covers/120/1614840280_92.jpg,https://litnet.com/ru/book/obrecheny-na-porazhenie-b528758,"Фэнтези, Историческое фэнтези "
Елена Горская,Право на любовь,"Дрейк Гордон всегда готов встать на  защиту красивой женщины. Но вот только охранять ему придется Вивьен Мэлоун, своенравную француженку, которая разбила о е...",https://rust.litnet.com/uploads/covers/120/1693996014_33.jpg,https://litnet.com/ru/book/obrecheny-na-porazhenie-b528758,"Фэнтези, Историческое фэнтези "
Марго Акиньшина,Чаровница. Русь.,"Она видит прошлое и будущее, умеет управлять разумом животных, владеет тайнами целительства. Однако этот дар - ее проклятье. Ведь он запрещает ей любить, в то время к...",https://rust.litnet.com/uploads/covers/120/1748606170_67.jpg,https://litnet.com/ru/book/obrecheny-na-porazhenie-b528758,"Фэнтези, Историческое фэнтези "
"Алина Углицкая, Лилия Орланд",Защитник для чужой невесты-1,"Между людьми и драконами вновь разгорелась война. А сильнейший маг королевства герцог Минрах надумал жениться на Хлое, дочери обедневшего дворянина. Он отправляет...",https://rust.litnet.com/uploads/covers/120/1746380636_69.jpg,https://litnet.com/ru/book/obrecheny-na-porazhenie-b528758,"Фэнтези, Историческое фэнтези "
Елена Добрынина,(не)знакомка с Руанской дороги,"Приехать в командировку в одну из французских провинций, пойти вечером за водой в магазин и... очнуться на дне телеги в первой трети XVII века? Я бы так и прозябала в оф...",https://rust.litnet.com/uploads/covers/120/1734269091_85.png,https://litnet.com/ru/book/obrecheny-na-porazhenie-b528758,"Фэнтези, Историческое фэнтези "
Теона Рэй,Замуж до утра,"Отец привел домой молодую любовницу и выгнал меня на улицу. В отчаянии я вышла замуж за незнакомца, чтобы спасти его от позора и заработать самой. Я хотела помочь му...",https://rust.litnet.com/uploads/covers/120/1727298085_9.jpg,https://litnet.com/ru/book/obrecheny-na-porazhenie-b528758,"Фэнтези, Историческое фэнтези "
Агата Грин,Усадьба толстушки Астрид,"После смерти судьба дала мне второй шанс, и я оказалась в теле молодой женщины из другого мира. Теперь я наивная толстушка Астрид, с которой хочет развестись муж. Зд...",https://rust.litnet.com/uploads/covers/120/1725337653_19.jpg,https://litnet.com/ru/book/obrecheny-na-porazhenie-b528758,"Фэнтези, Историческое фэнтези "
"Дия Сёмина, Ди Сёмина",С.Т.О. попаданки. Красотка рулит,"— От тебя отказались все женихи, даже нищий священник, а уж они-то и дурнушками не брезгуют. Никто не хочет рыжих наследников! Кэтрин, ты самая незавидная невес...",https://rust.litnet.com/uploads/covers/120/1732788132_62.jpg,https://litnet.com/ru/book/obrecheny-na-porazhenie-b528758,"Фэнтези, Историческое фэнтези "
Ольга Арунд,Проклятие Анершерата. Последний вызов,"— Я не знал отказов, малышка. Не было никакой любви. Страсть, похоть, желание подчинить — да, возможно. Но не любовь. Не каждая может принять и привыкнуть, если хо...",https://rust.litnet.com/uploads/covers/120/1713345277_55.png,https://litnet.com/ru/book/obrecheny-na-porazhenie-b528758,"Фэнтези, Историческое фэнтези "
Татьяна Дин,Попаданка. Реальная история,"Все попаданки, как попаданки, оказываются в телах других людей. Кому-то везёт больше и они оказываются в теле королевы или принцессы. Другие же попадают в тело прост...",https://rust.litnet.com/uploads/covers/120/1723461203_91.png,https://litnet.com/ru/book/obrecheny-na-porazhenie-b528758,"Фэнтези, Историческое фэнтези "
Лара Барох,Хозяйка дома Риччи,"История о девушке, которая нашла себя в другом мире. Да, ей повезло немного больше, ведь она очнулась в состоятельной семье. Но это награда или наказание?

Роскошная ...",https://rust.litnet.com/uploads/covers/120/1701369504_41.jpg,https://litnet.com/ru/book/obrecheny-na-porazhenie-b528758,"Фэнтези, Историческое фэнтези "
Анастасия Миллюр,Замуж по контракту,"— Женитесь на мне, — выпалила я. 
Его брови дрогнули. Он отнял руку от лица и посмотрел на меня в упор. 
— Повторите.
— Вы не ослышались.
— Я знаю, что не ослышался. Я д...",https://rust.litnet.com/uploads/covers/120/1715158691_59.jpg,https://litnet.com/ru/book/obrecheny-na-porazhenie-b528758,"Фэнтези, Историческое фэнтези "
Жанна Штиль,Нежное создание. Книга первая,"Они не должны были встретиться.
Она — наша современница, оканчивает пятый курс художественно-графического факультета педагогического университета.
Он — воен...",https://rust.litnet.com/uploads/covers/120/1746984481_47.jpg,https://litnet.com/ru/book/obrecheny-na-porazhenie-b528758,"Фэнтези, Историческое фэнтези "
Салма Кальк ,Я сделаю это сама,"Евгения Ивановна умеет всё. Сошьёт, приготовит, споёт, спляшет, расскажет сказку, напишет продающий пост, подготовит отчёт, выстоит на ковре у директора и договорит...",https://rust.litnet.com/uploads/covers/120/1670648468_76.jpg,https://litnet.com/ru/book/obrecheny-na-porazhenie-b528758,"Фэнтези, Историческое фэнтези "
Тая Ан,"Как приручить злодея. Практическое пособие для ""старых дев""","Сбежать от одного злодея, чтобы попасть в лапы другого? Могу, умею, практикую! Жаль, из этих лап уже не вырваться. А если не вырваться, то что? Правильно, приручить! 
То...",https://rust.litnet.com/uploads/covers/120/1716320535_54.jpg,https://litnet.com/ru/book/obrecheny-na-porazhenie-b528758,"Фэнтези, Историческое фэнтези "
Салма Кальк ,Хранительница его сокровищ,"Лизавета, сотрудник фондов провинциального музея, находит среди новых экспонатов непонятный предмет и пытается его почистить, а он в ответ переносит её неведомо к...",https://rust.litnet.com/uploads/covers/120/1584633928_21.jpg,https://litnet.com/ru/book/xranitelnica-ego-sokrovishch-b182669,"Фэнтези, Историческое фэнтези "
"Оксана Северная, Гуйда Елена",Непокорный трофей,"Я всегда знала, какая судьба мне уготована - залог мира, супруга короля, правительница. И я готовилась к такой жизни. Но стала трофеем варвара. Теперь я - заложница, пл...",https://rust.litnet.com/uploads/covers/120/1687941344_43.jpg,https://litnet.com/ru/book/xranitelnica-ego-sokrovishch-b182669,"Фэнтези, Историческое фэнтези "
Полина Ром,Выбор варианта,"Банальная история попаданки в банальное средневековье.
Принца не будет, равно, как и бальных платьев. А будет нищая деревня рыбаков, нестандартный социум и бытовые...",https://rust.litnet.com/uploads/covers/120/1699355492_66.jpg,https://litnet.com/ru/book/xranitelnica-ego-sokrovishch-b182669,"Фэнтези, Историческое фэнтези "
Инесса Иванова,Проклятый двор. Невеста вне времени,"Я могу ускорять время, отпущенное человеку. Я рождена в купеческой семье и с тёмным даром.
Я влюблена в жениха своей молочной сестры-княжны, в доме которой воспитыва...",https://rust.litnet.com/uploads/covers/120/1748512676_89.jpg,https://litnet.com/ru/book/xranitelnica-ego-sokrovishch-b182669,"Фэнтези, Историческое фэнтези "
Инесса Иванова,Книжная королева 2. Чума вас побери!,"Я попала в книгу на место ненужной королевы, томящейся в замке на окраине страны. По сюжету её должны убить по дороге в столицу. В книге ничего не сказано про то, кто ...",https://rust.litnet.com/uploads/covers/120/1744474508_38.jpg,https://litnet.com/ru/book/xranitelnica-ego-sokrovishch-b182669,"Фэнтези, Историческое фэнтези "
Виктория Богачева ,Опасная игра леди Эвелин,"ФИНАЛ!
Леди Эвелин, дочь опального герцога, привыкла полагаться только на себя. Когда ее лучшая подруга исчезает, она начинает расследование, которое приводит её в ...",https://rust.litnet.com/uploads/covers/120/1736964570_59.jpg,https://litnet.com/ru/book/xranitelnica-ego-sokrovishch-b182669,"Фэнтези, Историческое фэнтези "
