author,title,annotation,img_url,book_url,genre
Рэдрик,Жребий,"Вы подходите к последней линии, к самой кромке и вам предлагается жребий: или потерять всё или взять что-то одно. А как быть, если вы хотите пронести многое, потому чт...",https://rust.litnet.com/uploads/covers/120/1611913272_41.jpg,https://litnet.com/ru/book/tainy-iz-proshlogo-b360683,"Фэнтези, Историческое фэнтези "
Наталья Щеголева,Путь домой. Год надежды.,"Убить и быть убитым – таков план Виктора. Восстановить друга в правах на титул предков – такова надежда Жана. Однажды проснуться и обнаружить, что ее замужество, эт...",https://rust.litnet.com/uploads/covers/120/1608922164_99.jpg,https://litnet.com/ru/book/tainy-iz-proshlogo-b360683,"Фэнтези, Историческое фэнтези "
Снежана Масалыкина (Ея Россо),"Легенды радужного мира - путеводитель ""Шагнув за радугу""","Мифическая книга, в которой собраны легенды, мифы и сказания Радужного мира
Спасибо за новую обложку моей фее-напарнице Анне Зюман!...",https://rust.litnet.com/uploads/covers/120/1601891423_74.jpg,https://litnet.com/ru/book/tainy-iz-proshlogo-b360683,"Фэнтези, Историческое фэнтези "
Татьяна Бессонная,Дочь Монтесумы,"...Уже практически обнажённая (не считая набедренной повязки и покрывала длинных растрёпанных волос), Отоми с ужасом наблюдала как в комнату входит ещё один белый д...",https://rust.litnet.com/uploads/covers/120/1595576954_4.jpg,https://litnet.com/ru/book/tainy-iz-proshlogo-b360683,"Фэнтези, Историческое фэнтези "
Lia Fe,Надежда,"Короткая славянская сказка о том, что даже в самые тёмные периоды нашей жизни можно отыскать лучик света. Никогда не стоит пренебрегать надеждой. Ведь она может ста...",https://rust.litnet.com/uploads/covers/120/1651530974_77.jpg,https://litnet.com/ru/book/tainy-iz-proshlogo-b360683,"Фэнтези, Историческое фэнтези "
Анастасия Вихарева,Семиречинская Академия. Наследство бабки Авдотьи,"ЧАСТЬ I: Брат, похоже, сошел с ума. Связавшись с мошенниками, спустил все, что оставил отец. Так Кирилл оказался в деревне. Но именно там, пройдя через испытания, он отк...",https://rust.litnet.com/uploads/covers/120/1587641629_86.jpg,https://litnet.com/ru/book/tainy-iz-proshlogo-b360683,"Фэнтези, Историческое фэнтези "
Елена - Стихия,Взрыв мозга,"Виктория считает себя землянкой, но всё оказалось совершенно не так. И только в своем мире она узнает про себя и свою семью. И огромную помощь ей предоставил её собс...",https://rust.litnet.com/uploads/covers/120/1561740027_24.jpg,https://litnet.com/ru/book/tainy-iz-proshlogo-b360683,"Фэнтези, Историческое фэнтези "
Александра Турлякова,В первый зимний день,"В первый день наступившей зимы, когда земля укрывалась снегом, он встретил его... Встреча эта предопределена свыше, и можно ли изменить свою судьбу?...",https://rust.litnet.com/uploads/covers/120/1588776424_86.jpg,https://litnet.com/ru/book/tainy-iz-proshlogo-b360683,"Фэнтези, Историческое фэнтези "
Anna Stolz,Песнь пустоши,"У Него отобрали все: княжий престол, красавицу невесту, родимый дом. Отобрал тот, на кого Он даже и помыслить не мог. В душе поселилась черная злоба, пожирая нутро, сл...",https://rust.litnet.com/uploads/covers/120/1491242617_73.jpg,https://litnet.com/ru/book/tainy-iz-proshlogo-b360683,"Фэнтези, Историческое фэнтези "
Ольга Феникс,01. Вопрос Жизни и Смерти!,"Танго было их танцем. Она рвалась в полёт, Он жаждал Её удержать. Её шаги были резки и продуманы, Его — спокойны и верны, но одна случайная ошибка обратилась горящими...",https://rust.litnet.com/uploads/covers/120/1694416021_14.jpg,https://litnet.com/ru/book/tainy-iz-proshlogo-b360683,"Фэнтези, Историческое фэнтези "
Федор Кумарин,Гардарика: Тени войны,"Русь XIII века. Время раздробленности, кровавых междоусобиц и войн. Русь уязвима, как никогда прежде. Братство богатырей и Союз волшебников, которые прежде стояли на ...",https://rust.litnet.com/uploads/covers/120/1644055218_83.jpg,https://litnet.com/ru/book/tainy-iz-proshlogo-b360683,"Фэнтези, Историческое фэнтези "
Николь Арнд,Кристалл  Атлантиды,"Они  атланты, еще  до  гибели  Атлантиды   встретились. Но  судьба   распорядилась  иначе, в аварии, что  подстроили  против  Афарона , погибает  его любимая  невеста  .  Аф...",https://rust.litnet.com/uploads/covers/120/1676795235_55.jpg,https://litnet.com/ru/book/tainy-iz-proshlogo-b360683,"Фэнтези, Историческое фэнтези "
Руслан Самигуллин,Девять грехов,"Верите ли вы в то, что наши действия определяют загробную судьбу души?
Возможно ли поверить в существование ада?
Есть ли у заблудшей души путь назад?
Может ли обычн...",https://rust.litnet.com/uploads/covers/120/1640066429_44.jpg,https://litnet.com/ru/book/tainy-iz-proshlogo-b360683,"Фэнтези, Историческое фэнтези "
Светлая эльфийка,Я знаю ваше имя,Юная графиня отправлена на обучение в АБИ закончив школу с отличием наша героиня храбро сражается за Английского короля. Что ждёт нашу героиню ка...,https://rust.litnet.com/uploads/covers/120/1637073416_28.jpeg,https://litnet.com/ru/book/tainy-iz-proshlogo-b360683,"Фэнтези, Историческое фэнтези "
Александр Клюквин,Память,ПАМЯТЬ...,https://rust.litnet.com/uploads/covers/120/1635484559_81.jpg,https://litnet.com/ru/book/tainy-iz-proshlogo-b360683,"Фэнтези, Историческое фэнтези "
Александр Клюквин,Supernatural,SUPERNATURAL...,https://rust.litnet.com/uploads/covers/120/1635392651_28.jpg,https://litnet.com/ru/book/tainy-iz-proshlogo-b360683,"Фэнтези, Историческое фэнтези "
Мак Роберт,Странник 8,"Здравствуйте ! Представляю Вашему вниманию серию рассказов в стиле Кельтское Фэнтези. Общая нить сюжета - определенные персонажи, которые имеют знания друидов. Эти...",https://rust.litnet.com/uploads/covers/120/1635404847_72.png,https://litnet.com/ru/book/tainy-iz-proshlogo-b360683,"Фэнтези, Историческое фэнтези "
Мак Роберт,Чужеземец 9,"Здравствуйте ! Представляю Вашему вниманию серию рассказов в стиле Кельтское Фэнтези. Общая нить сюжета - определенные персонажи, которые имеют знания друидов. Эти...",https://rust.litnet.com/uploads/covers/120/1635338788_30.png,https://litnet.com/ru/book/tainy-iz-proshlogo-b360683,"Фэнтези, Историческое фэнтези "
Анна Замосковная,Мачеха,"С первого дня на Олимпе, с того самого мига, как увидел блистательную, гневную Геру, с трудом подавлявшую злость, едва в родственных объятиях сжал округлые плечи, пр...",https://rust.litnet.com/uploads/covers/120/1496619264_12.jpg,https://litnet.com/ru/book/macheha-b34292,"Фэнтези, Историческое фэнтези "
Александра Ром,Легенда о Белом Змее,"За темными горами, непроходимыми лесами, за блуждающими болотами и бескрайним морем простираются земли крылатых змеев. И нет страшнее и кровожаднее твари на всем ...",https://rust.litnet.com/uploads/covers/120/1492358647_37.png,https://litnet.com/ru/book/macheha-b34292,"Фэнтези, Историческое фэнтези "
Аделаида Мендельштам,Цветок моей души,"Она идёт по дороге из драгоценностей, брошенных князем к её ногам. Хрустят осколки разбитых сердец под шелковыми туфельками, флер из ненависти, вожделения и завист...",https://rust.litnet.com/uploads/covers/120/1492525787_33.jpg,https://litnet.com/ru/book/macheha-b34292,"Фэнтези, Историческое фэнтези "
Олег Макеёнок,Носители. Легенда о Холодроге (расширенная версия),"О Нём слышали все северяне, а кто-то даже удостоился чести лицезреть Его... Однако, эти люди пропадали без вести, так что все рассказы про Него, лишь вымысел и легенда....",https://rust.litnet.com/uploads/covers/120/1477138359_.png,https://litnet.com/ru/book/macheha-b34292,"Фэнтези, Историческое фэнтези "
Gazero,Этюды Веков,"Оттенки Истории
Возможно пересечение эр...",https://rust.litnet.com/uploads/covers/120/1647431346_55.jpg,https://litnet.com/ru/book/macheha-b34292,"Фэнтези, Историческое фэнтези "
Любовь Юрцевич,Путешествие к Небесным Вратам,"Чжэнь провел отрочество в монастыре, но теперь ему пора отправляться дальше. Однако мир за стенами обители совсем не похож на мирную монастырскую жизнь....",https://rust.litnet.com/uploads/covers/120/1645629537_61.jpg,https://litnet.com/ru/book/macheha-b34292,"Фэнтези, Историческое фэнтези "
Веле Штылвелд,"Прощайте, товарищ Чернотроп или новая Гульсары",Это книжица о страшном для украинских киевских фантастов 1983 г. во всю работывала машина схлопывания советского инакомыслия... Фабрика промывки мозгов имени товари...,https://rust.litnet.com/uploads/covers/120/1645567007_97.jpg,https://litnet.com/ru/book/macheha-b34292,"Фэнтези, Историческое фэнтези "
Мак Роберт,Перегрин 2,"Здравствуйте ! Представляю Вашему вниманию новый цикл рассказов в стиле Кельтское Фэнтези с общим именем ""Перегрин"" /Peregrinus/  

Перегринами в Древнем Риме тазывали св...",https://rust.litnet.com/uploads/covers/120/1645127255_14.png,https://litnet.com/ru/book/macheha-b34292,"Фэнтези, Историческое фэнтези "
Ланиакея Эспи,Нимфа с мундштуком. И мертвые восстанут,"Илия должна была стать Шаманкой своего племени. Но в ночь перед посвящением девушка оказалась за пределами территории ее племени. Не знающая язык людей, живущих зд...",https://rust.litnet.com/uploads/covers/120/1643728919_89.jpg,https://litnet.com/ru/book/macheha-b34292,"Фэнтези, Историческое фэнтези "
Илья Объедков,Под звуки кифары,"От своего страха не убежать. Он настигнет тебя, расправив за спиной чёрные крылья. Античный триллер о монстрах мифических и настоящих....",https://rust.litnet.com/uploads/covers/120/1643578457_46.jpg,https://litnet.com/ru/book/macheha-b34292,"Фэнтези, Историческое фэнтези "
Мак Роберт,Перегрин 1,"Здравствуйте ! Представляю Вашему вниманию новый цикл рассказов в стиле Кельтское Фэнтези с общим именем ""Перегрин"" /Peregrinus/  

Перегринами в Древнем Риме тазывали св...",https://rust.litnet.com/uploads/covers/120/1642936664_12.png,https://litnet.com/ru/book/macheha-b34292,"Фэнтези, Историческое фэнтези "
Мак Роберт,Странник 9,"Здравствуйте ! Представляю Вашему вниманию серию рассказов в стиле Кельтское Фэнтези. Общая нить сюжета - определенные персонажи, которые имеют знания друидов. Эти...",https://rust.litnet.com/uploads/covers/120/1637520464_83.png,https://litnet.com/ru/book/macheha-b34292,"Фэнтези, Историческое фэнтези "
Изабель Сильвер,Леди Смерть,"В Лондон пришла чума, люди умирают целыми семьями. Отважная девушка, потерявшая практически всю семью от этой заразы. Вступает  в ряды чумных врачей, дабы помочь тем...",https://rust.litnet.com/uploads/covers/120/1682615130_80.jpg,https://litnet.com/ru/book/macheha-b34292,"Фэнтези, Историческое фэнтези "
Олег Татаренко,Сказка на ночь,"Рассказать Вам сказку? А может, быль, похожую на сказку?...",https://rust.litnet.com/uploads/covers/120/1635500265_49.jpg,https://litnet.com/ru/book/macheha-b34292,"Фэнтези, Историческое фэнтези "
Мак Роберт,Странник 7,"Здравствуйте ! Представляю Вашему вниманию серию рассказов в стиле Кельтское Фэнтези. Общая нить сюжета - определенные персонажи, которые имеют знания друидов. Эти...",https://rust.litnet.com/uploads/covers/120/1635404879_76.png,https://litnet.com/ru/book/macheha-b34292,"Фэнтези, Историческое фэнтези "
Мак Роберт,Странник 6,"Здравствуйте ! Представляю Вашему вниманию серию рассказов в стиле Кельтское Фэнтези. Общая нить сюжета - определенные персонажи, которые имеют знания друидов. Эти...",https://rust.litnet.com/uploads/covers/120/1635404896_32.png,https://litnet.com/ru/book/macheha-b34292,"Фэнтези, Историческое фэнтези "
Мак Роберт,Странник 5,"Здравствуйте ! Представляю Вашему вниманию серию рассказов в стиле Кельтское Фэнтези. Общая нить сюжета - определенные персонажи, которые имеют знания друидов. Эти...",https://rust.litnet.com/uploads/covers/120/1635404912_30.png,https://litnet.com/ru/book/macheha-b34292,"Фэнтези, Историческое фэнтези "
Мак Роберт,Странник 4,"Здравствуйте ! Представляю Вашему вниманию серию рассказов в стиле Кельтское Фэнтези. Общая нить сюжета - определенные персонажи, которые имеют знания друидов. Эти...",https://rust.litnet.com/uploads/covers/120/1635404927_93.png,https://litnet.com/ru/book/macheha-b34292,"Фэнтези, Историческое фэнтези "
Мак Роберт,Странник 3,"Здравствуйте ! Представляю Вашему вниманию серию рассказов в стиле Кельтское Фэнтези. Общая нить сюжета - определенные персонажи, которые имеют знания друидов. Эти...",https://rust.litnet.com/uploads/covers/120/1635404943_39.png,https://litnet.com/ru/book/macheha-b34292,"Фэнтези, Историческое фэнтези "
Мак Роберт,Странник 2,"Здравствуйте ! Представляю Вашему вниманию серию рассказов в стиле Кельтское Фэнтези. Общая нить сюжета - определенные персонажи, которые имеют знания друидов. Эти...",https://rust.litnet.com/uploads/covers/120/1635404959_20.png,https://litnet.com/ru/book/macheha-b34292,"Фэнтези, Историческое фэнтези "
Віталій Медвідь,Ежи и джинири,Новый взгляд на старую легенду...,https://rust.litnet.com/uploads/covers/120/1606993050_50.jpg,https://litnet.com/ru/book/ezhi-i-dzhiniri-b293437,"Фэнтези, Историческое фэнтези "
Budini,Тупоухая эльфа.,"Иногда, жизнь преподносит нам сюрпризы.
 А иногда не понятно, чудо было или это просто игра воображения....",https://rust.litnet.com/uploads/covers/120/1606058772_21.png,https://litnet.com/ru/book/ezhi-i-dzhiniri-b293437,"Фэнтези, Историческое фэнтези "
Ойдин,Бекки,"Невыносимо быть одной! Трудно, когда все мечты остаются неисполненными! Но что нужно делать, если уже нет никаких желаний, а душа требует покоя?!?!
Ярмарка тщеславия!...",https://rust.litnet.com/uploads/covers/120/1607687624_96.jpg,https://litnet.com/ru/book/ezhi-i-dzhiniri-b293437,"Фэнтези, Историческое фэнтези "
Береника Лито,Просто невероятная история,"Как сложно порой любить того, кому отдана. Как сложно удержаться от взгляда на другого. И все же...

...",https://rust.litnet.com/uploads/covers/120/1674615339_41.jpg,https://litnet.com/ru/book/ezhi-i-dzhiniri-b293437,"Фэнтези, Историческое фэнтези "
Morrigan Tales,Природа страха,"Как много в нашей жизни развилок, поворотных точек, после которых кардинально меняется судьба человека? После размолвки длинною в вечность двум университетским др...",https://rust.litnet.com/uploads/covers/120/1604669722_100.jpg,https://litnet.com/ru/book/ezhi-i-dzhiniri-b293437,"Фэнтези, Историческое фэнтези "
Киевский Словоруб,Звездочет,"История про нормальное такое королевство, нет, не про варваров где все решает сила. Здесь есть стражники, канцлер, наследник и даже и ученые. Например Звездочет, кот...",https://rust.litnet.com/uploads/covers/120/1604227044_57.jpg,https://litnet.com/ru/book/ezhi-i-dzhiniri-b293437,"Фэнтези, Историческое фэнтези "
OsaGo,Графиня,"Псевдоисторическая новелла с элементами мистики и фэнтези. 
Молодая аристократка после долгих дней вынужденного беспамятства приходит в себя и обнаруживает, что ...",https://rust.litnet.com/uploads/covers/120/1648379794_66.png,https://litnet.com/ru/book/ezhi-i-dzhiniri-b293437,"Фэнтези, Историческое фэнтези "
Maria Moretti,Винный погреб,"Дракула может не знать её имя, но за то вкус крови запомнит на несколько сотен лет. А ещё в замке есть винный погреб, вот только... граф не пьёт вина....",https://rust.litnet.com/uploads/covers/120/1601139518_71.jpg,https://litnet.com/ru/book/ezhi-i-dzhiniri-b293437,"Фэнтези, Историческое фэнтези "
Надежда Бер,Белый господин,"Лулу – дочь Вождя попадает в плен, и узнает новое слово «рабство». Она становится собственностью белого господина, и вынуждена жить в незнакомом и непонятном ей ми...",https://rust.litnet.com/uploads/covers/120/1598674927_85.jpg,https://litnet.com/ru/book/ezhi-i-dzhiniri-b293437,"Фэнтези, Историческое фэнтези "
  Татьяна Фёдорова,Перевёртыши. Часть 2. Эрим. Кан.,"Правила игры изменились, и ситуация стала еще хуже. Что еще можно сделать, чтобы оправдать доверие своего короля? Отправиться во Дворец, оборвав все связи с новыми д...",https://rust.litnet.com/uploads/covers/120/1703683598_66.png,https://litnet.com/ru/book/ezhi-i-dzhiniri-b293437,"Фэнтези, Историческое фэнтези "
  Татьяна Фёдорова,Перевёртыши. Часть 1. Эрим. Рас.,"Спасти свою страну от завоевания — чем не благородная миссия? А что делать, если ты вовсе не супергерой? Стараться. Заводить друзей, ошибаться, и снова пытаться. Даж...",https://rust.litnet.com/uploads/covers/120/1703683474_34.jpg,https://litnet.com/ru/book/ezhi-i-dzhiniri-b293437,"Фэнтези, Историческое фэнтези "
Дарья Кот,Игра в догонялки,"Детям очень нравится играть с взрослыми в такие игры: догонялки, прятки, салочки. Особенно, если им поддаются. Но когда игра принимает серьезные обороты, высокие ста...",https://rust.litnet.com/uploads/covers/120/1611671471_21.jpg,https://litnet.com/ru/book/ezhi-i-dzhiniri-b293437,"Фэнтези, Историческое фэнтези "
AnniLora,Акколада,"Великобритания. 1891 г. Время бурного прогресса, время благополучия и величия британской нации. Молодой джентльмен Артур Уэлдон, любитель древностей и искатель прик...",https://rust.litnet.com/uploads/covers/120/1593285407_32.jpg,https://litnet.com/ru/book/ezhi-i-dzhiniri-b293437,"Фэнтези, Историческое фэнтези "
Макар Пашкевич,Настоящие герои,"История о солдатах, история о войне, история о взгляде со стороны на всем известные события, история о памяти....",https://rust.litnet.com/uploads/covers/120/1591794736_39.png,https://litnet.com/ru/book/ezhi-i-dzhiniri-b293437,"Фэнтези, Историческое фэнтези "
