author,title,annotation,img_url,book_url,genre
Виктор Зорин,Чёрная королева,"В офисе фирмы обнаружен мёртвый начальник. 
Сперва все думают, что это - несчастный случай, но правда жестока - убийство.
Полицейский-интеллектуал со своми молодым ...",https://rust.litnet.com/uploads/covers/120/1510610786_96.jpg,https://litnet.com/ru/book/i-rassvet-uzhe-vstrechaya-vzroslymi-b150917,"Детективы, Классический детектив"
Starrik,Сыщик галактического масштаба,"Через много лет мир изменится. Межзвездные полеты, иные цивилизации, умопомрачительные технологии...
Вот только люди останутся людьми. Со своими страстями и порока...",https://rust.litnet.com/uploads/covers/120/1505198764_18.jpg,https://litnet.com/ru/book/i-rassvet-uzhe-vstrechaya-vzroslymi-b150917,"Детективы, Классический детектив"
Виктор Зорин,Сюрприз инспектора Дюпона,"У Луи Роже пропала жена, и полиция подозревает, что не без участия мужа.  
Инспектор Дюпон думает, что мёртвое тело Элен Роже пытались уничтожить, но правда гораздо н...",https://rust.litnet.com/uploads/covers/120/1501538415_32.jpg,https://litnet.com/ru/book/i-rassvet-uzhe-vstrechaya-vzroslymi-b150917,"Детективы, Классический детектив"
Ярослав Ян,Покажи мне бостонское небо,"Эта история уходит корнями в далекие 50-е годы, именно тогда Аннет Лоутон впервые встретила Эвана. Шли годы, их пути разошлись. Но осенью 1973 года девушка получает сра...",https://rust.litnet.com/uploads/covers/120/1486884004_67.jpg,https://litnet.com/ru/book/i-rassvet-uzhe-vstrechaya-vzroslymi-b150917,"Детективы, Классический детектив"
Маргарита Дорогожицкая,Опаленные злом,"Рассказ на конкурс ""Летний детектив-2016"". Первое место...",https://rust.litnet.com/uploads/covers/120/1472547462_.jpg,https://litnet.com/ru/book/i-rassvet-uzhe-vstrechaya-vzroslymi-b150917,"Детективы, Классический детектив"
Ольга Буйкова,Ч.Г.,"В компьютере уволившейся сотрудницы найден странный файл с детективом. Разобраться, имеет ли написанное хоть какое-то отношение к их конторе, пытаются молодые спе...",https://rust.litnet.com/uploads/covers/120/1470815259_.jpg,https://litnet.com/ru/book/i-rassvet-uzhe-vstrechaya-vzroslymi-b150917,"Детективы, Классический детектив"
Rart,Закат империи,"лойд — обычный школьник. Он учится, гуляет, общается с друзьями и верит в стабильность мира вокруг. Но однажды он узнаёт правду, которую не должен был знать. С этог...",https://rust.litnet.com/uploads/covers/120/1749931898_91.png,https://litnet.com/ru/book/i-rassvet-uzhe-vstrechaya-vzroslymi-b150917,"Детективы, Классический детектив"
babygirlqqq,с закатом яснее,"детектив тамара расследует серию загадочных убийств. всё указывает на нечто зловещее.
...",https://rust.litnet.com/common/img/empty_cover_litnet.png,https://litnet.com/ru/book/i-rassvet-uzhe-vstrechaya-vzroslymi-b150917,"Детективы, Классический детектив"
Inna Bers,Быть красивой — опасно,"В свои невинные десять я влюбился в прекрасную юную, взрослую девушку и только лишь мог быть свидетелем ее трагической судьбы
...",https://rust.litnet.com/uploads/covers/120/1748449006_40.png,https://litnet.com/ru/book/i-rassvet-uzhe-vstrechaya-vzroslymi-b150917,"Детективы, Классический детектив"
Луканин ,Равные,"Это первые две главы моего будущего романа, так что могут был логичкеские не состыковки....",https://rust.litnet.com/uploads/covers/120/1748279398_79.jpg,https://litnet.com/ru/book/i-rassvet-uzhe-vstrechaya-vzroslymi-b150917,"Детективы, Классический детектив"
Дариэла Грей ,Когда молчат свидетели,"В городе, где коррупция пустила глубокие корни, а страх сковал свидетелей, Анна, молодой следователь, решает бросить вызов системе. Вместе с опытным наставником Иго...",https://rust.litnet.com/uploads/covers/120/1747245199_15.png,https://litnet.com/ru/book/i-rassvet-uzhe-vstrechaya-vzroslymi-b150917,"Детективы, Классический детектив"
Лана Вишневская,Тайная ловушка: детективные рассказы,"Раскройте тайны сердца с помощью этой захватывающей коллекцией детективных историй, переплетенных со страстными любовными историями (18+).
Окунитесь в тени престу...",https://rust.litnet.com/uploads/covers/120/1691850480_81.png,https://litnet.com/ru/book/tainaya-lovushka-detektivnye-rasskazy-b439998,"Детективы, Классический детектив"
Марк ОК,Сьюзи,"В Коллинсвиле происходит убийство, и частный детектив Энди Аллен расследует дело. 
...",https://rust.litnet.com/uploads/covers/120/1684839016_52.png,https://litnet.com/ru/book/tainaya-lovushka-detektivnye-rasskazy-b439998,"Детективы, Классический детектив"
Марк ОК,3 марта,"Мэгги Холстер, молодая дизайнерша из Лос-Анджелеса, получает шокирующее известие о смерти своей подруги Эмили Картер. Узнав о связи между убийством Эмили и её руко...",https://rust.litnet.com/uploads/covers/120/1684838780_10.png,https://litnet.com/ru/book/tainaya-lovushka-detektivnye-rasskazy-b439998,"Детективы, Классический детектив"
Alisabet Argent,Бестолочи,"За вами когда-нибудь наблюдало небо? За мной - да. А ещё оно умеет смеяться и плакать навзрыд. И просто жить своей жизнью. Это Лондон, мой дорогой читатель. Над Лондоно...",https://rust.litnet.com/uploads/covers/120/1708100745_4.png,https://litnet.com/ru/book/tainaya-lovushka-detektivnye-rasskazy-b439998,"Детективы, Классический детектив"
Tiffany Lee,Лара Грин,"Лара Грин живет в сердце Австрии и раскрывает различные преступления. И она хочет доказать, что девушки со светлыми волосами могут быть детективом...",https://rust.litnet.com/uploads/covers/120/1682604898_75.png,https://litnet.com/ru/book/tainaya-lovushka-detektivnye-rasskazy-b439998,"Детективы, Классический детектив"
Елена Венская,Insegnima,"Книга первая. Часть первая.Мир на грани вселенской катастрофы. Человечество необратимо встало на путь самоистребления.Он – успешный детектив из Лос-Анджелеса, пыт...",https://rust.litnet.com/uploads/covers/120/1683579124_39.jpg,https://litnet.com/ru/book/tainaya-lovushka-detektivnye-rasskazy-b439998,"Детективы, Классический детектив"
Виктор Мардони,Защита Нимцовича,"Пятая книга про Ивана Ангелова, попаданца и детектива новосибирского сыскного бюро ""Варан"" Продолжение книг ""Обратный билет"", "" Чужая эпоха"", "" Венерин башмачок"" и "" По...",https://rust.litnet.com/uploads/covers/120/1679142521_4.jpg,https://litnet.com/ru/book/tainaya-lovushka-detektivnye-rasskazy-b439998,"Детективы, Классический детектив"
Гаан Лилия,"Кому Новый год, а кому...","РАССКАЗ ЗАНЯЛ 1 МЕСТО В КОНКУРСЕ ДЕТЕКТИВНОГО НОГО КЛУБА САМИЗДАТА ""РОЖДЕСТВЕНСКИЙ ДЕТЕКТИВ -2023""

Она зашла в цех и протиснулась между терриконами, дожидавшихся св...",https://rust.litnet.com/uploads/covers/120/1674246805_57.jpg,https://litnet.com/ru/book/tainaya-lovushka-detektivnye-rasskazy-b439998,"Детективы, Классический детектив"
Виктор Мардони,Последнее предсказание Волека,"Четвертая книга об Иване Ангелове по кличке Ангел. Продолжение книг ""Обратный билет"", ""Чужая эпоха"", ""Венерин башмачок"". Детектив новосибирского сыскного агенства ""...",https://rust.litnet.com/uploads/covers/120/1673769070_22.jpg,https://litnet.com/ru/book/tainaya-lovushka-detektivnye-rasskazy-b439998,"Детективы, Классический детектив"
Лола Алишеровна,Не иди за ним,"Мне тридцать два года, ни мужа ни детей, есть только своя ветеринарная клиника, квартира, машина. Бизнесвумен как ни как. Все же думаю что хочеться женского счастья. ...",https://rust.litnet.com/uploads/covers/120/1672692547_47.png,https://litnet.com/ru/book/tainaya-lovushka-detektivnye-rasskazy-b439998,"Детективы, Классический детектив"
Виктор Мардони,Венерин башачок,"Третья книга об Иване Ангелове, по кличке Ангел, бывшем бойце спецназа и попаданце. Продолжение книг ""Чужая эпоха"" и ""Обратный билет"". Сыщик частного бюро ""Варан"" расс...",https://rust.litnet.com/uploads/covers/120/1668483728_55.jpeg,https://litnet.com/ru/book/tainaya-lovushka-detektivnye-rasskazy-b439998,"Детективы, Классический детектив"
Татьяна Рябинина,Приют одинокого слона,"Каждый из шестерых друзей запутался в паутине лжи, подставив себя под удар того, кто давно перестал быть их другом. И все же они приняли его приглашение приехать в Ч...",https://rust.litnet.com/uploads/covers/120/1657200808_23.jpg,https://litnet.com/ru/book/tainaya-lovushka-detektivnye-rasskazy-b439998,"Детективы, Классический детектив"
Ксю Фельд,Милая старлетка,"Казалось бы, столь молодая девушка, а уже так успешна, и никаких забот. Но это только с первого взгляда. На самом деле, став актрисой, у неё появилась одна тайна, очень...",https://rust.litnet.com/uploads/covers/120/1648926133_23.jpg,https://litnet.com/ru/book/tainaya-lovushka-detektivnye-rasskazy-b439998,"Детективы, Классический детектив"
Гарцев,Неудачная рыбалка,Отдел Виктора был самым результативным в Управлении. Но пришла реорганизация......,https://rust.litnet.com/uploads/covers/120/1627805570_25.jpg,https://litnet.com/ru/book/tainaya-lovushka-detektivnye-rasskazy-b439998,"Детективы, Классический детектив"
Константин Бессмертник,Сказочник,"""Посадил дед репку, - бормотал Анатолий, орудуя лопатой и постоянно оглядываясь по сторонам, - выросла репка большая-пребольшая...""...",https://rust.litnet.com/uploads/covers/120/1627640108_66.jpg,https://litnet.com/ru/book/tainaya-lovushka-detektivnye-rasskazy-b439998,"Детективы, Классический детектив"
Alstory ,Письма из прошлого,"Читая мою книгу, ты сможешь окунуться в мир загадок и тайн. Вместе с главной героиней, ты будешь раскрывать преступления, разгадывая различные загадки....",https://rust.litnet.com/uploads/covers/120/1625294878_12.png,https://litnet.com/ru/book/tainaya-lovushka-detektivnye-rasskazy-b439998,"Детективы, Классический детектив"
Энн Митчелл,Убийство в Байбери.,В тихой английской деревушке происходит убийство добропорядочной жительницы и мецената миссис Пикок. Но так ли она была идеальна и примерна как казалась всем? Отв...,https://rust.litnet.com/uploads/covers/120/1622577657_68.png,https://litnet.com/ru/book/tainaya-lovushka-detektivnye-rasskazy-b439998,"Детективы, Классический детектив"
Рина Львович,Тридцать три несчастья,"Каждый из нас хотел бы встретить своего двойника. Можно меняться местами, устраивать розыгрыши. Чем и занимались время от времени Марго и Тони. Но взбалмошность одн...",https://rust.litnet.com/uploads/covers/120/1713791373_68.jpg,https://litnet.com/ru/book/tainaya-lovushka-detektivnye-rasskazy-b439998,"Детективы, Классический детектив"
Galinca,В поисках правды,"Константин Менин в годы распада СССР переезжает вместе с семьёй в Нью-Йорк. Будучи талантливым инженером, он быстро строит свою карьеру и вскоре попадает на работу ...",https://rust.litnet.com/uploads/covers/120/1612261272_21.png,https://litnet.com/ru/book/tainaya-lovushka-detektivnye-rasskazy-b439998,"Детективы, Классический детектив"
Вячеслав Соколов,Ответное танго,"Странная и жуткая история, произошедшая в глухом украинском селе в нынешнее время. Два связанных убийства, боль и месть....",https://rust.litnet.com/uploads/covers/120/1609842605_52.jpg,https://litnet.com/ru/book/tainaya-lovushka-detektivnye-rasskazy-b439998,"Детективы, Классический детектив"
Леся Белая,Совсем не идеальная жизнь,"В то время когда человек влюбляется в его душе происходит переворот, один из таких переворотов случился и у Евы. Наша героиня испытывала боль, унижение, её силы каза...",https://rust.litnet.com/uploads/covers/120/1584896896_6.jpg,https://litnet.com/ru/book/sovsem-ne-idealnaya-zhizn-b215752,"Детективы, Классический детектив"
Леся Белая,Пропавшая любовь,"Максим совершенно обычный работник вуза, но иногда и с обычными людьми происходят, необычные истории......",https://rust.litnet.com/uploads/covers/120/1584894068_97.jpg,https://litnet.com/ru/book/sovsem-ne-idealnaya-zhizn-b215752,"Детективы, Классический детектив"
Иннесса,Запутанное дело,"Похищения, произошедшие два года назад и в этот день, связаны между собой. Запутанное дело раскрывают детектив и его помощник....",https://rust.litnet.com/uploads/covers/120/1584865290_22.png,https://litnet.com/ru/book/sovsem-ne-idealnaya-zhizn-b215752,"Детективы, Классический детектив"
MaksF,1 убийство 6 подозреваемых,"В шикарном особняке, в элитном районе Москвы, должен состояться празднечный ужин. У пожилого олигарха родился внук, вчесть этого он устроил ужин, но вечером он так и...",https://rust.litnet.com/uploads/covers/120/1580647891_1.png,https://litnet.com/ru/book/sovsem-ne-idealnaya-zhizn-b215752,"Детективы, Классический детектив"
Со Летов,Фатальная любовь,"Повествование основано на реальных событиях, произошедших в конце 90-х годов в одном из украинских городов, где молодой журналист и стажёрка прокуратуры оказываютс...",https://rust.litnet.com/uploads/covers/120/1580634641_73.jpg,https://litnet.com/ru/book/sovsem-ne-idealnaya-zhizn-b215752,"Детективы, Классический детектив"
Триа Флэйт,Веришь в мистику - не шляйся по закрытой ярмарке,Когда тебя посреди ночи вызывают искать пропавшего на ярмарке журналиста - это часть работы детектива. Когда на этой ярмарке за тобой начинает гоняться ожившая кук...,https://rust.litnet.com/uploads/covers/120/1576839595_17.png,https://litnet.com/ru/book/sovsem-ne-idealnaya-zhizn-b215752,"Детективы, Классический детектив"
Фим Юлия,Дважды за день,"Великолепная Оксана помогает своей коллеге расследовать одно убийство в театре. И у нее великолепно получается.

Это небольшая зарисовка (хоть и полноценная), кот...",https://rust.litnet.com/uploads/covers/120/1576705279_3.jpg,https://litnet.com/ru/book/sovsem-ne-idealnaya-zhizn-b215752,"Детективы, Классический детектив"
Оливия Лаутен,Утонуть в твоих глазах,"Что заставляет изменить жизнь на ДО и ПОСЛЕ?
Этим вопросом задавалась и Милия-22-летняя студентка.Но теперь она точно знает ответ на этот вопрос.ОН.Владелец крупног...",https://rust.litnet.com/uploads/covers/120/1580844898_45.png,https://litnet.com/ru/book/sovsem-ne-idealnaya-zhizn-b215752,"Детективы, Классический детектив"
Людмила Зурбаган,Вечный шах,"Фанфик по сериалу Шерлок ББС. 
Вечный шах — ситуация, в которой одна из сторон (как правило, сильнейшая) не может избежать серии повторяющихся шахов. Партия при этом...",https://rust.litnet.com/uploads/covers/120/1571577524_44.jpg,https://litnet.com/ru/book/sovsem-ne-idealnaya-zhizn-b215752,"Детективы, Классический детектив"
Дмитрий Шадрин,"""Правдоведение""","В обычной российской школе появляется новый предмет ""Правдоведение"". На этих уроках учеников учат отделять правду от лжи. Кто знал, что такое благородное дело могло...",https://rust.litnet.com/uploads/covers/120/1570443097_76.jpg,https://litnet.com/ru/book/sovsem-ne-idealnaya-zhizn-b215752,"Детективы, Классический детектив"
Ирина Соляная,Бабочка-убийца,"Милая, но запутанная детективная история, где ребенок нанимает детектива для того, чтобы расследовать убийство матери. Но может ли бабочка убить?...",https://rust.litnet.com/uploads/covers/120/1569262482_49.jpg,https://litnet.com/ru/book/sovsem-ne-idealnaya-zhizn-b215752,"Детективы, Классический детектив"
Крися,Пятница 13-е,"В обычный летний день в коттеджном городке «Шарм» произошло загадочное исчезновение. Елена бежит к своей подруге Татьяне за помощью, а Татьяна не может отказать по...",https://rust.litnet.com/uploads/covers/120/1576389829_21.jpg,https://litnet.com/ru/book/sovsem-ne-idealnaya-zhizn-b215752,"Детективы, Классический детектив"
D-Rozd,Анти-Б. Выпуск-25. Кесарево,Да воздастся по заслугам каждому......,https://rust.litnet.com/uploads/covers/120/1568395645_14.jpg,https://litnet.com/ru/book/sovsem-ne-idealnaya-zhizn-b215752,"Детективы, Классический детектив"
Cos,Выстрелы в готеле Джон,"Тед Малверн любил дождливую погоду; любил шелест дождя, его запах, его вкус на губах. Выйдя из своего двухместного «Ласаль», он постоял немного возле бокового входа ...",https://rust.litnet.com/uploads/covers/120/1566637398_18.jpg,https://litnet.com/ru/book/sovsem-ne-idealnaya-zhizn-b215752,"Детективы, Классический детектив"
Евгений Котов,История одного вагона,"В один из вагонов поезда заходит человек с окровавленной головой, хорошо что неподалеку находится врач. Пострадавшему оказывают помощь, и тогда он невнятно произн...",https://rust.litnet.com/uploads/covers/120/1564922454_96.jpg,https://litnet.com/ru/book/sovsem-ne-idealnaya-zhizn-b215752,"Детективы, Классический детектив"
Тихий,Стив Шоунли. Дело об украденном ожерелье.,"Главный герой, частный детектив по имени Стив Шоунли со своей сестрой Анной начинают расследовать дело о краже фамильного ожерелья семьи Лоуренс. Стив с Анной начи...",https://rust.litnet.com/uploads/covers/120/1563336456_69.jpg,https://litnet.com/ru/book/sovsem-ne-idealnaya-zhizn-b215752,"Детективы, Классический детектив"
Александир Азавак,Новый поворот,В Париже годовщина революции и каждый  по своему отмечает ее.  Кто дома поминая погибших кто в резиденции короля обмывая очередную награду словом кто где а Жавер в ...,https://rust.litnet.com/uploads/covers/120/1557575942_85.jpg,https://litnet.com/ru/book/sovsem-ne-idealnaya-zhizn-b215752,"Детективы, Классический детектив"
Dogtor,Отказавшийся от имени,"Способны ли вы отказаться от своего имени? 
Способны ли вы принять тот факт что вы виновны в чьей то смерти? 
Смогли бы достойно принять свою участь? 
Смогли бы отка...",https://rust.litnet.com/uploads/covers/120/1570731548_43.jpg,https://litnet.com/ru/book/sovsem-ne-idealnaya-zhizn-b215752,"Детективы, Классический детектив"
