author,title,annotation,img_url,book_url,genre
Петров-Одинец,Чемодан бриллиантов,"Ограбление банка исполнено с выдумкой. Сумма похищенного такова, что дело поручают важняку из столицы. Но местный следователь самостоятельно приходит к выводу, чт...",https://rust.litnet.com/common/img/empty_cover_litnet.png,https://litnet.com/ru/book/sovsem-ne-idealnaya-zhizn-b215752,"Детективы, Классический детектив"
Sabrina Loveless,Кровать миссис Маккинли,"Иногда смерть поджидает нас в самых необычных местах, а зло настолько коварно, что даже может показаться безобидным на первый взгляд. 

""Кровать миссис МакКинли"" эт...",https://rust.litnet.com/uploads/covers/120/1548444874_3.png,https://litnet.com/ru/book/sovsem-ne-idealnaya-zhizn-b215752,"Детективы, Классический детектив"
Кристина Выборнова (Аделя Хильман),На слуху,"У капитана Колина Розанова - полоса неудач. Дети отвлекают от работы дурацкими просьбами, жена - обидами, а ценный осведомитель чуть не отдает богу душу из-за его, Ко...",https://rust.litnet.com/uploads/covers/120/1506948668_14.jpg,https://litnet.com/ru/book/na-sluhu-b44632,"Детективы, Классический детектив"
Ева Андреа,Бригитта,"К известному психотерапевту Антону Богданцову на приём приходит странный мужчина. Он убежден, что в его жену вселилась дьявольская сила. Доктор старается убедить ...",https://rust.litnet.com/uploads/covers/120/1506346930_95.jpg,https://litnet.com/ru/book/na-sluhu-b44632,"Детективы, Классический детектив"
Екатерина Соллъх,Убийство в закрытой книге,"Встреча бывших одноклассников могла бы стать сущей пыткой для молодого частного детектива Джейка, если бы не то, что встретиться они должны были в загородном доме ...",https://rust.litnet.com/common/img/empty_cover_litnet.png,https://litnet.com/ru/book/na-sluhu-b44632,"Детективы, Классический детектив"
Таня Пламенная,Кто убил попугая?,чисто английское расследование ))...,https://rust.litnet.com/uploads/covers/120/1494530216_94.jpg,https://litnet.com/ru/book/na-sluhu-b44632,"Детективы, Классический детектив"
Олеся Перепелица,Луизиана для Тима,"Бог не любил Луизиану. Тим был с ним солидарен, но уехать не мог...",https://rust.litnet.com/uploads/covers/120/1494376551_58.jpg,https://litnet.com/ru/book/na-sluhu-b44632,"Детективы, Классический детектив"
Мария Рэд,Вместо холодной мести,Почему месть должна быть именно холодной?Раскаленная добела тоже смотрится неплохо......,https://rust.litnet.com/uploads/covers/120/1491738283_13.jpg,https://litnet.com/ru/book/na-sluhu-b44632,"Детективы, Классический детектив"
Петров-Одинец,Без Машиаха и труб Мафусаила,"Спасаясь от оружия массового поражения, шахтёр уводит семью в заброшенную штольню. Надежда пересидеть опасное время под толщей земли и потом вернуться в город - ст...",https://rust.litnet.com/common/img/empty_cover_litnet.png,https://litnet.com/ru/book/na-sluhu-b44632,"Детективы, Классический детектив"
Dzura,"Тридцать шесть часов, изменившие...",Наемный убийца и свидетель. Как случай повлияет  на их жизнь? Что изменится в каждом за тридцать шесть часов?...,https://rust.litnet.com/uploads/covers/120/1479381364_.jpg,https://litnet.com/ru/book/na-sluhu-b44632,"Детективы, Классический детектив"
Лана Кирр,Летний хит,Классический деревенский детектив. ...,https://rust.litnet.com/common/img/empty_cover_litnet.png,https://litnet.com/ru/book/na-sluhu-b44632,"Детективы, Классический детектив"
Лана Кирр,Пёрышко,"Иногда красота, созданная природой, гораздо красноречивее экспертов-криминалистов.  ...",https://rust.litnet.com/uploads/covers/120/1485856581_37.jpg,https://litnet.com/ru/book/na-sluhu-b44632,"Детективы, Классический детектив"
Рудный Кот,Noir,"Капли дождя отбивали ритм по черепицам крыш этого серого города. Ветер, словно безумный музыкант, играл симфонию труб и водостоков, заставляя плотнее кутаться в дл...",https://rust.litnet.com/uploads/covers/120/1464172013_.jpg,https://litnet.com/ru/book/na-sluhu-b44632,"Детективы, Классический детектив"
Алесана Снежная,"Дом там, где сердце","Вероника, узнав, что ее любимый мужчина убийца и сумасшедший, проводит собственное расследование. Открывая новые факты о нем, она сталкивается с множеством странно...",https://rust.litnet.com/uploads/covers/120/1546450512_64.jpg,https://litnet.com/ru/book/dom-tam-gde-serdce-b112072,"Детективы, Классический детектив"
Елена_1107,Сеть Ариадны,"Никто из родных и знакомых не удивился сильно, когда миссис Далия Фостер скончалась от сердечного приступа у себя дома в возрасте пятидесяти восьми лет. Но её медиу...",https://rust.litnet.com/uploads/covers/120/1545767923_27.jpg,https://litnet.com/ru/book/dom-tam-gde-serdce-b112072,"Детективы, Классический детектив"
NatAlien91,Секреты Долголетия,"Генеральный директор крупного петербургского завода, специализирующегося на выпуске йогуртов с бифидобактериями и экологически чистых продуктов под брендом &laquo...",https://rust.litnet.com/uploads/covers/120/1737008227_70.jpeg,https://litnet.com/ru/book/dom-tam-gde-serdce-b112072,"Детективы, Классический детектив"
Измайлов В.,Натюрморт с револьвером и человеческим черепом.,Викторианская Англия. Лондон накануне открытия всемирной промышленной выставки. Доктор-антрополог везет из Эдинбурга свою знаменитую коллекцию древних артефакт...,https://rust.litnet.com/uploads/covers/120/1545515188_54.jpg,https://litnet.com/ru/book/dom-tam-gde-serdce-b112072,"Детективы, Классический детектив"
Михаил Краснопевцев,Сырость,"Короткий рассказ о том, что может ждать в самый обыкновенный, дождливый день. 
...",https://rust.litnet.com/uploads/covers/120/1542291040_44.jpg,https://litnet.com/ru/book/dom-tam-gde-serdce-b112072,"Детективы, Классический детектив"
Крися,"Поместье ""Уитинхорд""","Викторианская эпоха. Привидения, убийства, привычные чаепития в пять часов.
Женская интуиция мисс Рейли и мужская логика инспектора Списа объединяются, чтобы раск...",https://rust.litnet.com/uploads/covers/120/1540054736_57.jpg,https://litnet.com/ru/book/dom-tam-gde-serdce-b112072,"Детективы, Классический детектив"
Розалия Цех,Вересковые пустоши,"Действия происходят в 1845 году в Западном Йоркшире в деревушке Хаворт. В дом приходского священника приезжает в гости молодая девушка Мэри, подруга Шарлотты Бронте....",https://rust.litnet.com/uploads/covers/120/1539756382_72.jpg,https://litnet.com/ru/book/dom-tam-gde-serdce-b112072,"Детективы, Классический детектив"
Странник,Тайна дома мистера Данфола,"В Лондоне, в 1839-м году, в сентябре, в дождливый осенний вечер, в кабинет детектива Карла Оуна, заходит пожилой мужчина низкого роста и сообщает о том, что некая семья ...",https://rust.litnet.com/uploads/covers/120/1539648307_2.jpg,https://litnet.com/ru/book/dom-tam-gde-serdce-b112072,"Детективы, Классический детектив"
Encanto9,Я тебя найду,В центре сюжета находится молодая девушка Кейси Дикинсон.  После окончания академии F.B.I в городе  Куантико в штате Вирджиния за отличное обучение и невероятные спо...,https://rust.litnet.com/uploads/covers/120/1538841714_71.jpg,https://litnet.com/ru/book/dom-tam-gde-serdce-b112072,"Детективы, Классический детектив"
Константин Погодаев,Убийство на Эбби-роуд,"Всемирная выставка 1851 года продемонстрировала мировой технологический прогресс, но вместе с тем, инспекторам Скотланд-Ярда приходится проводить расследование по...",https://rust.litnet.com/uploads/covers/120/1538633687_49.png,https://litnet.com/ru/book/dom-tam-gde-serdce-b112072,"Детективы, Классический детектив"
Макс Белградов,Лестница монаха. Ступень 5,"Посвящается тем, кто готов подняться до самого конца....",https://rust.litnet.com/uploads/covers/120/1531948883_53.jpg,https://litnet.com/ru/book/dom-tam-gde-serdce-b112072,"Детективы, Классический детектив"
Макс Белградов,Лестница монаха. Ступень 4,"Посвящается тем, кто готов подняться до самого конца....",https://rust.litnet.com/uploads/covers/120/1531948872_72.jpg,https://litnet.com/ru/book/dom-tam-gde-serdce-b112072,"Детективы, Классический детектив"
Макс Белградов,Лестница монаха. Ступень 3,"Посвящается тем, кто готов подняться до самого конца....",https://rust.litnet.com/uploads/covers/120/1531948861_17.jpg,https://litnet.com/ru/book/dom-tam-gde-serdce-b112072,"Детективы, Классический детектив"
Макс Белградов,Лестница монаха. Ступень 2,"Посвящается тем, кто готов подняться до самого конца....",https://rust.litnet.com/uploads/covers/120/1531948848_11.jpg,https://litnet.com/ru/book/dom-tam-gde-serdce-b112072,"Детективы, Классический детектив"
Алиса Кин,Экзамен,Для каждого выпускника будет практический экзамен. Вы сможете почувствовать себя Шерлоком Холмсом. Необходимо включить свои дедуктивные способности и прислушива...,https://rust.litnet.com/uploads/covers/120/1528567738_7.png,https://litnet.com/ru/book/dom-tam-gde-serdce-b112072,"Детективы, Классический детектив"
Алина Кошкина,Семейные ценности,"Что такое семья? Это любящие друг друга люди. Это место, где мы находим поддержку и черпаем радость и силы для жизни...
Но что, если это совсем не так? 
Для шестнадцати...",https://rust.litnet.com/uploads/covers/120/1534203579_65.jpg,https://litnet.com/ru/book/dom-tam-gde-serdce-b112072,"Детективы, Классический детектив"
Петров-Одинец,На ком пресекается род,"Потеряв сына и сестру, оставшись бесплодным, и все это вследствие наезда глиссера на его лодку, герой теряет смысл жизни. Но завещание его покойной сестры, которое п...",https://rust.litnet.com/common/img/empty_cover_litnet.png,https://litnet.com/ru/book/dom-tam-gde-serdce-b112072,"Детективы, Классический детектив"
Маргарита Дорогожицкая,Аромат пустыни,"Ирис - самый загадочный цветок, который может цвести... даже в пустыне....",https://rust.litnet.com/uploads/covers/120/1519884268_90.png,https://litnet.com/ru/book/dom-tam-gde-serdce-b112072,"Детективы, Классический детектив"
Ольга Дальняя,Ирония судьбы,"Тёплым летним вечером кучка детей безмятежно играет во дворе. И вдруг маленькая девочка кричит и показывает на что-то, летящее сверху......",https://rust.litnet.com/uploads/covers/120/1515861211_29.jpg,https://litnet.com/ru/book/dom-tam-gde-serdce-b112072,"Детективы, Классический детектив"
Ная Сергеева,Слёзы Салации,"Загадочное убийство политика за закрытой дверью - лакомый кусочек для детектива-консультанта. Ни правила приличия, ни угроза жизни, ни отсутствие зацепок - ничто не...",https://rust.litnet.com/uploads/covers/120/1513978836_7.jpg,https://litnet.com/ru/book/dom-tam-gde-serdce-b112072,"Детективы, Классический детектив"
Ева Герд,Снова не я,"Их дружба началась еще со школьной скамьи. Он был первым красавцем в классе, а она - книжным червем, который проводила все свое свободное время в библиотеке. Но, несм...",https://rust.litnet.com/uploads/covers/120/1709401188_47.jpg,https://litnet.com/ru/book/snova-ne-ya-b471837,"Детективы, Классический детектив"
Татьяна Полунина,Дорога к себе.,"Когда понимаешь, что все, чем ты жил много лет разрушено, и ты уже давно не девочка. Когда кажется, что ничего хорошего в жизни больше не будет.. Возьми паузу. Жизнь по...",https://rust.litnet.com/uploads/covers/120/1707673401_25.png,https://litnet.com/ru/book/snova-ne-ya-b471837,"Детективы, Классический детектив"
Каришка,Secret of the Forest,"Девочка Эмили приезжает на летние каникулы к бабушке в деревню ,в которой не была с раннего детства. Через несколько дней она узнает, что тут происходит что то стран...",https://rust.litnet.com/uploads/covers/120/1707239863_91.jpg,https://litnet.com/ru/book/snova-ne-ya-b471837,"Детективы, Классический детектив"
Розалина Будаковская,Череп под раковиной,"Рождество - самое ненавистное время для Габриэля Стоуна. Каждый год Габриэль покидает Лондон, чтобы развеяться и забыть о существовании нелюбимого праздника. Погр...",https://rust.litnet.com/uploads/covers/120/1706895396_4.jpg,https://litnet.com/ru/book/snova-ne-ya-b471837,"Детективы, Классический детектив"
Ольга Трунова,Тень на камне,"Книга повествует о набатеях, древнем народе, о таинственном исчезновении которого с исторической арены до сих пор идут споры. Столицей Набатейского царства была П...",https://rust.litnet.com/uploads/covers/120/1705398745_59.jpg,https://litnet.com/ru/book/snova-ne-ya-b471837,"Детективы, Классический детектив"
Николай Хрипков (Копа),Ватще рвалась душа моя,"Герой убивает своего однокурсница, чтобы отомстить ему за свою возлюбленную.....",https://rust.litnet.com/uploads/covers/120/1704795498_88.jpg,https://litnet.com/ru/book/snova-ne-ya-b471837,"Детективы, Классический детектив"
Анна Луна,Инопланетянин,"Обходя территорию леса, лесничий находит обнаженный труп. Прибывшая на место следственная группа видит странную картину: в сугробе лежит молодой обнаженный мужчи...",https://rust.litnet.com/uploads/covers/120/1703502278_16.jpg,https://litnet.com/ru/book/snova-ne-ya-b471837,"Детективы, Классический детектив"
Розалина Будаковская,Туманные поля,"Две недели в доме отдыха Эббс-Холл для Марты Порай должны были стать временем, чтобы полностью избавиться от депрессии и вернуться к обычной жизни. Такой подарок по...",https://rust.litnet.com/uploads/covers/120/1702919831_84.jpg,https://litnet.com/ru/book/snova-ne-ya-b471837,"Детективы, Классический детектив"
Maria Гладыш,Дрянь,"Как быть, если мать отрывает от привычной школы, друзей и увозит в сомнительную деревню на исправление, где тебе предстоит учиться в старом монастыре с привидениям...",https://rust.litnet.com/uploads/covers/120/1702835652_3.jpg,https://litnet.com/ru/book/snova-ne-ya-b471837,"Детективы, Классический детектив"
Олег Фомин,По расписанию,"Поход в театр завершился для Виктора Сергеевича и его супруги Татьяны ограблением их квартиры. Однако за банальной, на первый взгляд, кражей кроется нечто более пр...",https://rust.litnet.com/uploads/covers/120/1702398646_31.jpeg,https://litnet.com/ru/book/snova-ne-ya-b471837,"Детективы, Классический детектив"
Олег Фомин,По кусочкам,"Нет ничего больнее, чем терять то, что создавал, растил изо дня в день долгое время, собирал по кусочкам... Преподавателю института Виктору Сергеевичу пришлось узнат...",https://rust.litnet.com/uploads/covers/120/1702397339_71.jpg,https://litnet.com/ru/book/snova-ne-ya-b471837,"Детективы, Классический детектив"
Наталья Явленская,Смерть на маяке,"Действие детективного рассказа происходит на маленьком острове, затерянном в Северном море. На маяк прибывают двое молодых людей, подозреваемых полицией в загадо...",https://rust.litnet.com/uploads/covers/120/1702319629_61.jpg,https://litnet.com/ru/book/snova-ne-ya-b471837,"Детективы, Классический детектив"
Виктор Мардони,Поместье теней,"Эмилия Мартин, является талантливым репортером одной из ведущих газет Лондона. Однако, ее репутация как женщины, способной расследовать даже самые загадочные собы...",https://rust.litnet.com/uploads/covers/120/1699956935_32.png,https://litnet.com/ru/book/snova-ne-ya-b471837,"Детективы, Классический детектив"
Борис Викторович Сударушкин,"Не уходи, Жасинта",Эта детективная история началась с убийства и переросла в опасное путешествие в южные страны с целью преследования подозреваемой. Но когда следователями являются...,https://rust.litnet.com/uploads/covers/120/1699872730_13.jpg,https://litnet.com/ru/book/snova-ne-ya-b471837,"Детективы, Классический детектив"
Борис Викторович Сударушкин,Африка для Яны,"Остросюжетный детектив и мистический триллер в этой книге развиваются на фоне особых отношений между молодым следователем-оперативником и юной россиянкой, оказа...",https://rust.litnet.com/uploads/covers/120/1699551260_40.jpg,https://litnet.com/ru/book/snova-ne-ya-b471837,"Детективы, Классический детектив"
Александр Семс,Озорная шпионка,Юная шпионка Маша должна найти Неизвестного. Его мотивы не понятный никому. Ей остается полагаться только на себя...,https://rust.litnet.com/uploads/covers/120/1698674670_48.jpg,https://litnet.com/ru/book/snova-ne-ya-b471837,"Детективы, Классический детектив"
Виктория Стальная,Учитель в законе,"Съёмная квартира окутала Нину туманом до боли знакомого неприятного сигаретного дыма, что не сулило ничего хорошего и говорило о повышенной нервозности Денисова, ...",https://rust.litnet.com/uploads/covers/120/1697612520_73.jpg,https://litnet.com/ru/book/snova-ne-ya-b471837,"Детективы, Классический детектив"
Гаан Лилия,У самого синего моря,"Надо сказать, что этот отдых у моря оказался для Тамары одним из самых лучших в жизни, хотя и был несколько омрачен убийством одной из курортниц.
Впрочем, обо всем по...",https://rust.litnet.com/uploads/covers/120/1691927049_53.jpg,https://litnet.com/ru/book/snova-ne-ya-b471837,"Детективы, Классический детектив"
Олег Шейн,Охота на единорога,"Настали ужасные времена для обычной деревушки, на окраине королевства. Из-за бушующей войны и долгой зимы, охотникам пришлось переступить через принципы и объявит...",https://rust.litnet.com/uploads/covers/120/1690619247_43.png,https://litnet.com/ru/book/snova-ne-ya-b471837,"Детективы, Классический детектив"
